lemma	pos	date	grouping	identifier	description	context	indexes_target_token	indexes_target_sentence
fidelis	JJ	[-100,0]	1	2_50	 	ad necem Platoris Pleuratus eius comes, quem necasti Veribus summa senectute confectum. Idemque tu Rabocentum, Bessicae gentis principem, cum te trecentis talentis regi Cotyi vendidisses, securi percussisti, cum ille ad te legatus in castra venisset et tibi magna praesidia et auxilia a Bessis peditum equitumque polliceretur, neque eum solum sed etiam ceteros legatos qui simul venerant; quorum omnium capita regi Cotyi vendidisti. Denseletis, quae natio semper oboediens huic imperio etiam in illa omnium barbarorum defectione Macedoniam C. Sentio praetore tutata est, nefarium bellum et crudele intulisti, eisque cum fidelissimis sociis uti posses, hostibus uti acerrimis maluisti. Ita perpetuos defensores Macedoniae vexatores ac praedatores effecisti; vectigalia nostra perturbarunt, urbes ceperunt, vastarunt agros, socios nostros in servitutem abduxerunt, familias abripuerunt, pecus abegerunt, Thessalonicensis, cum de oppido desperassent, munire arcem coegerunt. </section><section> A te Iovis Vrii fanum antiquissimum barbarorum sanctissimumque direptum est. Tua scelera di immortales in nostros milites expiaverunt; qui cum novo genere morbi adfligerentur neque se recreare quisquam posset, qui semel incidisset, dubitabat nemo quin violati hospites, legati necati, pacati atque socii nefario	620:632	0:1304
fidelis	JJ	[-300,0]	1	2_51	 	aetatis uideor? Accherunticus, </line><line> senex uetus, decrepitus. Peruorse uides. </line><line> Puer sum, Lysimache, septuennis. Sanun es </line><line> qui puerum te esse dicas? Vera praedico. </line><line> Modo hercle in mentem uenit quid tu diceres: </line><line> senex quom extemplo est, iam nec sentit nec sapit, </line><line> aiunt solere eum rusum repuerascere. </line><line> Immo bis tanto ualeo quam ualui prius. </line><line> Bene hercle factum et gaudeo. Immo si scias, </line><line> oculeis quoque etiam plus iam uideo quam prius. </line><line> Benest. Malae rei deico. Iam istuc non benest. </line><line> Sed aussimne ego tibi eloqui fideliter? </line><line> Audacter. Animum aduorte. Fiet sedulo. </line><line> Hodie eire occepi in ludum litterarium, </line><line> Lysimache. Ternas scio iam. Quid ternas? Amo. </line><line> Tun capite cano amas, senex nequissume? </line><line> Si canum seu istuc rutilumst siue atrumst, amo. </line><line> Ludificas nunc tu me heic, opinor, Demipho. </line><line> decide collum stanti si falsum loquor; </line><line> uel, ut scias me amare, cape cultrum, seca </line><line> digitum uel aurem uel tu nassum uel labrum: </line><line> sei mouero me seu secari sensero, </line><line> Lysimache, auctor sum ut med amando enices. </line><line> Si umquam	650:659	0:1300
fidelis	JJ	[-300,0]	1	2_52	 	ago adsequitur, subest, supsequitur, </line><line> ita gaudiis gaudium suppeditat. </line><line> Modo me Stasimus Lesbonici seruos conuenit domi; </line><line> is mihi dixit suom erum peregre huc aduenisse Charmidem. </line><line> Nunc mi is propere conueniundust, ut quae cum eius filio </line><line> egi, ei rei fundus pater sit potior. Eo. Sed fores </line><line> hae sonitu suo mihi moram obiciunt incommode. </line><line> Neque fuit neque erit neque esse quemquam hominem in terra arbitror </line><line> quoi fides fidelitasque amicum erga aequiperet tuam; </line><line> nam exaedificauisset me ex his aedibus, apsque te foret. </line><line> Si quid amicum erga bene feci aut consului fideliter, </line><line> non uideor meruisse laudem, culpa caruisse arbitror. </line><line> Nam beneficium, homini proprium quod datur, prosum perit, </line><line> quod datum utendumst, id repetundi copiast quando uelit. </line><line> Est ita ut tu dicis. Sed ego hoc nequeo mirari satis, </line><line> eum sororem despondisse suam in tam fortem familiam. </line><line> Lysiteli quidem Philtonis filio. Enim me nominat. </line><line> Familiam optumam occupauit. Quid ego cesso hos conloqui? </line><line> Sed maneam etiam opinor, namque hoc commodum orditur loqui. </line><line> Vah! Quid est? Oblitus intus dudum tibi sum dicere: </line><line> modo mi aduenienti nugator quidam	690:699	0:1369
fidelis	JJ	[-100,0]	1	2_53	 	alia est re magis utilis. Idcirco amicitiae comparantur ut commune commodum mutuis officiis gubernetur. Quid recipis mandatum, si aut neglecturus aut ad tuum commodum conversurus es? cur mihi te offers ac meis commodis officio simulato officis et obstas? Recede de medio; per alium transigam. Suscipis onus offici quod te putas sustinere posse; quod maxime videtur grave eis qui minime ipsi leves sunt. </section><section> Ergo idcirco turpis haec culpa est, quod duas res sanctissimas violat, amicitiam et fidem. Nam neque mandat quisquam fere nisi amico neque credit nisi ei quem fidelem putat. Perditissimi est igitur hominis simul et amicitiam dissolvere et fallere eum qui laesus non esset, nisi credidisset. Itane est? in minimis rebus qui mandatum neglexerit, turpissimo iudicio condemnetur necesse est, in re tanta cum is cui fama mortui, fortunae vivi commendatae sunt atque concreditae, ignominia mortuum, inopia vivum adfecerit, is inter honestos homines atque adeo inter vivos numerabitur? In mmimis privatisque rebus etiam neglegentia in crimen mandati iudiciumque infamiae vocatur, propterea quod, si recte fiat, illum neglegere oporteat qui mandarit non illum qui mandatum receperit	582:589	0:1198
fidelis	JJ	[-100,0]	1	2_54	 	amicis, rei familiari. Valerius cotidie cantabat; erat enim scaenicus: quid faceret aliud? At Numerius Furius, noster familiaris, cum est commodum, cantat; est enim paterfamilias, est eques Romanus; puer didicit quod discendum fuit. Eadem ratio est harum artium maximarum; dies et noctis virum summa virtute et prudentia videbamus, philosopho cum operam daret, Q. Tuberonem; at eius avunculum vix intellegeres id agere, cum ageret tamen, Africanum. Ista discuntur facile? si et tantum sumas, quantum opus sit, et habeas qui docere fideliter possit et scias etiam ipse discere; sed si tota vita nihil velis aliud agere, ipsa tractatio et quaestio cotidie ex se gignit aliquid, quod cum desidiosa delectatione vestiges. Ita fit, ut agitatio rerum sit infinita, cognitio facilis, si usus doctrinam confirmet, mediocris opera tribuatur, memoria studiumque permaneat. Libet autem semper discere; ut si velim ego talis optime ludere aut pilae studio tenear, etiam fortasse, si adsequi non possim; at alii, quia praeclare faciunt, vehementius, quam causa postulat, delectantur, ut Titius pila	531:540	0:1086
fidelis	JJ	[-100,0]	1	2_55	 	amotae rei usquam nec oblatae ad tempus vestigium ullum erat sed ita omnia constanti tranquilla pace ut eo vix fama belli perlata videri posset. Victus igitur patientia hostium senatum eorum vocari iussit.'' soli adhuc'' inquit,'' Tusculani, vera arma verasque vires quibus ab ira Romanorum vestra tutaremini invenistis. ite Romam ad senatum; aestimabunt patres utrum plus ante poenae an nunc veniae meriti sitis. non praecipiam gratiam publici beneficii; deprecandi potestatem a me habueritis; precibus eventum vestris senatus quem videbitur dabit.'' postquam Romam Tusculani venerunt senatusque paulo ante fidelium sociorum maestus in vestibulo curiae est conspectus, moti extemplo patres vocari eos iam tum hospitaliter magis quam hostiliter iussere. dictator Tusculanus ita verba fecit:'' quibus bellum indixistis intulistisque, patres conscripti, sicut nunc videtis nos stantes in vestibulo curiae vestrae, ita armati paratique obviam imperatoribus legionibusque vestris processimus. hic noster, hic plebis nostrae habitus fuit eritque semper, nisi si quando a vobis proque vobis arma acceperimus. gratias agimus et ducibus vestris et exercitibus, quod oculis magis quam auribus crediderunt et ubi nihil hostile erat ne ipsi quidem fecerunt.	608:616	0:1247
fidelis	JJ	[-100,0]	1	2_56	 	Annos iam xxx in foro versaris, sed tamen in Pergameno. Longo intervallo, si quando tibi peregrinari commodum est, Romam venis, adfers faciem novam, nomen vetus, purpuram Tyriam, in qua tibi invideo, quod unis vestimentis tam diu lautus es. Verum esto, negotiari libet; cur non Pergami, Smyrnae, Trallibus, ubi et multi cives Romani sunt et ius a nostro magistratu dicitur? Otium te delectat, lites, turbae, praetor odio est, Graecorum libertate gaudes. Cur ergo unus tu Apollonidensis amantissimos populi Romani, fidelissimos socios, miseriores habes quam aut Mithridates aut etiam pater tuus habuit umquam? Cur his per te frui libertate sua, cur denique esse liberos non licet? Homines sunt tota ex Asia frugalissimi, sanctissimi, a Graecorum luxuria et levitate remotissimi, patres familias suo contenti, aratores, rusticani; agros habent et natura perbonos et diligentia culturaque meliores. In hisce agris tu praedia habere voluisti. Omnino mallem, et magis erat tuum, si iam te crassi agri delectabant, hic alicubi in Crustumino aut in Capenati paravisses. Verum esto; Catonis	514:526	0:1083
fidelis	JJ	[-300,0]	1	2_57	 	apud me? Ne time, uoluptas mea. </line><line> Quid istuc est negoti? Animus hanc modo hic reliquerat. </line><line> Metuoque et timeo ne hoc tandem propalam fiat nimis. </line><line> Quid id est? Nos secundum ferri nunc per urbem haec omnia, </line><line> ne quis tibi hoc uitio uortat. Mea, non illorum dedi: </line><line> parui ego illos facio. Agite, ite cum dis beneuolentibus. </line><line> Tua ego hoc caussa dico. Credo. Iam uale. Et tu bene uale. </line><line> Ite cito, iam ego adsequar uos: cum ero pauca uolo loqui. </line><line> quamquam alios fideliores semper habuisti tibi </line><line> quam me, tamen tibi habeo magnam gratiam rerum omnium; </line><line> et, si ita sententia esset, tibi seruire malui </line><line> multo quam alii libertus esse. Habe animum bonum. </line><line> Eheu, quom uenit mi in mentem ut mores mutandi sient, </line><line> muliebres mores discendi, obliuiscendi stratiotici! </line><line> Fac sis frugi. Iam non possum, amisi omnem lubidinem. </line><line> I, sequere illos, ne morere. Bene uale. Et tu bene uale. </line><line> Quaeso memineris, si forte liber fieri occeperim </line>  <line> ( mittam nuntium ad te), ne me deseras.	556:566	0:1174
fidelis	JJ	[-100,0]	1	2_58	 	argenti triginta milia pondo et mille ducenta. senatores quinque et viginti Cales in custodiam, duodetriginta Teanum missi, quorum de sententia maxime descitum ab Romanis constabat. De supplicio Campani senatus haudquaquam inter Fulvium Claudiumque conveniebat. facilis impetrandae veniae Claudius, Fulvi durior sententia erat. itaque Appius Romam ad senatum arbitrium eius rei totum reiciebat: percontandi etiam aequum esse potestatem fieri patribus, num communicassent consilia cum aliquis sociorum Latini nominis[ municipiorum] et num ope eorum in bello forent adiuti. id vero minime committendum esse Fulvius dicere ut sollicitarentur criminibus dubiis sociorum fidelium animi, et subicerentur indicibus quis neque; quid dicerent neque; quid facerent quicquam unquam pensi fuisset; itaque se eam quaestionem oppressurum exstincturumque. ab hoc sermone cum digressi essent, et Appius quamvis ferociter loquentem collegam non dubitaret tamen litteras super tanta re ab Roma exspectaturum, Fulvius, ne id ipsum impedimentum incepto foret, dimittens praetorium tribunis militum ac praefectis socium imperavit uti duobus milibus equitum delectis denuntiarent ut ad tertiam bucinam praesto essent. cum hoc equitatu nocte Teanum profectus, prima luce portam intravit atque in forum perrexit; concursuque ad primum equitum	666:674	0:1319
fidelis	JJ	[-100,0]	1	2_59	 	atque erecti passim toto foro cum quibusdam minis et barbaro atque immani terrore Vorum; quod ego profecto non crederem, nisi aliquotiens ex ipsis accusatoribus vobiscum simul, iudices, audissem, cum praeciperent ut caveretis ne hoc absoluto novum aliquod bellum Gallicum concitaretur. Si M. Fonteium, iudices, in causa deficerent omnia, si turpi adulescentia, vita infami, magistratibus quos ante oculos vestros gessit; male gestis;, convictus virorum bonorum testimoniis, legationibus flagitiose obitis, invisus suis omnibus in iudicium vocaretur, si in eo iudicio colonorum populi Romani Narbonensium, fidelissimorum sociorum Massiliensium, civium Romanorum omnium testimoniis tabulisque premeretur, tamen esset vobis magno opere providendum ne, quos ita adflictos a vestris patribus maioribusque accepissetis ut contemnendi essent, eos pertimuisse et eorum minis et terrore commoti esse videremini. Nunc vero cum laedat nemo bonus, laudent omnes vestri cives atque socii, oppugnent idem qui saepissime hanc urbem et hoc imperium oppugnarunt, cumque inimici M. Fontei vobis ac populo Romano minentur, amici ac propinqui supplicent vobis, dubitabitis non modo vestris civibus, qui maxime gloria ac laude ducuntur, verum etiam exteris nationibus;	605:619	0:1248
fidelis	JJ	[1000,1200]	2	2_0	 	- conuersionem; quam in rebus, quia conuersio proprie terminorum est qui transponuntur, non rerum, et proprie secundum Aristotelem. Si quis itaque hoc nomen; substantia; prius esse hoc nomine; deus; recipiat secundum non- conuersionem, eo fortassis quod, cum necessario sequatur:; Si deus est, substantia est;, non e conuerso recipiat:; Si substantia est, deus est;; non ideo cogendus erit ut ullo modo rem ipsam quae substantia est, re, quae deus est, priorem esse annuat. Parum etiam fidelibus debet esse quicquam de auctoritate infidelium contra fidem opponitur, siue philosophorum siue aliorum, cum secundum uere fidei tenorem constet eos errasse in multis, non solum in his quae ad Deum, uerum etiam quae ad creaturas attinent. Unde et saepe alii in alios inuehuntur, non mcdiocriter eos arguendo et proprio ipsi iudicio auctoritates suas dissipant. Sed rursus obicis mihi ex his quae ipsemet posui quod sicut dico sapientiam ex potentia nasci, hoc est filium ex patre, ad eam scilicet similitudinem qua dicimus speciem ex genere nasci, ita etiam dici conuenit diuinam	486:495	0:1074
fidelis	JJ	[1900,2000]	2	2_1	 	- Eucharistica et spiritalis communio;; Prima communio; Qualibet feria VI temporis quadragesimae;; Spiritalis communionis actus; Gratiarum actio post communionem Anima Christi- En ego, o bone et dulcissime IesuExamen conscientiae et actus contritionis; Examen conscientiae; Actus contritionis---- Ps paenitentiales Exercitiaspiritalia et recollectio menstrua; Exercitia spiritalia; Recollectio menstrua Hebdomadapro christianorum unitate; Participatio; Prex: In articulo mortis; Si sacerdos aderit; Si sacerdos aberit; Laudabiliter adhibetur crucifixus vel crux; Etiamsi eodem die alia indulgentia plenaria iam obtenta erit; Circa hoc fideles instruendi sunt Inmemoria Passionis et Mortis Domini; Sollemnis adoratio crucis; Via crucis Obiectorumpietatis usus; A Summo Pontifice aut ab Episcopo be nedictorum; A sacerdote vel diacono benedictorum Oratiomentalis Praedicationissacrae participatio; Sacrae Missiones; Sacrae praedicationes Precesad Beatissimam Virginem Mariam; Rosarium mariale; Pia recitatio in variis adiunctis; Dum recitatio Summi Pontificis ope instrumenti televisifici vel radiophonici propagatur;; Canticum; vel; Preces:---- Preces ad custodem Angelum Angele DeiPreces in honorem S. Ioseph Ad te, beate IosephPreces in honorem Ss. Apostolorum Petri et Pauli Sancti	635:642	0:1284
fidelis	JJ	[1000,1200]	2	2_2	 	Quid est illud in euangelio Lucae, quod diuiti damnato Abraham dicit: Et in his omnibus inter nos et uos chaos magnum firmatum est, ut hi qui uolunt hinc transire ad Vos, non possint, neque inde huc transmeare? Quomodo enim aliqui excaecati sunt, ut de refrigerio tantae quietis ad poenas damnatorum transire uelint, uel eis aliquod impendere beneficium iam omnino inaniter affectent, quos a misericordia Dei penitus exclusos uident? SOLUTIO Abraham, in cuius sinu Lazarus est susceptus, Deus est, qui fideles suos de huius uitae miseriis ad futurae Vitae refrigerium nobis adhuc occultum tamquam in quoddam secretum quietis suscipit. Ad hunc anima damnata loquitur quasi supplicando, dum eum sui desideret misereri. Abraham ei de sententia sua constituta respondet, cum eum intelligere facit inaniter eum desiderare, quod nullatenus eidem potest euenire. Hoc est autem quod eum intelligere facit, quod subiungit: Et in his omnibus inter nos et Vos chaos magnum firmatum est. . . etc.; In his omnibus;-- hoc est, in utrisque praedictis, de consolatione scilicet	502:509	0:1062
fidelis	JJ	[1000,1200]	2	2_3	 	IN NATALI INNOCENTUM Si ad corporalem aspiciamus pacem hodierna passio innocentum prima professata est quam uerum fuerit quod ipsa Veritas postmodum ait: Nolite putare quia ueni pacem mittere in terram: non ueni pacem mittere, sed gladium. Etsi enim aduentus eius pacem maximam mundo dederit, bellis prioribus sub Augusto finitis, nequaquam ipsesibi hancpraestitit quam omnibus contulit. Quod quidem non sine magna dispensatione factum esse credimus, ut in eius scilicet persecutione tam cito inchoata, singuli fideles in propria se maxime consolarentur, quam et ipse Dominus consolationem discipulis anteponens: Mementote, inquit, sermonis mei, quem ego dixi uobis: non enim est seruus maior domino suo; si me persecuti sunt et uos persequentur. Bene autem ab ipsa statim infantia Christi persecutio eius est incoepta et in infantibus debacchata ut tanto irrationabilior comprobetur, quod tam crudelis innocentiam manifestam prosequitur, ut prius imperatur supplicium quam patrandi facultatem aetas habeat. Ne quis forte Dominum crudelitatis arguat quod ipse persecutionem declinans in Aegypto latuerit, nec ab ea innocentiam infantum liberare decreuit	511:518	0:1154
fidelis	JJ	[1000,1200]	2	2_4	 	Rogamus quippe et quaerimus, quis fuerit ille uir Dei a Domino missus ad Eli, ut eum corrigeret, et mala domnui eius uentura praediceret? Quid et illud sit, quod inter caetera dicitur, de sacerdote meliore successuro Eli: Suscitabo, inquit, mihi sacerdotem fidelem, qui iuxta cor meum et animam meam faciat: et aedificabo ei domum fidelem, et ambulabit coram Christo meo cunctis diebus. Futurum est autem, ut quicumque remanserit in domo, ueniat, ut oretur pro ea, et offerat nummum argenteum, et tortam panis, dicatque: Dimitte me, obsecro, ad unam partem sacerdotalem, ut comedam buccellam panis. Scimus quidem Samuelem, qui Eli superuixit, fidelissimum extitisse Domino. Sed quod leuita potius quam sacerdos extiterit, communis opinio est, nec domum eius fidelem extitisse, cuius filii reprobati sunt. Quod etiam dicitur: Ambulabit coram Christo meo utrum de ipso sacerdote,	331:338	0:878
fidelis	JJ	[1000,1200]	2	2_5	 	EXPOSITIO DOMINICAE ORATIONIS IN DIEBUS ROGATIONUM, QUAE LITANIAE DICUNTUR Praesentes Rogationum, id est orationum, dies ex ipso quoque nomine suo nos nunc praecipue ad orationem inuitant. Constat autem inter uniuersas orationes eam tam dignitate quam utilitate praeminere, quae ab ipso Domino discipulis tradita Dominica inde est appellata, et ob hoc a fidelibus potissimum frequentanda, ut de ipsa praecipue Iacobus uideatur dixisse: Multum enim ualet oratio iusti assidua. Quantum autem ualeat et possit oratio iusti illud Hieronymi super Ieremiam manifeste declarat, Domino ad prophetam dicente: Tu autem noli orare pro populo hoc, et non obsistas mihi, quia non exaudiam te. Hieronymus: Quod autem dicit:; Et non resistas mihi; ostendit quod sanctorum oratio irae Dei possit resistere. Unde et loquitur ad Moysen:; Dimitte me, ut percutiam populum istum.; Quod si tantumdem oratio sanctorum posse habeas,	354:363	0:910
fidelis	JJ	[1000,1200]	2	2_6	 	Rogamus quippe et quaerimus, quis fuerit ille uir Dei a Domino missus ad Eli, ut eum corrigeret, et mala domnui eius uentura praediceret? Quid et illud sit, quod inter caetera dicitur, de sacerdote meliore successuro Eli: Suscitabo, inquit, mihi sacerdotem fidelem, qui iuxta cor meum et animam meam faciat: et aedificabo ei domum fidelem, et ambulabit coram Christo meo cunctis diebus. Futurum est autem, ut quicumque remanserit in domo, ueniat, ut oretur pro ea, et offerat nummum argenteum, et tortam panis, dicatque: Dimitte me, obsecro, ad unam partem sacerdotalem, ut comedam buccellam panis. Scimus quidem Samuelem, qui Eli superuixit, fidelissimum extitisse Domino. Sed quod leuita potius quam sacerdos extiterit, communis opinio est, nec domum eius fidelem extitisse, cuius filii reprobati	257:264	0:799
fidelis	JJ	[1000,1200]	2	2_7	 	IN DIE PASCHAE Quantum ad deuotionem uel honorem feminarum paschalis exultatio solemnitatis pertineat, tam Veteris quam Noui Testamenti paginae testantur. Veteri quippe pascha in Aegypto a populo Dei primum celebrato, et ea nocte per submersionem Aegyptiorum fidelibus liberatis, canticum gratiarum non solum uiri, sed etiam feminae, ut Exodus narrat, Domino persoluunt. Scriptum quippe ibidem est: Tunc cecinit Moyses et filii Israel carmen hoc Domino, et dixerunt: Cantemus Domino, gloriose enim. . . etc. Ubi et de cantu quoque feminarum seorsum adiungitur: Sumpsit ergo Maria prophetissa, soror Aaron, tympanum in manu. Egressaeque sunt omnes mulieres post eam, cum tympanis et chords, quibus praecinebat, dicens: Cantemus Domino, gloriose enim. . . etc. Quod quidem feminarum canticum quanto	259:268	0:797
fidelis	JJ	[1000,1200]	2	2_8	 	DE SANCTO IOANNE EVANGELISTA Qui sermones in sanctorum festiuitatibus componunt, a praerogatiua, hoc est a dignitate ipsorum non incongrue sumunt exordium; ut eorum festa tanto deuotius a fidelibus celebrentur, quanto amplius ipsorum commendatio est audita et eos Deo gratiores intelligimus, et de meritis ipsorum magis confidimus. Constat autem inter uniuersos apostolos, sicut et beatus meminit Augustinus, epistolam Pauli ad Galatas exponens, tres honorabiliores extitisse, Petrum uidelicet, et Iacobum, et Ioannem: qui, ut memoratus ait Apostolus, uidebantur columnae esse, quasi fulcimentum scilicet ac robur aliorum. Hos quippe tres familiarissimos Christi fuisse ex multis locis Euangeliorum colligimus, et his seorsum Dominum sua secreta saepius commisisse, et tanquam inseparabiles comites eos habuisse. His enim	188:197	0:822
fidelis	JJ	[1000,1200]	2	2_9	 	Quid est quod fidelium mentes Dominus componens, et ea computans bona, quibus beatitudinem promereri possunt, modlo in singulis dicit eos beatos, in quibus sunt, tamquam unum quodque facere sufficiat beatum, sicut esse declanatur ex remuneratione eonum sunbiecta? Sic quippe dicitur: Beati pauperes spiritu, quoniam ipsorum est regnum caelorum. Et similiter in caeteris singulis remuneratio supponitur, ex qua unaquaeque gratia suufficere uidetur ad salutem. Quas etiam distingui petimus diligenter, quo melius appareat, utrum singulae sufficiant, si non in eodem homine simul occurrant. SOLUTIO Septem sunt bona tamquam septem beatitudinibus	14:22	0:643
fidelis	JJ	[1900,2000]	2	2_10	 	TITULUS De fidelium associationibus in genere. Can. Fideles laude digni sunt, si sua dent nomina associationibus ab Ecclesia erectis vel saltem commendatis; caveant autem ab associationibus secretis, damnatis, seditiosis, suspectis aut quae studeant sese a legitima Ecclesiae vigilantia subducere. Can. Associationes distinctae a religionibus vel societatibus de quibus in can.-, ab Ecclesia constitui possunt vel ad perfectiorem vitam christianam inter socios promovendam, vel ad aliqua pietatis aut caritatis opera exercenda, vel denique ad incrementum publici cultus. Can.; Nulla in Ecclesia recognoscitur associatio quae a legitima auctoritate ecclesiastica erecta vel saltem approbata non fuerit	52:59	0:701
fidelis	JJ	[2000,2100]	2	2_11	 	De sacris vasis Vasa sacra, quae ad recipiendum Corpus et Sanguinem Domini destinata sunt, stricte ad normam traditionis et librorum liturgicorum conficiantur. Conferentiis Episcoporum facultas datur decernendi an, actis ab Apostolica Sede recognitis, opportunum sit vasa sacra confici etiam aliis ex materiis solidis. Attamen stricte requiritur, ut huiusmodi materiae secundum communem aestimationem cuiusque regionis, revera nobiles sint, ita ut eorum usu honor reddatur Domino et periculum omnino vitetur prae oculis fidelium doctrinam realis praesentiae Christi in speciebus eucharisticis minuendi. Reprobandus igitur est quivis usus, quo ad Missae celebrationem vasa communia vel viliora adhibentur ad qualitatem quod attinet, vel omni artificio carentia vel simplicia canistra vel alia vasa ex vitro, argilla, creta aliisve materiis confecta, quae facile frangantur. Quod valet etiam de metallis aliisque materiis, quae facile corrumpantur. Vasa sacra, antequam usurpentur, a Sacerdote iuxta ritus in libris liturgicis praescriptos benedicenda sunt. Laudabiliter benedictio ab Episcopo dioecesano impertitur, qui diiudicabit an vasa ad usum, cui destinantur, sint	520:528	0:1170
fidelis	JJ	[1900,2000]	2	2_12	 	-). Illa fuit dies primi nuntii ac primorum baptismatum: Petrus coadunatae turbae Christum surrexisse proclamavit atque nonnulli,; recepto sermone eius, baptizati sunt;(,). Fuit epiphania Ecclesiae, quae ut populus manifestata est, in quem in unitate, praeter omnes diversitates, Dei filii dispersi confluunt. </section><section> Prima hebdomadis dies Hoc super fundamentum, ab apostolicis inde temporibus,; prima sabbatorum dies;, prima hebdomadis, ipsam Christi discipulorum vitam modulari coepit( cfr,).; Prima post sabbatum dies; fuit quoque dies quo Troados fideles; ob fractionem panis; conveniebant, cum Paulus discedens eos allocutus est ac miraculum patravit, ut Eutychum iuvenem ad vitam revocaret( cfr,-). Apocalypsis liber usum testatur hanc primam hebdomadis diem appellandi dominicam diem( cfr,). Haec iam una est ex notis qua Christiani ab iis qui circa sunt dignoscuntur. Id animadvertit ab ineunte usque secundo saeculo Bitiniae procurator, Plinius Iunior, Christianorum consuetudinem referendo; quod essent soliti stato die ante lucem convenire carmenque Christo quasi deo dicere;. Verumtamen, cum Christiani; diem Domini;	563:570	0:1141
