lemma	pos	date	grouping	identifier	description	context	indexes_target_token	indexes_target_sentence
honor	NN	[400,700]	2	17_10	 	, </line><line> ecclesiaeque caput distribuente deo, </line><line> discipule egregii, bone Magnerice, Niceti, </line><line> nominis auspicio magne canende tui, </line><line> clare sacro merito tanto informante magistro, </line><line> quem reparas operum fructificante loco, </line><line> cuius, opime, sequax sancta et uestigia seruans </line><line> rite minister agens ecce magister ades </line><line> auctorisque pii successor dignus haberis </line><line> heredisque sui frugiparensque manes. </line><line> creuit post obitum pater et te crescere fecit: </line><line> dum capit ille polum, tu capis arce locum. </line><line> grex alitur per te uice praecessoris, alumne, </line><line> nec sua damna dolet, dum tua lucra tenet. </line><line> fratribus optandus, iucundus honore ministris </line><line> carius et populis pastor amore places. </line><line> te panem esuriens, tectum hospes, nudus amictum, </line><line> te fessus requiem, spem peregrinus habet. </line><line> haec faciens intende magis, uenerande sacerdos, </line><line> ut commissa tibi dupla talenta feras. </line><line> pro Fortunato exorans quoque dulcis amator </line><line> spem mihi dans ueniae, sit tibi palma, pater. </book></section></line><line><section><book> Nauta rudis tumido cum uult dare uela profundo </line><line> atque procellosas nescius intrat aquas, </line><line> raucisono latrante salo cum perstrepit aequor </line><line> et uaga terrifico murmurat unda freto, </line><line> exsiliens pelagus colles ubi uoluit aquosos </line><line> planaque dorsa malis mobile rupe tument, </line><line> naufragii cumulos	772:778	0:1597
honor	NN	[300,500]	2	17_11	 	, </line><line> et iam vietam Sarra in alvum fertilis </line><line> munus iuventae mater exsanguis stupet, </line><line> herede guadens, et cachinni paenitens. </line><line> haec ad figuram praenotata est linea, </line><line> quam nostra recto vita resculpat pede: </line><line> vigilandum in armis pectorum fidelium, </line><line> omnemque nostri portionem corporis, </line><line> quae capta foedae serviat libidini, </line><line> domi coactis liberandam viribus; </line><line> nos esse large vernularum divites, </line><line> si quid trecenti bis novenis additis </line><line> possint figura noverimus mystica. </line><line> mox ipse Christus, qui sacerdos verus est, </line><line> parente inenarrabili atque uno satus, </line><line> cibum beatis offerens victoribus </line><line> parvam pudici cordis intrabit casam, </line><line> monstrans honorem trinitatis hospitae. </line><line> animam deinde spiritus conplexibus </line><line> pie maritam, prolis expertem diu, </line><line> faciet perenni fertilem de semine, </line><line> tunc sera dotem possidens puerpera </line><line> herede digno patris inplebit domum. </line><line> Christe, graves hominum semper miserate labores, </line><line> qui patria virtute cluis propriaque, sed una, </line>  <line> ( unum namque deum colimus de nomine utroque, </line><line> non tamen et solum, quia tu deus ex patre, Christe) </line><line> dissere, rex noster, quo milite pellere culpas </line><line> mens armata queat nostri de pectoris antro, </line><line> exoritur quotiens turbatis sensibus intus </line><line> seditio atque animam morborum rixa fatigat, </line><line> quod	844:851	0:1621
honor	NN	[400,700]	2	17_12	 	, </line><line> et memor illud ero dum luce et corpore consto. </line><line> promptius affectu, precor, inde require sodales: </line><line> si sociis loqueris, ueniam pietate mereris, </line><line> porrigo materiam quibus hanc ego, ut ore rotundo </line><line> Martini gestis florentia carmina pangant </line><line> et claro ingenio texant spargenda per ortum: </line><line> uir radians meritis licet ille nec indiget istis, </line><line> gratia cuius ouans ac fama iter occupat orbis, </line><line> arua capax, pelagus intrans, super astra coruscans, </line><line> distribuens miras populis pro stipe medellas, </line><line> qui domino famulando suo capit omnia dona. </line><line> et quo Christus habet nomen, Martinus honorem. </book></section></line><line><section><book> Lingua prophetarum cecinit de uirgine partum: </line><line> nuntia fert terris angelus ista poli. </line><line> consona uox hominum memorat hoc ferre puellam, </line><line> quod daret absque uiro germine uirgo uirum. </line><line> hoc euangelio concordans pandit Esaias: </line><line> quae deus inspirat, haec canit ipse tuba </line><line> eloquio torrens et rite profunda locutus, </line><line> Emmanuhel nostrum uirgine dante canens. </line><line> praedicens olim ut de matre Tonantis honore </line><line> radicis florem Iessea uirga daret. </line><line> uirgo haec uirga fuit, de qua est flos Christus obortus, </line><line> cuius odor uiuax membra sepulta leuat, </line><line> laxus morte iacens de cuius aromate tactus </line><line> postque diem quartam	721:728	0:1535
honor	NN	[0,300]	2	17_13	 	, </line><line> et picturatus morituris floribus agger; </line><line> tertius adsurgens Arabum strue tollitur ordo </line><line> Eoas complexus opes incanaque glebis </line><line> tura et ab antiquo durantia cinnama Belo. </line><line> summa crepant auro, Tyrioque attollitur ostro </line><line> molle supercilium, teretes hoc undique gemmae </line><line> inradiant, medio Linus intertextus acantho </line><line> letiferique canes: opus admirabile semper </line><line> oderat atque oculos flectebat ab omine mater. </line><line> arma etiam et ueterum exuuias circumdat auorum </line><line> gloria mixta malis adflictaeque ambitus aulae, </line><line> ceu grande exequiis onus atque inmensa ferantur </line><line> membra rogo, sed cassa tamen sterilisque dolentes </line><line> fama iuuat, paruique augescunt funere manes. </line><line> inde ingens lacrimis honor et miseranda uoluptas, </line><line> muneraque in cineres annis grauiora feruntur; </line><line> namque illi et pharetras breuioraque tela dicarat </line><line> festinus uoti pater insontesque sagittas; </line><line> iam tunc et nota stabuli de gente probatos </line><line> in nomen pascebat equos cinctusque sonantes </line><line> armaque maiores expectatura lacertos. </line>  <line> [ spes auidi quas, non in nomen credula, uestes </line><line> urguebat studio cultusque insignia regni </line><line> purpureos sceptrumque minus, cuncta ignibus atris </line><line> damnat atrox suaque ipse parens gestamina ferri, </line><line> si damnis rabidum queat exaturare dolorem.] </line><line> parte alia gnari monitis exercitus instat </line><line> auguris aeriam truncis nemorumque ruina, </line><line> montis opus, cumulare pyram,	857:862	0:1691
honor	NN	[1100,1200]	2	17_14	 	, </line><line> Et regere affectas, nescius ipse regi. </line><line> Quam male confundit ratio praepostera mores, </line><line> Cum docet indoctus, ducit et absque duce. </section></line><line><section> Visceribus peregrina tuis annectere, durum est; </line><line> Concordare sibi extranea, difficile est. </line><line> Quod jungit natura tibi, Marcelle, repellis, </line><line> Exterum et adversum vis sociare tibi. </section></line><line><section> Ne noceas tibi, sic aliis prodesse memento; </line><line> Velle beare alios, prodere te, miserum est; </line><line> Quo vitio cum decenti plerique laborent, </line><line> Unum supra omnes Euripidem video. </section></line><line><section> Altior ascensus, gravior plerumque ruina est, </line><line> Sollicitudo gravis, praeproperatus honor. </line><line> Cum nimis alta petis citus incautusque, ruina </line><line> Et gravis et subita est, Sexte, timenda tibi. </section></line><line><section> Invidus es, Gaius, frustra sibi, Magne, placere </line><line> Contendis, non te conciliabis ei. </line><line> Diligis? instigas; vis pacificare? Fatigas; </line><line> Sic exhibitio perdis amore duos. </section></line><line><section> Crimina nulla tibi quoniam sunt, Galle, superbis; </line><line> Inflaris, quoniam crimina nulla tibi. </line><line> Crimen in omne ruis, quia non peccasse superbis, </line><line> Te justum esse putans, crimen in omne ruis. </section></line><line><section> Invitum servare diu, provincia dura est; </line><line> verbis servare	783:788	0:1503
honor	NN	[1100,1200]	2	17_15	 	, </line><line> Funesto cunctos fuerant qui participati </line><line> Consilio punit; hos truncat, perfodit illos, </line><line> Multos suspendit; memorata morte Drogonis, </line><line> Parcere vult nulli; iacet alto pectore fixus </line><line> Fraternae mortis succensus fornite moeror, </line><line> Omnibus horrendus. Multas sibi subdidit urbes: </line><line> Solvere Troiam comiti coepere tributum; </line><line> Hunc et Barini, Tranenses et Venusini, </line><line> Cives Ydrunti famulantur et urbs Acernnti. </line><line> Roberto fratri Calabras adquirere terras </line><line> Concedit. Iuvenis patiens erat iste laboris, </line><line> Vir prudens et habens ad quaeque negotia promtas </line><line> Esercenda manus Robertus et ingeniosus, </line><line> Semper celsa petens, et laudis amans et honoris. </line><line> Si contingebat sibi palma vel arte vel armis, </line><line> Aeque ducebat, quia quod violentia saepe </line><line> Non explere potest, esplet versutia mentis. </line><line> Clarus in eloquto dabat hic responsa repente </line><line> Optima consultus; si quis quaerebat ab illo </line><line> Consilium, sapienter ei dare noverat illud. </line><line> Hic sibi concesso Calabrorum munere gaudet. </line><line> se cum nonnullos equites collegerat ante, </line><line> Qua poterat, sed praecipue regionibus illis </line><line> Multiplicem praedam peragens, quas frater habebat. </line><line> Quodque capi poterat dum dividit omnibus aeque, </line><line> Omnes sunt cari sibi, carus et omnibus ipse. </line><line> Captus ab Unfredo se cum	798:805	0:1552
honor	NN	[300,500]	2	17_16	 	, </line><line> Grypes Hyperborei pondera fulua soli; </line><line> Furatae Veneris prato per inane columbae </line><line> Florea conexis serta tulere rosis, </line><line> Fractaque nobilium ramis electra sororum </line><line> Cycnus oloriferi uexit ab amne Padi, </line><line> Et Nilo Pygmaea grues post bella remenso </line><line> Ore legunt rubri germina cara maris; </line><line> Venit et extremo Phoenix longaeuus ab Euro </line><line> Adportans unco cinnama rara pede: </line><line> Nulla auium pecudumque fuit quae ferre negaret </line><line> Vectigal meritae coniugiale lyrae. </line><line> Tunc opibus totoque Heliconis sedula regno </line><line> Ornabat propriam Calliopea nurum. </line><line> Ipsam praeterea dominam stellantis Olympi </line><line> Ad nati thalamos ausa rogare parens. </line><line> Nec spreuit regina deum, uel matris honore </line><line> Vel iusto uatis ducta fauore pii, </line><line> Qui sibi carminibus totiens lustrauerat aras </line><line> Iunonis blanda numina uoce canens </line><line> Proeliaque altisoni referens Phlegraea mariti, </line><line> Titanum fractas Enceladique minas. </line><line> Ilicet aduentu noctem dignata iugalem </line><line> Addidit augendis munera sacra toris, </line><line> Munera mortales non admittentia cultus, </line><line> Munera quae solos fas habuisse deos. </line><line> Sed quod Threicio Iuno placabilis Orphei, </line><line> Hoc poteris uotis esse, Serena, meis. </line><line> Illius expectant famulantia sidera nutum: </line><line> Sub pedibus regitur terra fretumque tuis. </line><line> Non ego, cum peterem, sollemni more procorum </line><line> Promisi gregibus pascua plena meis, </line><line> Nec quod mille	847:853	0:1685
honor	NN	[400,500]	2	17_17	 	, </line><line> Hac primos homines cretos dicione ferebat; </line><line> Ut seu praescriptum mandatum transgrederentur, </line><line> Siue inculpati, seruata lege, manerent, </line><line> Mortem istam prorsus, qua carnem uita relinquit, </line><line> Oppeterent; quae non peccato parta, sed ipso </line><line> Instituente Deo, comes esset fixa creatis. </line><line> Progenitos igitur nullum traxisse reatum </line><line> De patribus, neque dissimiles nunc nascier illo </line><line> Ortu primorum, qui libertate male usi </line><line> Peccarunt, forma nocui, non semine proli. </line><line> Posse autem insontes omnes uirtutis in arce </line><line> Uitam agere, et menti ingemitum seruare decorem: </line><line> Arbitrio quoniam subsistat recta uolentis. </line><line> Naturalis honos, Lexque insita cordibus intus </line><line> Hoc maneat, quod scripta foris: cui gratia Christi </line><line> Addita perfugium lapsis generaliter in se </line><line> Condiderit, sacro si uellent fonte nouari: </line><line> Ut sponte attractum uenia soluente reatum, </line><line> Sponte sua in uires proprias natura rediret; </line><line> Quoque per errores esset spoliata uigore, </line><line> Hunc seruare semel posset purgata receptum. </line><line> Tam diues uero hoc donum baptismatis esse, </line><line> Et tam multa homini conferri foedere in isto, </line><line> Ut paruis etiam, uitioque carentibus omni </line><line> Congruat, ut qui sunt geniti bene, sint meliores, </line><line> Naturaeque bonum adiecto illustretur honore. </line><line> Nullum	780:785	0:1541
honor	NN	[400,500]	2	17_19	 	Nemo suae carnis nimium laetetur honore, </line><line> ne uilis factus post sua fata gemat. </line><line> Cum pulcher fueris, deformem spernere noli, </line><line> turpia namque uigent, saepe decora cadunt. </line><line> Dicunt doctores:" rara est concordia formae </line><line> securique status atque pudicitiae". </line><line> Non honor est sed onus species laesura ferentem: </line><line> utilis horriditas non onus est sed honor.	333:338	0:434
honor	NN	[400,700]	2	17_21	 	, </line><line> inscia coniugio feta negante uiro. </line><line> accipis et nescis: sic reddis, ut integra constes; </line><line> nec uiolata paris nec pariendo doles. </line><line> et tamen est genitus deus et homo, uerus et unus, </line><line> spiritus atque caro Christus, utrumque genus, </line><line> in deitate patri aequalis uel corpore matri, </line><line> sed sine peccato de genetrice caro, </line><line> factor dans legem, factus sub lege minister, </line><line> ipse pater mundi, filius ipse tibi: </line><line> unde tuum, mater, generas natum atque parentem: </line><line> hinc prolem, inde patrem; hoc deus, illud humus. </line><line> cuius honore sacro genetrix transcendis Olympum </line><line> et super astrigeros erigis ora polos. </line><line> conderis in solio felix regina superno, </line><line> cingeris et niueis lactea uirgo choris, </line><line> nobile nobilior circumsistente senatu, </line><line> consulibus celsis celsior ipsa sedens, </line><line> sic iuxta genitum regem regina perennem, </line><line> ornata ex partu, mater opima, tuo. </line><line> occurrunt proceres et gloria magna Iohannis, </line><line> noscens ante deum quam pareretur homo </line><line> fratribus adscitis Paulo reliquisque beatis </line><line> ductor apostolicus, fulgida palma Petrus. </line><line> diligit has portas Sion super omnia Iacob, </line><line> pro patribus genitos quos in amore deus, </line><line> qui omnes ore sui ornati super astra	655:661	0:1455
honor	NN	[300,500]	2	17_22	 	, </line><line> Inter dura uiae balnea qui posuit. </book></section></line><line><section><book> Quae tibi cum pedibus ratio? quid carmina culpas? </line><line> Scandere qui nescis, uersiculos laceras? </line>  <line> " Claudicat hic uersus, haec" inquis" syllaba nutat", </line><line> Atque nihil prorsus stare putas, podager </book></section></line><line><section><book> Dulcia dona mihi semper tu, Maxime, mittis, </line><line> Et, quidquid mittis, mella putare decet. </book></section></line><line><section><book> Paupertas me saeua domat dirusque Cupido: </line><line> Sed toleranda fames, non tolerandus amor. </book></section></line><line><section><book> Esuriens pauper telis incendor amoris. </line><line> Inter utrumque malum deligo pauperiem. </book></section></line><line><section><book> Aspice sudantes uenerando pondere fratres, </line><line> Diuino meritos semper honore coli, </line><line> Iusta quibus rapidae cessit reuerentia flammae </line><line> Et mirata uagas reppulit Aetna faces. </line><line> Conplexi manibus fultos ceruice parentes </line><line> Attollunt uultus adcelerantque gradus. </line><line> Grandaeui gemina sublimes prole feruntur </line><line> Et cara natos inplicuere mora. </line><line> Nonne uides ut saeua senex incendia monstret, </line><line> Vt trepido genetrix inuocet ore deos? </line><line> Erexit formido comam, perque omne metallum </line><line> Fusus in attonito palluit aere tremor. </line><line> In iuuenum membris animosus cernitur horror </line><line> Aeque oneri metuens inpauidusque sui. </line><line> Reiectae uento chlamydes. dextram exerit ille </line><line> Contentus laeua sustinuisse patrem; </line><line> Ast illi duplices in nodum colligit ulnas </line><line> Cautior in sexu debiliore	879:885	0:1751
honor	NN	[300,400]	2	17_23	 	, </line><line> Inuenit ecce alios operique adcrescere iussit, </line><line> Pro meritis operis promittens praemia digna; </line><line> Illi non aliter laeti praecepta sequuntur. </line><line> Ast ubi sexta dehinc lucis transfluxerat hora, </line><line> Haut secus hinc alios iuuenes conducere pergit. </line><line> Horaque nona dehinc ubi solis cursibus acta est, </line><line> Tunc alios pariter conductos iussit adire. </line><line> Vltima labentis restabat portio lucis: </line><line> Egressus cernit iuuenes causasque requirit, </line><line> Cur pigris manibus torperent otia lenta. </line><line> Aiunt conductoris quod praecepta fuissent </line><line> Nulla sibi. Dominus mox hos insistere ruri </line><line> Tunc etiam iussit. Sed uespere protinus orto </line><line> Praecipit, ut cuncti caperent mercedis honorem </line><line> Aequalique omnes portarent praemia nummo. </line><line> Tunc manus illa uirum, prima quae luce laborem </line><line> Sustulerat factisque diem tolerauerat aequum, </line><line> Indignans se cum tali cum murmure fatur: </line>  <line> " Iniustum est, istis similem nos quaerere nummum, </line><line> Vltima quos operis sero coniunxerat hora." </line><line> Tum dominus ruris sedato pectore fatur: </line>  <line> " Inlibata tibi mercedis portio saluae </line><line> Redditur et pacti seruantur iura fidelis. </line><line> Istis de nostro liceat concedere tantum, </line><line> Extima quos operis glomerauit portio ruri. </line><line> Nam multos homines dignatio sancta uocauit, </line><line> E quis perminimam dignum est secernere partem."" </line><line> Haec ait	813:820	0:1598
honor	NN	[400,500]	2	17_24	 	, </line><line> Ipsa peregrinis ne uia sit laqueus. </line><line> Nam declinantes pro summis ferre laborem, </line><line> Terrenorum auidos infima suscipient. </book></section></line><line><section><book> Nulla quidem mens est mortali in corpore uiuens, </line><line> Quae plena uideat cognitione Deum. </line><line> Sed miris operum signis ostenditur auctor, </line><line> Rectoremque suum condita quaeque canunt. </line><line> Unde licet fandi uires, animique uigorem </line><line> Uincat, et excedat gloria lausque Dei, </line><line> Nos tamen officio cordis gaudemus et oris, </line><line> Et tanto oblectat succubuisse bono. </line><line> Hinc fidei uirtus, hinc flamma oriatur amoris, </line><line> Quod latet, exercet; quod superat, reparat. </book></section></line><line><section><book> Laetifer immodico naturae elatus honore </line><line> Angelus, inde hominem subruit, unde ruit. </line><line> Sed Christus miserans deceptum fraude maligni, </line><line> In se illi ad uitam posse redire dedit: </line><line> Si caueat pactis hostis seruire superbi, </line><line> Sectari et studeat formam humilis Domini. </line><line> Qui Patris in Deitate manens Deus omnicreator, </line><line> Uerus de sacra Uirgine natus homo est. </line><line> Sic nostrum assumens Matris de corpore corpus, </line><line> Esset ut assumptae carnis origo Deus: </line><line> In quo per lauacrum, fidei uirtute renata, </line><line> Caeleste accipiet gens noua principium. </line><line> Nil hominis primi retinens, sed plena secundi, </line><line> Splendore in capitis glorificanda sui. </book></section></line>	828:834	0:1594
honor	NN	[0,100]	2	17_25	 	, </line><line> ipse fodit, ditesque Caprae viridesque resultant </line><line> Taurubulae, et terris ingens redit aequoris echo. </line><line> non tam grande sonat motis incudibus Aetne, </line><line> cum Brontes Steropesque ferit, nec maior ab antris </line><line> Lemniacis fragor est ubi flammeus aegida caelat </line><line> Mulciber et castis exornat Pallada donis. </line><line> decrescunt scopuli, et rosea sub luce reversi </line><line> artifices mirantur opus. vix annus anhelat, </line><line> alter, et ingenti dives Tirynthius arce </line><line> despectat fluctus et iunctae tecta novercae </line><line> provocat et dignis invitat Pallada templis. </line><line> iam placidae dant signa tubae, iam fortibus ardens </line><line> fumat harena sacris. hos nec Pisaeus honores, </line><line> Iuppiter aut Cirrhae pater aspernetur opacae. </line><line> nil his triste locis; cedat lacrimabilis Isthmos, </line><line> cedat atrox Nemee: litat hic felicior infans. </line><line> ipsae puniceis virides Nereides antris </line><line> exsiliunt ultro, scopulis umentibus haerent, </line><line> nec pudet occulte nudas spectare palaestras. </line><line> spectat et Icario nemorosus palmite Gaurus, </line><line> silvaque quae fixam pelago Nesida coronat, </line><line> et placidus Limon, omenque Euploea carinis, </line><line> et Lucrina Venus, Phrygioque e vertice Graias, </line><line> addisces, Misene, tubas, ridetque benigna </line><line> Parthenope gentile sacrum nudosque virorum </line><line> certatus et parva suae simulacra coronae. </line><line> Quin age et ipse	774:781	0:1572
honor	NN	[1100,1200]	2	17_26	 	, </line><line> Languens stupescat carnis aculeus, </line><line> Ancilla fiet sic caro spiritus: </line><line> Largire visus pessula januae, </line><line> Frenes ocellos, ne nimis improbe </line><line> Venentur extra luminis impetus, </line><line> Praedamque menti nuntius offerat. </line><line> Si quos habendi fervor inebriat, </line><line> Exire cogant, mente pecuniam, </line><line> Mentis triumphum sentiat ambitus, </line><line> Victi premantur colla Cupidinis. </line><line> Non in crumenis ipsa pecunia </line><line> Clausis moretur, pigraque dormiat, </line>  <line> [ C] Nulli vacando, sed magis excubet, </line><line> Custos honoris divitis usibus: </line><line> Si tempus adsit, si locus exigat, </line><line> Surgat sepultae massa pecuniae, </line><line> Nummos crumenae funditus evomant. </line><line> Quaevis honori munera militent. </line><line> Calcare si vis colla superbiae, </line><line> Flatus tumoris, fulmina spiritus, </line><line> Pensa caducae pondus originis, </line><line> Vitae labores mortis et apocham. </section></line><section> Cum in hanc specialis disciplinae semitam oratio Naturae procederet, ecce vir subitae apparitionis miraculo, sine omni nostrae praeconsiderationis vexillo, suam praesentiam nostris conspectibus praesentavit.[ D] Qui nullius aetatis legi videretur obnoxius, nunc enim juventutis vere pubescebat, nunc maturioris aevi facies seria loquebatur, nunc vultus senectutis sulcis videbatur arari. Qui sicut multimodae aetatis vicaria facie fluctuabat, sic ejus staturam ancipitem, nunc quantitas minor	824:830	0:1554
honor	NN	[300,500]	2	17_27	 	, </line><line> Ne lingua mendax, ne manus </line><line> Oculiue peccent lubrici, </line><line> Ne noxa corpus inquinet. </line><line> Speculator adstat desuper, </line><line> Qui nos diebus omnibus </line><line> Actusque nostros prospicit </line><line> A luce prima in uesperum. </line><line> Hic testis, hic est arbiter, </line><line> Hic intuetur, quidquid est </line><line> Humana quod mens concipit; </line><line> Hunc nemo fallit iudicem. </book></section></line><line><section><book> O crucifer bone, lucisator, </line><line> Omniparens, pie, uerbigena, </line><line> Edite corpore uirgineo, </line><line> Sed prius in genitore potens, </line><line> Astra solum mare quam fierent! </line><line> Huc nitido, precor, intuitu </line><line> Flecte salutiferam faciem </line><line> Fronte serenus et inradia, </line><line> Nominis ut sub honore tui </line><line> Has epulas liceat capere. </line><line> Te sine dulce nihil, domine, </line><line> Nec iuuat ore quid adpetere, </line><line> Pocula ni prius atque cibos, </line><line> Christe, tuus fauor inbuerit </line><line> Omnia sanctificante fide. </line><line> Fercula nostra deum sapiant, </line><line> Christus et influat in pateras, </line><line> Seria ludicra uerba iocos, </line><line> Denique quod sumus aut agimus, </line><line> Trina superne regat pietas. </line><line> Hic mihi nulla rosae spolia, </line><line> Nullus aromate flagrat odor, </line><line> Sed liquor influit ambrosius </line><line> Nectareamque fidem redolet </line><line> Fusus ab usque patris gremio. </line><line> Sperne, camena, leues hederas, </line><line> Cingere tempora quis solita es, </line><line> Sertaque mystica	840:846	0:1656
