lemma	pos	date	grouping	identifier	description	context	indexes_target_token	indexes_target_sentence
honor	NN	[-100,0]	1	17_3	 	-; Malum quidem militibus meis; inquit,; nisi quieverint.; Quod auditum non contionem magis quam mox patres offendit. Et tribunus plebis, vir acer nec infacundus, nactus inter adversarios superbum ingenium immodicamque linguam, quam inritando agitandoque in eas impelleret voces quae invidiae non ipsi tantum sed causae atque universo ordini essent, neminem ex collegio tribunorum militum saepius quam Postumium in disceptationem trahebat. Tum vero secundum tam saevum atque inhumanum dictum; Auditis; inquit,; Quirites, sicut servis malum minantem militibus? Tamen haec belua dignior vobis tanto honore videbitur quam qui vos urbe agrisque donatos in colonias mittunt, qui sedem senectuti vestrae prospiciunt, qui pro vestris commodis adversus tam crudeles superbosque adversarios depugnant? Incipite deinde mirari cur pauci iam vestram suscipiant causam. Quid ut a vobis sperent? An honores, quos adversariis vestris potius quam populi Romani propugnatoribus datis? Ingemuistis modo voce huius audita. Quid id refert? Iam si suffragium detur, hunc qui malum vobis minatur, iis qui agros sedesque ac fortunas stabilire volunt praeferetis;. Perlata haec vox Postumi ad milites multo in castris maiorem indignationem	597:603	0:1216
honor	NN	[-100,0]	1	17_18	 	, </line><line> illa vel in Sacra sint licet empta Via. </line><line> adferat aut uvas aut, quas Amaryllis amabat, </line><line> at nunc castaneas non amat illa nuces. </line><line> quin etiam turdoque licet missaque columba </line><line> te memorem dominae testificere tuae. </line><line> turpiter his emitur spes mortis et orba senectus. </line><line> a, pereant, per quos munera crimen habent! </line><line> quid tibi praecipiam teneros quoque mittere versus? </line><line> ei mihi, non multum carmen honoris habet. </line><line> carmina laudantur, sed munera magna petuntur: </line><line> dummodo sit dives, barbarus ipse placet. </line><line> aurea sunt vere nunc saecula: plurimus auro </line><line> venit honos: auro conciliatur amor. </line><line> ipse licet venias Musis comitatus, Homere, </line><line> si nihil attuleris, ibis, Homere, foras. </line><line> sunt tamen et doctae, rarissima turba, puellae; </line><line> altera non doctae turba, sed esse volunt. </line><line> utraque laudetur per carmina: carmina lector </line><line> commendet dulci qualiacumque sono. </line><line> his ergo aut illis vigilatum carmen in ipsas </line><line> forsitan exigui muneris instar erit. </line><line> at quod eris per te facturus, et utile credis, </line><line> id tua te facito semper amica roget. </line><line> libertas alicui fuerit promissa tuorum: </line><line> hanc tamen a domina fac petat ille	712:717	0:1405
honor	NN	[-300,0]	1	17_20	 	, </line><line> Innumerabilia; ut melius uigilare sit ante, </line><line> Qua docui ratione, cauereque ne illiciaris. </line><line> Nam uitare, plagas in amoris ne iaciamur, </line><line> Non ita difficile est quam captum retibus ipsis </line><line> Exire et ualidos Veneris perrumpere nodos. </line><line> Et tamen implicitus quoque possis inque peditus </line><line> Effugere infestum, nisi tute tibi obuius obstes </line><line> Et praetermittas animi uitia omnia primum </line><line> Aut quae corpori'' sunt eius, quam praepetis ac uis. </line><line> Nam faciunt homines plerumque cupidine caeci </line><line> Et tribuunt ea quae non sunt his commoda uere. </line><line> Multimodis igitur prauas turpisque uidemus </line><line> Esse in deliciis summoque in honore uigere. </line><line> Atque alios alii irrident Veneremque suadent </line><line> Vt placent, quoniam foedo afflictentur amore, </line><line> Nec sua respiciunt miseri mala maxima saepe. </line><line> Nigra melichrus est, immunda et fetida acosmos, </line><line> Caesia Palladium, neruosa et lignea dorcas, </line><line> Paruula, pumilio, chariton mia, tota merum sal, </line><line> Magna atque immanis cataplexis plenaque honoris. </line><line> Balba loqui non quit, traulizi, muta pudens est; </line><line> At flagrans odiosa loquacula Lampadium fit. </line><line> Ischnon eromenion tum fit, cum uiuere non quit </line><line> Prae macie; rhadine uerost iam mortua tussi. </line><line> At tumida et mammosa Ceres	760:766	0:1480
honor	NN	[-100,0]	1	17_33	 	, ad quos provocatio esto. Cum magistratus iudicassit inrogassitve, per populum multae poenae certatio esto. Militiae ab eo qui imperabit provocatio nec esto, quodque is qui bellum geret imperassit, ius ratumque esto.'''' Minoris magistratus partiti iuris ploeres in ploera sunto. Militiae quibus iussi erunt imperanto eorumque tribuni sunto. Domi pecuniam publicam custodiunto, vincula sontium servanto, capitalia vindicanto, aes argentum aurumve publice signanto, litis contractas iudicanto,; quod; quodcumque senatus creverit agunto.'''' Suntoque aediles curatores urbis annonae ludorumque sollemnium, ollisque ad honoris amplioris gradum is primus ascensus esto.'''' Censoris populi aevitates suboles familias pecuniasque censento, urbis templa vias aquas aerarium vectigalia tuento, populique partis in tribus discribunto, exin pecunias aevitatis ordinis partiunto, equitum peditumque prolem discribunto, caelibes esse prohibento, mores populi regunto, probrum in senatu ne relinquonto. Bini sunto, magistratum quinquennium habento eaque potestas semper esto, reliqui magistratus annui sunto.'''' Iuris disceptator, qui privata iudicet iudicarive iubeat, praetor esto. Is iuris civilis custos esto. Huic potestate pari quotcumque senatus creverit populusve iusserit	617:624	0:1271
honor	NN	[-100,0]	1	17_34	 	, alio loco. Nam ista mihi et cum Antiocho saepe et cum Aristo nuper, cum Athenis imperator apud eum deversarer, dissensio fuit. Mihi enim non videbatur quisquam esse beatus posse, cum in malis esset; in malis autem sapientem esse posse, si essent ulla corporis aut fortunae mala. Dicebantur haec, quae scripsit etiam Antiochus locis pluribus, virtutem ipsam per se beatam vitam efficere posse neque tamen beatissimam; deinde ex maiore parte plerasque res nominari, etiamsi quae pars abesset, ut vires, ut valetudinem, ut divitias, ut honorem, ut gloriam, quae genere, non numero cernerentur; item beatam vitam, etiamsi ex aliqua parte clauderet, tamen ex multo maiore parte optinere nomen suum. Haec nunc enucleare non ita necesse est, quamquam non constantissime dici mihi videntur. Nam et, qui beatus est, non intellego quid requirat, ut sit beatior si est enim quod desit, ne beatus quidem est, et quod ex maiore parte unam quamque rem appellari spectarique dicunt, est ubi id isto modo valeat; cum vero tria genera malorum esse dicant, qui duorum	535:542	0:1052
honor	NN	[-100,0]	1	17_35	 	, an utrique, id quod est verius?- ne legaretur A. Gabinius Cn. Pompeio expetenti ac postulanti. Utrum ille, qui postulat ad tantum bellum legatum quem velit, idoneus non est qui impetret, cum ceteri ad expilandos socios diripiendasque provincias quos voluerunt legatos eduxerint; an ipse, cuius lege salus ac dignitas populo Romano atque omnibus gentibus constituta est, expers esse debet gloriae eius imperatoris atque eius exercitus, qui consilio ipsius ac periculo est constitutus? An C. Falcidius, Q. Metellus, Q. Caelius Latiniensis, Cn. Lentulus, quos omnis honoris causa nomino, cum tribuni plebi fuissent, anno proximo legati ese potuerunt: in uno Gabinio sunt tam diligentes, qui in hoc bello, quod lege Gabinia geritur, in hoc imperatore atque exercitu, quem per vos ipse constituit, etiam praecipuo iure esse deberet? De quo legando consules spero ad senatum relaturos. Qui si dubitabunt aur gravabuntur, ego me profiteor relaturum. Neque me impediet cuiusquam inimicum edictum, quo minus vobis fretus vestrum ius beneficiumque defendam; neque praeter intercessionem quicquam audiam, de qua( ut arbitror) isti ipsi,	565:572	0:1128
honor	NN	[-100,0]	1	17_36	 	, appellationem et tribunicium auxilium, patricii confugerunt; postremo repulsi inde- adeo omnia tutiora quam ut innocentiam suam purgarent visa- in nos inruerunt, et privatis dictatorem poscere reum vere cundiae non fuit;- ut omnes di hominesque sciant ab illis etiam quae non possint temptari ne rationem vitae reddant, me obviam ire crimini et offerre me inimicis reum, dictatura me abdico. Vos quaeso, consules, si vobis datum ab senatu negotium fuerit, in me primum et hunc M. Folium quaestiones exerceatis, ut appareat innocentia nostra nos, non maiestate honoris tutos a criminationibus istis esse.; abdicat inde se dictatura et post eum confestim Folius magisterio equitum; primique apud consules- iis enim ab senatu mandata res est- rei facti adversus nobilium testimonia egregie absolvuntur. Publilius etiam Philo multiplicatis summis honoribus post res tot domi belloque gestas, ceterum invisus nobilitati, causam dixit absolutusque est. Nec diutius, ut fit, quam dum recens erat quaestio per clara nomina reorum viguit: inde labi coepit ad viliora capita, donec coitionibus factionibusque adversus quas comparata erat oppressa est.	562:569	0:1144
honor	NN	[-100,0]	1	17_37	 	b. Operae pretium est audire qui omnia prae divitiis humana spernunt neque honori magno locum neque virtuti putant esse, nisi ubi effuse afluant opes. Spes unica imperii populi Romani, L. Quinctius trans Tiberim, contra eum ipsum locum ubi nunc navalia sunt, quattuor iugerum colebat agrum, quae prata Quinctia vocantur. Ibi ab legatis- seu fossam fodiens palae innixus, seu cum araret, operi certe, id quod constat, agresti intentus- salute data in vicem redditaque rogatus ut, quod bene verteret ipsi reique publicae, togatus mandata senatus audiret, admiratus rogitansque'' satin salve?'' Togam propere e tugurio proferre uxorem	75:81	0:632
honor	NN	[-100,0]	1	17_38	 	, aut? cum res distribuitur in partis, ut si quaeratur, quot sint genera rerum expetendarum, ut sintne tria, corporis, animi externarumque rerum, aut, cum, quae forma et quasi naturalis nota cuiusque sit, describitur, ut si quaeratur avari species, seditiosi, gloriosi. Consecutionis autem duo prima quaestionum genera ponuntur; nam aut simplex est disceptatio, ut si disseratur, expetendane sit gloria, aut ex comparatione, laus an divitiae magis expetendae sint; simplicium autem sunt tres modi: de expetendis fugiendisve rebus, ut expetendine honores sint, num fugienda paupertas; de aequo aut iniquo, ut aequumne sit ulcisci iniurias etiam propinquorum; de honesto aut turpi, ut hoc, sitne honestum gloriae causa mortem obire. Comparationis autem duo sunt modi: unus, cum idemne sit an aliquid intersit quaeritur; ut metuere et vereri, ut rex et tyrannus, ut adsentator et amicus; alter, cum quid praestet aliud alii quaeritur, ut illud, optimine cuiusque sapientes an populari laude ducantur. Atque eae quidem disceptationes, quae ad cognitionem referuntur, sic fere a doctissimis hominibus	546:553	0:1096
honor	NN	[-100,0]	1	17_39	 	, Cato, contemnis quocum per tot annos tot proeliis tot imperatores bella gesserunt, cuius expulsi et eiecti vita tanti aestimata est ut morte eius nuntiata denique bellum confectum arbitrarentur? Hoc igitur in bello L. Murenam legatum fortissimi animi, summi consili, maximi laboris cognitum esse defendimus, et hanc eius operam non minus ad consulatum adipiscendum quam hanc nostram forensem industriam dignitatis habuisse. At enim in praeturae petitione prior renuntiatus est Servius. Pergitisne vos tamquam ex syngrapha agere cum populo ut, quem locum semel honoris cuipiam dederit, eundem; in; reliquis honoribus debeat? Quod enim fretum, quem Euripum tot motus, tantas, tam varias habere putatis agitationes commutationesque fluctuum, quantas perturbationes et quantos aestus habet ratio comitiorum? Dies intermissus aut nox interposita saepe perturbat omnia, et totam opinionem parva non numquam commutat aura rumoris. Saepe etiam sine ulla aperta causa fit aliud atque existimaris, ut non numquam ita factum esse etiam populus admiretur, quasi vero non ipse fecerit. Nihil est incertius volgo, nihil obscurius voluntate hominum, nihil fallacius ratione tota comitiorum. Quis L. Philippum summo ingenio, opera,	608:617	0:1218
honor	NN	[-100,0]	1	17_40	 	, declaravit, quam odisset senatum, cum auctorem senatus exstinctum laete atque insolenter tulit. Non igitur magis Leptines Octavium nec Veientium rex eos, quos modo nominavi, quam Ser. Sulpicium occidit Antonius. Is enim profecto mortem attulit, qui causa mortis fuit. Quocirca etiam ad posteritatis memoriam pertinere arbitror extare, quod fuerit de hoc bello iudicium senatus. Erit enim statua ipsa testis bellum tam grave fuisse, ut legati interitus honoris memoriam consecutus sit. Quodsi excusationem Ser. Sulpici, patres conscripti, legationis obeundae recordari volueritis, nulla dubitatio relinquetur, quin honore mortui, quam vivo iniuriam fecimus, sarciamus. Vos enim, patres conscripti( grave dictu est sed dicendum tamen), vos, inquam, Ser. Sulpicium vita privastis; quem cum videretis re magis morbum quam oratione excusantem, non vos quidem crudeles fuistis( quid enim minus in hunc ordinem convenit?), sed, cum speraretis nihil esse, quod non illius auctoritate et sapientia effici posset, vehementius excusationi obstitistis atque eum, qui semper vestrum consensum gravissimum iudicavisset, de sententia deiecistis. Ut vero Pansae consulis accessit cohortatio gravior, quam	616:622	0:1191
honor	NN	[-100,0]	1	17_41	 	, eloquentia. Quare meo quidem animo nihilo minus eloquentiae studendum est, etsi ea quidam et privatim et publice abutuntur; sed eo quidem vehementius, ne mali magno cum detrimento bonorum et communi omnium pernicie plurimum possint, cum praesertim hoc sit unum, quod ad omnes res et privatas et publicas maxime pertineat, hoc tuta, hoc honesta, hoc inlustris, hoc eodem vita iucunda fiat. Nam hinc ad rem publicam plurima commoda veniunt, si moderatrix omnium rerum praesto est sapientia; hinc ad ipsos, qui eam adepti sunt, laus, honos, dignitas confluit; hinc amicis quoque eorum certissimum et tutissimum praesidium comparatur. Ac mihi quidem videntur homines, cum multis rebus humiliores et infirmiores sint, hac re maxime bestiis praestare, quod loqui possunt. Quare praeclarum mihi quiddam videtur adeptus is, qui, qua re homines bestiis praestent, ea in re hominibus ipsis antecellat. Hoc si forte non natura modo neque exercitatione conficitur, verum etiam artificio quodam comparatur, non alienum est videre, quae dicant ii, qui quaedam eius rei praecepta nobis reliquerunt. Sed antequam de praeceptis oratoriis dicimus	533:538	0:1131
honor	NN	[-100,0]	1	17_42	 	, et ea pedestris, quam inaurata equestris, qualis L. Sullae primum statuta est. Mirifice enim Servius maiorum continentiam diligebat, huius saeculi insolentiam vituperabat. Ut igitur, si ipsum consulam, quid velit, sic pedestrem ex aere statuam tamquam ex eius auctoritate et voluntate decerno; quae quidem magnum civium dolorem et desiderium honore monumenti minuet et leniet. Atque hanc meam sententiam, patres conscripti, P. Servili sententia comprobari necesse est, qui sepulchrum publice decernendum Ser. Sulpicio censuit, statuam non censuit. Nam si mors legati sine caede atque ferro nullum honorem desiderat, cur decernit honorem sepulturae, qui maximus haberi potest mortuo? Sin id tribuit Ser. Sulpicio, quod non est datum Cn. Octavio, cur, quod illi datum est, huic dandum esse non censet? Maiores quidem nostri statua multis decreverunt, sepulchra paucis. Sed statuae intereunt tempestate, vi, vetustate, sepulchrorum autem sanctitas in ipso solo est, quod nulla vi moveri neque deleri potest, atque, ut cetera extinguuntur, sic sepulchra sanctiora fiunt vetustate. Augeatur igitur isto honore etiam is vir, cui nullus honos tribui non debitus	599:606	0:1157
honor	NN	[-100,0]	1	17_43	 	, et prae se ferre quemadmodum si non dedatur obses, pro rupto foedus se habiturum, sic deditam intactam inviolatamque ad suos remissurum. Utrimque constitit fides; et Romani pignus pacis ex foedere restituerunt, et apud regem Etruscum non tuta solum sed honorata etiam virtus fuit, laudatamque virginem parte obsidum se donare dixit; ipsa quos vellet legeret. Productis omnibus elegisse impubes dicitur; quod et virginitati decorum et consensu obsidum ipsorum probabile erat eam aetatem potissimum liberari ab hoste quae maxime opportuna iniuriae esset. Pace redintegrata Romani novam in femina virtutem novo genere honoris, statua equestri, donavere; in summa Sacra via fuit posita virgo insidens equo. Huic tam pacatae profectioni ab urbe regis Etrusci abhorrens mos traditus ab antiquis usque ad nostram aetatem inter cetera sollemnia manet, bona Porsennae regis vendendi. Cuius originem moris necesse est aut inter bellum natam esse neque omissam in pace, aut a mitiore crevisse principio quam hic prae se ferat titulus bona hostiliter vendendi. Proximum vero est ex iis quae traduntur Porsennam discedentem ab Ianiculo castra opulenta, convecto ex propinquis ac fertilibus Etruriae arvis commeatu, Romanis dono dedisse,	617:624	0:1226
honor	NN	[-100,0]	1	17_44	 	, et praeter equos virosque et si quid argenti( quod plurimum in phaleris equorum erat; nam ad vescendum facto perexiguo, utique militantes, utebantur) omnis cetera praeda diripienda data est. Tum sepeliendi causa conferri in unum corpora suorum iussit; ad octo milia fuisse dicuntur fortissimorum virorum. consulem quoque Romanum conquisitum sepultumque quidam auctores sunt. Eos qui Canusium perfugerant mulier Apula nomine Busa, genere clara ac divitiis, moenibus tantum tectisque a Canusinis acceptos, frumento, veste, viatico etiam iuvit, pro qua ei munificentia postea bello perfecto ab senatu honores habiti sunt. Ceterum cum ibi tribuni militum quattuor essent, Fabius Maximus de legione prima, cuius pater priore anno dictator fuerat, et de legione secunda L. Publicius Bibulus et P. Cornelius Scipio et de legione tertia Ap. Claudius Pulcher, qui proxime aedilis fuerat, omnium consensu ad P. Scipionem admodum adulescentem et ad Ap. Claudium summa imperii delata est. Quibus consultantibus inter paucos de summa rerum nuntiat P. Furius Philus, consularis viri filius, nequiquam eos perditam spem fovere; desperatam comploratamque rem esse publicam; nobiles iuvenes quosdam, quorum principem	600:607	0:1202
honor	NN	[-100,0]	1	17_45	 	, et unum mane duorum: </line><line> sideris et floris nam domina una Venus. </line><line> forsan et unus odor: sed celsior ille per auras </line><line> difflatur, spirat proximus iste magis. </line><line> communis Paphie dea sideris et dea floris </line><line> praecipit unius muricis esse habitum. </line><line> momentum intererat quo se nascentia florum </line><line> germina comparibus dividerent spatiis. </line><line> haec viret angusto foliorum tecta galero, </line><line> hanc tenui filo purpura rubra notat, </line><line> haec aperit primi fastigia celsa obelisci, </line><line> mucronem absolvens purpurei capitis. </line><line> vertice collectos illa exinuabat amictus, </line><line> iam meditans foliis se numerare suis. </line><line> nec mora: ridentis calathi patefecit honorem, </line><line> prodens inclusi stamina densa croci. </line><line> haec, modo quae toto rutilaverat igne comarum, </line><line> pallida conlapsis deseritur foliis. </line><line> mirabar celerem fugitiva aetate rapinam, </line><line> et dum nascuntur consenuisse rosas. </line><line> ecce et defluxit rutili coma punica floris </line><line> dum loquor, et tellus tecta rubore micat. </line><line> tot species tantosque ortus variosque novatus </line><line> una dies aperit, conficit ipsa dies. </line><line> conquerimur, Natura, brevis quod gratia florum: </line><line> ostentata oculis ilico dona rapis. </line><line> quam longa una dies, aetas tam longa rosarum, </line><line> quas pubescentes iuncta senecta premit. </line><line> quam modo nascentem rutilus conspexit Eoos	784:791	0:1566
honor	NN	[-100,0]	1	17_46	 	, experiretur. Itaque non illum vis hiemis, non nives, non longitudo itineris, non asperitas viarum, non morbus ingravescens retardavit, cumque iam ad congressum colloquiumque eius pervenisset ad quem erat missus, in ipsa cura ac meditatione obeundi sui muneris excessit e vita. Ut igitur alia, sic hoc, C. Pansa, praeclare, quod et nos ad honorandum Ser. Sulpicium cohortatus es et ipse multa copiose de illius laude dixisti. Quibus a te dictis nihil praeter sententiam dicerem, nisi P. Servilio, clarissimo viro, respondendum putarem, qui hunc honorem statuae nemini tribuendum censuit nisi ei, qui ferro esset in legatione interfectus. Ego autem, patres conscripti, sic interpretor sensisse maiores nostros, ut causam mortis censuerint, non genus esse quaerendum. Etenim cui legatio ipsa causa mortis fuisset, eius monumentum exstare voluerunt, ut in bellis periculosis obirent homines legationis munus audacius. Non igitur exempla maiorum quaerenda, sed consilium est eorum, a quo ipsa exempla nata sunt explicandum. Lars Tolumnius, rex Veientium, quattuor legatos populi Romani Fidenis interemit, quorum statuae steterunt usque ad meam memoriam in rostris	546:553	0:1161
honor	NN	[-100,0]	1	17_47	 	, facies cum bona teste caret. </line><line> tu licet et Thamyran superes et Amoebea cantu, </line><line> non erit ignotae gratia magna lyrae. </line><line> si Venerem Cous nusquam posuisset Apelles, </line><line> mersa sub aequoreis illa lateret aquis. </line><line> quid petitur sacris, nisi tantum fama, poetis? </line><line> hoc votum nostri summa laboris habet. </line><line> cura deum fuerant olim regumque poetae, </line><line> praemiaque antiqui magna tulere chori; </line><line> sanctaque maiestas et erat venerabile nomen </line><line> vatibus, et largae saepe dabantur opes. </line><line> Ennius emeruit, Calabris in montibus ortus, </line><line> contiguus poni, Scipio magne, tibi. </line><line> nunc hederae sine honore iacent operataque doctis </line><line> cura vigil Musis nomen inertis habet. </line><line> sed famae vigilare iuvat: quis nosset Homerum, </line><line> Ilias aeternum si latuisset opus? </line><line> quis Danaen nosset, si semper clusa fuisset </line><line> inque sua turri perlatuisset anus? </line><line> utilis est vobis, formosae, turba, puellae. </line><line> saepe vagos ultra limina ferte pedes. </line><line> ad multas lupa tendit oves, praedetur ut unam, </line><line> et Iovis in multas devolat ales aves. </line><line> se quoque det populo mulier speciosa videndam; </line><line> quem trahat, e multis forsitan unus erit. </line><line> omnibus illa locis maneat studiosa placendi </line><line> et curam tota	726:732	0:1452
honor	NN	[-100,0]	1	17_48	 	, fecissem id quod his vehementer placebat, ut te, cuius testimonium propter turpitudinem vitae sordisque domesticas nullius momenti putaretur, tacitus dimitterem; nemo enim horum aut ita te refutandum ut gravem adversarium aut ita rogandum ut religiosum testem arbitrabatur. sed fui paulo ante intemperantior fortasse quam debui; odio enim tui, in quo etsi omnis propter tuum in me scelus superare debeo, tamen ab omnibus paene vincor, sic sum incitatus ut, cum te non minus contemnerem quam odissem, tamen vexatum potius quam despectum vellem dimittere. qua re ne tibi hunc honorem a me haberi forte mirere, quod interrogem quem nemo congressu, nemo aditu, nemo suffragio, nemo civitate, nemo luce dignum putet, nulla me causa impulisset nisi ut ferocitatem istam tuam comprimerem et audaciam frangerem et loquacitatem paucis meis interrogationibus inretitam retardarem. etenim debuisti, Vatini, etiam si falso venisses in suspicionem P. Sestio, tamen mihi ignoscere, si in tanto hominis de me optime meriti periculo et tempori eius et voluntati parere voluissem. sed( te) hesterno( die) pro testimonio esse mentitum, cum adfirmares nullum tibi omnino	576:583	0:1154
honor	NN	[-100,0]	1	17_49	 	, frons non percussa, non femur; pedis, quod minimum est, nulla supplosio. itaque tantum afuit ut inflammares nostros animos, somnum isto loco vix tenebamus.; sic nos summi oratoris vel sanitate vel vitio pro argumento ad diluendum crimen usi sumus. </section><section> Hoc modo, inquam. cum honos sit praemium virtutis iudicio studioque civium delatum ad aliquem, qui eum sententiis, qui suffragiis adeptus est, is mihi et honestus et honoratus videtur. qui autem occasione aliqua etiam invitis suis civibus nactus est imperium, ut ille cupiebat, hunc nomen honoris adeptum, non honorem puto. quae si ille audire voluisset, maxuma cum gratia et gloria ad summam amplitudinem pervenisset, ascendens gradibus magistratuum, ut pater eius fecerat, ut reliqui clariores viri. quae quidem etiam cum P. Crasso M. f.,; cum; initio aetatis ad amicitiam se meam contulisset, saepe egisse me arbitror, cum eum vementer hortarer, ut eam laudis viam rectissimam esse duceret, quam maiores eius ei tritam reliquissent. </section><section> Erat enim cum institutus optume tum etiam perfecte planeque eruditus, ineratque et ingenium satis acre et orationis	559:566	0:1142
