lemma	pos	date	grouping	identifier	description	context	indexes_target_token	indexes_target_sentence
honor	NN	[-100,0]	1	17_50	 	, habebunt aliquid offensionis, animi deformitas non habebit? Cuius turpitudo ex ipsis uitiis facillime perspici potest. Quid enim foedius auaritia, quid immanius libidine, quid contemptius timiditate, quid abiectius tarditate et stultitia dici potest? Quid ergo? Eos qui singulis uitiis excellunt aut etiam pluribus, propter damna aut detrimenta aut cruciatus aliquos miseros esse dicimus, an propter uim turpitudinemque uitiorum? Quod item ad contrariam laudem; de; uirtute dici potest. Nam si propter alias res uirtus expetitur, melius esse aliquid quam uirtutem necesse est: pecuniamne igitur an honores an formam an ualetudinem? Quae et quom adsunt perparua sunt, et quam diu adfutura sint, certum sciri nullo modo potest. An id quod turpissimum dictu est, uoluptatem? At in ea quidem spernenda et repudianda uirtus uel maxime cernitur. Sed uidetisne quanta series rerum sententiarumque sit, atque ut ex alio alia nectantur? Quin labebar longius, nisi me retinuissem. Qvintvs: Quo tandem? Libenter enim, frater, quo ista oratione; tendis; tecum prolab; ar;. Marcvs: Ad finem bonorum, quo referuntur et quoius	600:607	0:1114
honor	NN	[-100,0]	1	17_51	 	, hoc populo certe non vererer. Quis enim umquam tam secunda contione legem agrariam suasit quam ego dissuasi? si hoc dissuadere est ac non disturbare atque pervertere. Ex quo intellegi, Quirites, potest nihil esse tam populare quam id quod ego vobis in hunc annum consul popularis adfero, pacem, tranquillitatem, otium. Quae nobis designatis timebatis, ea ne accidere possent consilio meo ac ratione provisa sunt. Non modo vos eritis in otio qui semper esse volueratis, verum etiam istos quibus odio est otium quietissimos atque otiosissimos reddam. Etenim illis honores, potestates, divitiae ex tumultu atque ex dissensionibus civium comparari solent; vos, quorum gratia in suffragiis consistit, libertas in legibus, ius in iudiciis et aequitate magistratuum, res familiaris in pace, omni ratione otium retinere debetis. Nam si ei qui propter desidiam in otio vivunt, tamen in sua turpi inertia capiunt voluptatem ex ipso otio, quam vos fortunati eritis, si; in; hoc statu quem habetis vestra non ignavia quaesitum, sed virtute partum, otium tenueritis, Quirites! Ego ex concordia quam mihi constitui cum conlega,	564:571	0:1116
honor	NN	[-100,0]	1	17_52	 	, honorem coniungi. Atque utinam, patres conscripti,[ civibus] omnibus solvere nobis praemia liceret! quamquam nos ea, quae promisimus, studiose cumulata reddemus. Sed id quidem restat, ut spero, victoribus, quibus senatus fides praestabitur: quam quoniam difficillimo rei publicae tempore secuti sunt, eos numquam oportebit consilii sui paenitere. Sed facile est bene agere cum iis, a quibus etiam tacentibus flagitari videmur; illud admirabilius et maius maximeque proprium senatus sapientis est, grata eorum virtutem memoria prosequi, qui pro patria vitam profuderunt. Quorum de honore utinam mihi plura in mentem venirent! Duo certe non praeteribo, quae maxime occurrunt, quorum alterum pertinet ad virorum fortissimorum gloriam sempiternam, alterum ad leniendum maerorem et luctum proximorum. Placet igitur mihi, patres conscripti, legionis Martiae militibus et eis, qui una pugnantes occiderint, monumentum fieri quam amplissimum. Magna atque incredibilia sunt in rem publicam huius merita legionis. Haec se prima latrocinio abrupit Antoni, haec tenuit Albam, haec se ad Caesarem contulit, hanc imitata quarta legio parem virtutis gloriam consecuta est. Quarta victrix desiderat neminem; ex	582:588	0:1197
honor	NN	[-100,0]	1	17_53	 	, hostem venisse senserunt. Ad horum omnium iudicia tot atque tanta domesticum iudicium accessit sententiae damnationis tuae, occultus adventus, furtivum iter per Italiam, introitus in urbem desertus ab amicis, nullae ad senatum e provincia litterae, nulla ex trinis aestivis gratulatio, nulla triumphi mentio; non modo quid gesseris sed ne quibus in locis quidem fueris dicere audes. Ex illo fonte et seminario triumphorum cum arida folia laureae rettulisses, cum ea abiecta ad portam reliquisti, tum tu ipse de te; FECISSE VIDERI; pronuntiavisti. Qui si nihil gesseras dignum honore, ubi exercitus, ubi sumptus, ubi imperium, ubi illa uberrima supplicationibus triumphisque provincia? Sin autem aliquid sperare potueras, si cogitaras id quod imperatoris nomen, quod laureati fasces, quod illa tropaea plena dedecoris et risus te commentatum esse declarant, quis te miserior, quis te damnatior, qui neque scribere ad senatum a te bene rem publicam esse gestam neque praesens dicere ausus es? </section>  <section> [ XLI] An tu mihi cui semper ita persuasum fuerit non eventis sed factis cuiusque fortunam ponderari, neque in tabellis paucorum iudicum sed in sententiis omnium	578:584	0:1177
honor	NN	[-100,0]	1	17_54	 	, idemque, cum actorum Caesaris defensor esse deberet, et in publicis et in privatis rebus acta Caesaris rescidit. In publicis nihil est lege gravius, in privatis firmissimum est testamentum. Leges alias sine promulgatione sustulit, alias ut tolleret, promulgavit. Testamentum irritum fecit, quod etiam infimis civibus semper optentum est. Signa, tabulas, quas populo Caesar una cum hortis legavit, eas hic partim in hortos Pompei deportavit, partim in villam Scipionis.[ XLIII] Et tu in Caesaris memoria diligens, tu illum amas mortuum? Quem is honorem maiorem consecutus erat, quam ut haberet pulvinar, simulacrum, fastigium, flaminem? Est ergo flamen, ut Iovi, ut Marti, ut Quirino, sic divo Iulio M. Antonius. Quid igitur cessas? Cur non inauguraris? Sume diem, vide, qui te inauguret; conlegae sumus; nemo negabit. O detestabilem hominem, sive[ eo] quod Caesaris sacerdos es sive quod mortui! Quaero deinceps, num, hodiernus dies qui sit, ignores. Nescis heri quartum in Circo diem ludorum Romanorum fuisse? te autem ipsum ad populum	546:553	0:1039
honor	NN	[-100,0]	1	17_55	 	, ideo nominatio in locum eius non est facta. C. Claudius flamen Dialis quod exta perperam dederat flamonio abiit. Per idem tempus M. Valerius Laevinus temptatis prius per secreta conloquia principum animis ad indictum ante ad id ipsum concilium Aetolorum classe expedita venit. ubi cum Syracusas Capuamque captas in fidem in Italia Siciliaque rerum secundarum ostentasset, adiecissetque iam inde a maioribus traditum morem Romanis colendi socios, ex quibus alios in civitatem atque aequum se cum ius accepissent, alios in ea fortuna haberent ut socii esse quam cives mallent: Aetolos eo in maiore futuros honore quod gentium transmarinarum in amicitiam primi venissent; Philippum eis et Macedonas graves accolas esse, quorum se vim ac spiritus et iam fregisse et eo redacturum esse ut non iis modo urbibus quas per vim ademisset Aetolis excedant, sed ipsam Macedoniam infestam habeant; et Acarnanas quos aegre ferrent Aetoli a corpore suo diremptos restituturum se in antiquam formulam iurisque ac dicionis eorum;- haec dicta promissaque a Romano imperatore Scopas, qui tum praetor gentis erat, et Dorimachus princeps Aetolorum adfirmaverunt auctoritate sua, minore cum verecundia et maiore cum fide vim maiestatemque populi Romani	606:612	0:1233
honor	NN	[-100,0]	1	17_56	 	, iis immunitatem dederunt; quae partium Antiochi fuerant aut stipendiariae Attali regis, eas omnes vectigal pendere Eumeni iusserunt. Nominatim praeterea Colophoniis, qui in Notio habitant, et Cymaeis et Mylasenis immunitatem concesserunt; Clazomeniis super immunitatem et Drymussam insulam dono dederunt, et Milesiis quem sacrum appellant agrum restituerunt, et Iliensibus Rhoeteum et Gergithum addiderunt, non tam ob recentia ulla merita quam originum memoria. Eadem et Dardanum liberandi causa fuit. Chios quoque et Zmyrnaeos et Erythraeos pro singulari fide, quam eo bello praestiterunt, et agro donarunt et in omni praecipuo honore habuerunt. Phocaeensibus et ager, quem ante bellum habuerant, redditus, et ut legibus antiquis uterentur permissum. Rhodiis adfirmata, quae data priore decreto erant; Lycia et Caria datae usque ad Maeandrum amnem praeter Telmessum. Regi Eumeni Chersonesum in Europa et Lysimachiam, castella, vicos, agrum, quibus finibus tenuerat Antiochus, adiecerunt; in Asia Phrygiam utramque- alteram ad Hellespontum, maiorem alteram vocant- et Mysiam, quam Prusia rex ademerat, ei restituerunt, et Lycaoniam et Milyada et Lydiam et nominatim urbes Tralles atque Ephesum et Telmessum.	631:637	0:1210
honor	NN	[-100,0]	1	17_57	 	, in iis potissimum elaborabimus. sin aliquando necessitas nos ad ea detruserit, quae nostri ingenii non erunt, omnis adhibenda erit cura, meditatio, diligentia, ut ea, si non decore, at quam minime indecore facere possimus, nec tam est enitendum, ut bona, quae nobis data non sint, sequamur, quam ut vitia fugiamus. </section><section> Ac duabus iis personis, quas supra dixi, tertia adiungitur, quam casus aliqui aut tempus imponit, quarta etiam, quam nobismet ipsis iudicio nostro accommodamus. nam regna, imperia, nobilitatem, honores, divitiae, opes eaque, quae sunt his contraria, in casu sita temporibus gubernantur; ipsi autem gerere quam personam velimus, a nostra voluntate proficiscitur. Itaque se alii ad philosophiam, alii ad ius civile, alii ad eloquentiam applicant, ipsarumque virtutum in alia alius mavult excellere. Quorum vero patres aut maiores aliqua gloria praestiterunt, ii student plerumque eodem in genere laudis excellere, ut Q. Mucius P. f. In iure civili, Pauli filius Africanus in re militari. quidam autem ad eas laudes quas a patribus acceperunt, addunt aliquam	531:538	0:1093
honor	NN	[-100,0]	1	17_58	 	, in invidiam falso crimine adduxerit. Ne noster quidem Gratidianus officio viri boni functus est tum, cum praetor esset, collegiumque praetorium tribuni plebi adhibuissent, ut res nummaria de communi sententia constitueretur; iactabatur enim temporibus illis nummus sic, ut nemo posset scire, quid haberet. Conscripserunt communiter edictum cum poena atque iudicio constitueruntque, ut omnes simul in rostra post meridiem escenderent. Et ceteri quidem alius alio: Marius ab subselliis in rostra recta idque, quod communiter compositum fuerat, solus edixit. Et ea res, si quaeris, ei magno honori fuit; omnibus vicis statuae, ad eas tus, cerei. Quid multa? Nemo umquam multitudini fuit carior. Haec sunt, quae conturbent in deliberatione non numquam, cum id, in quo violatur aequitas, non ita magnum, illud autem, quod ex eo paritur, permagnum videtur, ut Mario praeripere collegis et tribunis plebi popularem gratiam non ita turpe, consulem ob eam rem fieri, quod sibi tum proposuerat, valde utile videbatur. Sed omnium una regula est, quam tibi cupio esse notissimam: aut illud, quod utile videtur	590:596	0:1100
honor	NN	[-100,0]	1	17_59	 	, inquit. Non centurioni quidem solum, sed equiti etiam Romano; itaque viri fortissimi atque honestissimi, qui ordines duxerunt, res et iudicant et iudicaverunt.'' Non quaero'' inquit,'' istos. Quicumque ordinem duxit, iudicet''. At si ferretis, quicumque equo meruisset, quod est lautius, nemini probaretis; in iudice enim spectari et fortuna debet et dignitas.'' Non quaero'', inquit,'' ista; addo etiam iudices manipularis ex legione Alaudarum. Aliter enim nostri negant posse se salvos esse.'' O contumeliosum honorem iis, quos ad iudicandum nec opinantis vocatis! Hic enim est legis index, ut ii res in tertia decuria iudicent, qui libere iudicare non audeant. In quo quantus error est, di immortales, eorum, qui istam legem excogitaverunt! Ut enim quisque sordidissimus videbitur, ita libentissime severitate iudicandi sordes suas eluet laborabitque, ut honestis decuriis potius dignus videatur quam in turpem iure coniectus. Altera promulgata lex est, ut et de vi et maiestatis damnati ad populum provocent, si velint. Haec utrum tandem lex est an legum omnium dissolutio	514:521	0:1079
honor	NN	[1400,1600]	2	17_0	 	- androhn g- te g- theohn g- te, id est, Pater hominumque Deumque. Et nos sic a Christo praeceptore docti, Deum omnium haud dubie Principem, Patris uocabulo compellamus.[,] Quid autem foedius aut exsecrabilius illa compellatione, quam apud Homerum Achilles, opinor, iacit in Principem sibi gerentemimperium, non populo, g- dehmoboros g- basileus. Nihil enim reperit iratus ille, quod probrosius diceret in eum, quem imperio iudicabat indignum, nisi quod populum deuoraret. At idem Homerus, si quem Regem honoris gratia nominat, g- poimena g- laohn solet appellare, hoc est, populi pastorem. Plurimum autem interest inter pastorem et praedonem. Quanam igitur fronte sibi Principis titulum uindicant, qui paucos et eos sceleratissimos e suorum numero deligunt, per quos arte repertis praetextibus, et subinde nouatis titulis, populi uires simul et opes exhauriunt, in suum conuerrunt fiscum, siue quod inclementer extorserunt, aut prodigunt nequiter in uoluptatibus, aut insumunt crudeliter in bellis: et ut quisque in his maxime ueteratorem agere potest, ita plurimi faciunt, perinde quasi	504:511	0:1089
honor	NN	[100,200]	2	17_1	 	- non modo turpissima, sed et perniciosa adulatione. Tamquam si habens imperatorem alterum appelles, nonne maximam et inexorabilem offensam contrahes eius, quem habuisti, etiam ipsi timendam, quem appellasti? Esto religiosus in deum, qui vis illum propitium imperatori! Desine alium deum credere atque ita et hunc deum dicere, cui deo opus est! Si non de mendacio erubescit adulatio eiusmodi hominem deum appellans, timeat saltim de infausto: Maledictum est ante apotheosin deum Caesarem nuncupari. </section><section> Propterea igitur publici hostes Christiani, quia imperatoribus neque vanos neque mentientes neque temerarios honores dicant, quia verae religionis homines etiam solemnia eorum conscientia potius quam lascivia celebrant. Grande videlicet officium focos et toros in publicum educere, vicatim epulari, civitatem tabernae habitu abolefacere, vino lutum cogere, catervatim cursitare ad iniurias, ad impudentias, ad libidinis illecebras! Sicine exprimitur publicum gaudium per dedecus publicum? Haecine solemnes dies principum decent, quae alios dies non decent? Qui observant disciplinam de Caesaris respectu, hi eam propter Caesarem deserunt, et malorum morum licentia pietas erit, occasio luxuriae religio deputabitur! O nos merito damnandos! Cur	628:635	0:1263
honor	NN	[1000,1200]	2	17_2	 	--------------------------------------------------------------------- </section><section> IN FERIA QUINTA PENTECOSTES Tam ipsum diem Paschae quam Pentecostes dono Spiritus sancti legimus insigniri, ut non solum hanc, uerum etiam illam solemnitatem, quae praecipuae habentur, ad honorem quoque Spiritus sancti referendas esse sciamus. Ut enim Ioannes commemorat, . . cum esset sero die illo, et fores essent clausae ubi erant discipuli congregati propter metum Iudaeorum, uenit Iesus, et stetit in medio eorum, et dixit eis:; Pax uobis.; Et cum haec dixisset, ostendit eis menus et latus. Gauisi sunt ergo discipuli uiso Domino. Dicit ergo eis iterum Iesus:; Pax uobis, sicut misit me Pater, et ego mitto uos.; Haec cum dixisset, insufflauit et dixit illis:; Accipite	278:285	0:767
honor	NN	[700,800]	2	17_4	 	, </line><line> Aelffleda, conloquium perpes reticere memento, </line><line> Absolvar donec vinclis et carcere carnis.; </line><line> Nec mora, veriloqui complentur in ordine dicta. </line><line> Ecclesiae iussis, precibus lacrimisque coactus </line><line> Vatis et ipse genas luctu perfusus amaro </line><line> Dulcibus extrahitur latebris populisque regendis </line><line> Praeficitur, modio lateat ne tecta lucerna, </line><line> Sed iubar alticomum Domini diffundat in aedem. </line><line> Ecclesiam gemino qui rexit episcopus anno </line><line> Et priscis properavit ovans se reddere lustris. </line><line> Utque satisfieret vatis per singula dictis, </line><line> Sol magnum explevit solitis sub mensibus annum, </line><line> Pictorum infesto dum doncidit Ecgfridus ense </line><line> Et Nothus in regni frater successit honorem, </line><line> Scottorum qui tum versatus in incola terris </line><line> Caelestem intento spirabat corde sophiam, </line><line> Nam patriae fines et dulcia liquerat arva, </line><line> Sedulus ut Domini misteria disceret exul. </line><line> Huius nunc Tyrio venerabile pignus in ostro </line><line> Iure datas patrio sceptri iam tractat habenas, </line><line> Utque novus Iosia fideque animoque magis quam </line><line> Annis maturus, nostrum regit inclitus orbem. </section></line><line><section> Ergo sacerdotis summi fastigia nactus, </line><line> Mente manu fulget Cuthbertus et ore coruscus </line><line> Commissosque greges precibus monitisque tuetur. </line><line> Pauperibus qui dives, inops sibi, blandus amaris, </line><line> In turbis monachus, neque enim vel tegmina sueta </line><line> Arida vel heremi	827:834	0:1652
honor	NN	[400,500]	2	17_5	 	, </line><line> Arbitrium nostrum si uis externa teneret. </line><line> Uerum si quid obest uirtuti, animosque retardat. </line><line> Non superi pariunt ignes, nec ab aethere manat: </line><line> Sed nostris oritur de cordibus; ipsaque bellum </line><line> Libertas mouet, et quatimur ciuilibus armis: </line><line> Otia cum mollis complexa ignaua uoluptas </line><line> Difficili negat ire uia, brauioque potitos </line><line> Ardua quaeque piget pro spe temptare latenti. </line><line> Cumque haec intus agi prospexit callidus hostis, </line><line> De studiis uestris uires capit: utque parentis </line><line> Auertat ueri cultum, persuadet ab astris </line><line> Fata seri, frustraque homines contendere diuis, </line><line> Hinc uario uitae dominos mercantur honore. </line><line> Error abi, procul error abi: satis agnita prisci </line><line> Sunt commenta doli, monitos quibus Omnipotens nos </line><line> Elaqueat, cultusque docet uitare profanos. </line><line> Scimus enim quanta steterit mercede quibusdam </line><line> Sidus adoratum Rempham, uenerataque caeli </line><line> Militia, et cultus Soli Lunaeque dicatus. </line><line> Nec latet haec uerbis hominis subsistere iussa </line><line> Ad uocem seruisse mora, noctisque repulsae </line><line> Temporibus creuisse diem: cum lux famulata </line><line> Nesciret nisi quem faceret uictoria finem. </line><line> Nouimus et caelo praescriptas condiciones </line><line> Arbitrio quondam sancti mansisse prophetae; </line><line> Cum positum ad tempus clausos, sitientibus agris, </line><line> Non licuit rorare polos; ipsumque	765:771	0:1587
honor	NN	[400,700]	2	17_6	 	, </line><line> aspicit instantem huic saeui daemonis umbram, </line><line> horrificam facie, truculentam corpore pestem. </line><line> quam procul intendens sanctus flatu oris abegit. </line><line> iudex dum se ipsum putat exsufflasse beatum: </line>  <line> " cur, bone pastor" ait" tua nos iniuria uexat </line><line> indignosque facit despectio flatilis aurae? </line><line> quem pater egregius responso affatur amico: </line>  <line> " haec tibi non facimus probrosi sorte reatus, </line><line> sed, male quae incubuit ceruici, flauimus umbrae; </line><line> mox tamen illa fugit subsellia larua satelles </line><line> et ceruice sedens inuasa sedilia liquit". </line><line> libertate noua surgunt colla Auitiani. </line><line> exoneratus enim iudex reuocatur honori, </line><line> mitior atque fuit, grauis implacabilis olim. </line><line> Mirum aliud uico quod contigit Ambaciensi: </line><line> idola turrito fuerant educta metallo, </line><line> eximie saxis moles onerata politis, </line><line> in sublime thronum procedens aede superba, </line><line> falsa superstitio, deceptio uera precantum, </line><line> grande opus ad facinus, faciens nihil esse colentes; </line><line> quod cum sanctus ouans mandasset rite ruendum </line><line> humanis opibus neque hoc auerteret ullus, </line><line> tum sacer antistes adsueta per arma recurrens, </line><line> peruigil insistens nocturnis excubat horis, </line><line> alloquiis domini taciturna silentia rumpens. </line><line> sed cum mane recens auroram spargeret orbi </line><line> tenderet et croceum per nubila Phoebus amictum	765:771	0:1585
honor	NN	[0,100]	2	17_7	 	, </line><line> coepta refer paulumque moras et foedera necte </line><line> consiliis atque arte tua. sponde affore reges </line><line> dis genitos, quis arma uolens, quis agmina iungat." </line><line> at uirgo, quamquam insidias aestusque nouercae </line><line> sentiat et blandos quaerentem fingere uultus, </line><line> obsequitur tamen et iussas petit ocius oras. </line><line> Ingemuit Iuno tandemque silentia rumpit. </line>  <line> " en labor, en odiis caput insuperabile nostris! </line><line> quam Nemeen tot fessa minis, quae belua Lernae </line><line> experiar? Phrygiis ultro concurrere monstris </line><line> nempe uirum et pulso reserantem Pergama ponto </line><line> uidimus. en ego nunc regum soror, et mihi gentis </line><line> ullus honos? iam tum indecores iussaeque dolorum </line><line> primitiae et tenero superati protinus angues. </line><line> debueram nullos iuueni iam quaerere casus </line><line> uicta nec ad tales forsan descendere pugnas. </line><line> uerum animis insiste tuis actumque </line><line> tende, pudor; mox et Furias Ditemque mouebo." </line><line> haec ait et pariter laeui iuga pinea montis </line><line> respicit ac pulchro uenantes agmine nymphas, </line><line> undarum nemorumque decus. leuis omnibus arcus </line><line> et manicae uirides et stricta myrtus habena, </line><line> summo palla genu, tenui uagus innatat aura </line><line> crinis ad obscurae decurrens cingula mammae. </line><line> ipsa citatarum tellus pede plausa sororum </line><line> personat et teneris summittit gramina plantis	751:756	0:1546
honor	NN	[400,700]	2	17_8	 	, </line><line> cuiusque est oriens ex alto nomen honoris, </line><line> qui nos lumen agens uisitat in tenebris, </line><line> qui uenit de Edom, de Bosra ueste cruenta, </line><line> pulcher, sanguineus, candidus atque rubrus, </line><line> calcaturus erat qui solus torcular altum. </line><line> in cruce pensandus, membra cruore leuans. </line><line> unde sibi micuit stola candida, tincta rubore, </line><line> quem ante et uel post quem non deus ullus erit, </line><line> cuius transcendit sacra magnificentia caelos, </line><line> cuncta tegens palma, sidera rura freta: </line><line> quis te tunc sensus, domini pia mater, habebat, </line><line> cum tibi talis erat fetus honore nouus? </line><line> praemia quanta uterum implebant et gaudia pectus, </line><line> caelorum artificem cum tua ferret humus? </line><line> o meritis radians dic, uirgo, putasne uidebas </line><line> angelicos cursus ire, redire nouos, </line><line> militiam caeli cum te seruare uicissim </line><line> sentires animo, saepe leuata manu </line><line> quae circa te acies, uel quando iter ire parares, </line><line> milia per gressus concomitando tuos? </line><line> quid Michahel faceret ductor sub principe celso! </line><line> quid gereret Gabrihel, nuntius ille sacer? </line><line> qualiter aut Rafahel occursum impenderet almae, </line><line> te portante deum dum putat esse thronum? </line><line> credo alter cuperet plantis substernere plumas, </line>	680:686	0:1446
honor	NN	[0,100]	2	17_9	 	, </line><line> doctus et Auchates patulo uaga uincula gyro </line><line> spargere et extremas laqueis adducere turmas. </line><line> non ego sanguineis gestantem tympana bellis </line><line> Thyrsageten cinctumque uagis post terga silebo </line><line> pellibus et nexas uiridantem floribus hastas. </line><line> fama ducem Iouis et Cadmi de sanguine Bacchum </line><line> hac quoque turiferos, felicia regna, Sabaeos, </line><line> hac Arabas fudisse manu, mox, rumperet Hebri </line><line> cum uada, Thyrsagetas gelida liquisse sub Arcto. </line><line> illis omnis adhuc ueterum tenor et sacer aeris </line><line> pulsus et eoae memoratrix tibia pugnae. </line><line> iungit opes Emeda suas: sua signa secuti </line><line> Exomatae Torynique et flaui crine Satarchae; </line><line> mellis honor Torynis, ditant sua mulctra Satarchen, </line><line> Exomatas uenatus alit, nec clarior ullis </line><line> Arctos equis; abeunt Hypanin fragilemque per undam </line><line> tigridis aut saeuae profugi cum prole leaenae, </line><line> maestaque suspectae mater stupet aggere ripae. </line><line> impulit et dubios Phrixei uelleris ardor </line><line> Centoras et diros magico terrore Choatras. </line><line> omnibus in superos saeuus sonor, omnibus artes </line><line> monstrificae, nunc uere nouo compescere frondes, </line><line> nunc subitam trepidis Maeotin soluere plaustris. </line><line> maximus hos inter Stygia uenit arte Coastes; </line><line> sollicitat nec Martis amor, sed fama Cytaeae </line><line> uirginis et paribus spirans Medea uenenis. </line><line> gaudet Auerna palus,	791:796	0:1587
