lemma	pos	date	grouping	identifier	description	context	indexes_target_token	indexes_target_sentence
honor	NN	[300,500]	2	17_28	 	, </line><line> nec tamen hos separatis a uestra communione. </line><line> Non dico de illis peccatis, quae potestis et negare: </line><line> fustes, ignes, mortes dico, quae committunt uestri in luce; </line><line> et tamen suffertis illos uel errore uel timore. </line><line> Quantum erat ut ferrent unum patres uestri pro unitate </line><line> si tantus erat tumultus, ut non possent degradare. </line><line> Adde quod innocens erat et nil poterant probare, </line><line> sed ne crimen quaereretur, ubi se uidebant esse, </line><line> finxerunt se nimis iustos, cum totum uellent turbare. </line><line> Uos qui gaudetis de pace, modo uerum iudicate. </line><line> Honores uanos qui quaerit non uult cum Christo regnare, </line><line> sicut princeps huius mali, de cuius uocantur parte. </line><line> Nam Donatus tunc uolebat Africam totam obtinere; </line><line> tunc iudices transmarinos petiit ab imperatore. </line><line> Sed haec tam iusta petitio non erat de caritate. </line><line> Hoc ipsa ueritas clamat, quam uolo modo referre. </line><line> Nam consensit imperator, misit qui sederent Romae </line><line> sacerdotes qui tunc possent Caecilianum cum illo audire. </line><line> Dicta causa, nil probatum est: ausus est et appellare </line><line> et post collegarum sedem audiri ab imperatore. </line><line> Hinc petitio illa probatur non esse de caritate. </line><line> Deinde	667:674	0:1388
honor	NN	[300,500]	2	17_29	 	, </line><line> nec terrena diu contagia mixtus iniquis </line><line> duceret in fragili corporis hospitio, </line><line> sed nullo istius temeratus crimine mundi </line><line> dignius aeternum tenderet ad dominum. </line><line> ergo deo potius quam nobis debitus infans, </line><line> uerum et pro nobis ille deo placitus, </line><line> coeperat octauum producere paruulus annum, </line><line> prima citis agitans tempora curriculis. </line><line> iam puerile iugum tenera ceruice ferebat, </line><line> grammatici duris subditus imperiis, </line><line> quaeque docebatur puer, admirante magistro </line><line> sorbebat docili nobilis ingenio. </line><line> gaudebant trepido praesagi corde parentes, </line><line> dum metuunt tanti muneris inuidiam. </line><line> nec mora longa fuit, placitam deus aethere Christus </line><line> arcessens merito sumpsit honore animam </line><line> et rapuit terris subitum, quia dignior esset </line><line> associata piis uiuere conciliis. </line><line> causa fuit leti suffusus faucibus umor, </line><line> quo grauis inflauit lactea colla tumor, </line><line> inde repressus abit, sed lapsus ad intima fugit </line><line> corporis et uitam uisceribus pepulit. </line><line> terra suam partem tumulata carne recepit, </line><line> spiritus angelico uectus abit gremio. </line><line> deserti uacuum funus duxere parentes, </line><line> Celsus in excelso laetus agit nemore. </line><line> parcite quaeso, pii, multis peccare, parentes, </line><line> fletibus, in culpam ne pietas ueniat. </line><line> impia nam pietas animam lugere beatam </line><line> gaudentemque deo flere nocens amor est. </line>	857:863	0:1638
honor	NN	[400,500]	2	17_30	 	, </line><line> nobiscum pietate manens. te saepe frequentes </line><line> inuisunt populi, coram curatio uiuit, </line><line> adsunt optatae confestim dona salutis. </line><line> uerba silent, sed signa nitent. si corpore paulum </line><line> a uisu abstraheris, praesens uirtute uideris. </line><line> quam precor ut miseri manifeste in corde poetae </line><line> semper adesse uelis, ut, cum meditatio carmen </line><line> finierit, teneat transcripta oratio laudem. </book></section></line><line><section><book> Instauras nostram renouanda ad murmura curam, </line><line> dum uitam uirtute probas, non clause sacerdos </line><line> lege obitus, carnisque tuae sine carne superstes </line><line> cerneris, expeteris, contingeris atque teneris. </line><line> dum largiris opem praesentem, ostendis honorem, </line><line> quaerenti assistens et numquam absconse precanti. </line><line> quam bene uicinus propter complectitur artus </line><line> spiritus et sanctum perfundit gratia saxum! </line><line> nil longe est pulsante fide. clamantia corda </line><line> allegant proprias sine uoce et murmure causas. </line><line> mentis uerba legit, qui sensum introspicit et cor </line><line> uisit et arcanum percenset pectoris antrum. </line><line> Quinque prius recolens signaui gesta libellis, </line><line> de multis uel pauca legens. quota portio nobis </line><line> comperta e tantis titulis? quid contigit unus? </line><line> exiguum quanta pensat mercede laborem! </line><line> indigno rursum tempto praeconia sensu: </line><line> tanta sinus fert uota rei bonitate patroni. </line><line> praecedit meritum	800:807	0:1611
honor	NN	[300,500]	2	17_31	 	, </line><line> Non minus infamis thalami sortita cubile, </line><line> Quam cum fraterno caluit Saturnia lecto. </line><line> Nondum maternam partu uacuauerat aluum </line><line> Conceptamque uiri subolem paritura gerebat. </line><line> Pronuba iam grauidae fulcrum et geniale parantur, </line><line> Iam sponsus saliente utero nubentis amicos </line><line> Aduocat, haud sterilem certus fore iam sibi pactam. </line><line> Vitricus anteuenit tardum praeferuidus ortum </line><line> Priuigni nondum geniti. Mox editur inter </line><line> Fescennina nouo proles aliena marito. </line><line> Idque deum sortes, id Apollinis antra dederunt </line><line> Consilium; numquam melius nam cedere taedas </line><line> Responsum est, quam cum praegnans noua nupta iugatur </line><line> Hanc tibi, Roma, deam titulis et honore sacratam </line><line> Perpetuo Floras inter Veneresque creasti! </line><line> Nec mirum; quis enim sapiens dubitauerat illas </line><line> Mortali de stirpe satas uixisse et easdem </line><line> Laude uenustatis claras in amoribus usque </line><line> Ad famae excidium formae nituisse decore? </line><line> Quid loquar Antinoum caelesti in sede locatum </line><line> Illum delicias nunc diui principis, illum </line><line> Purpureo in gremio spoliatum sorte uirili </line><line> Hadrianique dei Ganymedem, non cyathos dis </line><line> Porgere sed medio recubantem cum Ioue fulcro </line><line> Nectaris ambrosii sacrum potare Lyaeum </line><line> Cumque suo in templis uota exaudire marito? </line><line> Ergo his auspicibus Traianus Nerua Seuerus </line><line> Et Titus et fortes gesserunt bella Nerones, </line><line> Quos terrena uiros illustres	810:816	0:1668
honor	NN	[0,300]	2	17_32	 	, </line><line> non pediti fidus, patulis non puppibus aequus. </line><line> et tunc imbre recens fuso correpta sub armis </line><line> corpora multa uirum spumanti uertice torquens </line><line> immersit fundo laceris deformia membris. </line><line> Sed iam praeteritos ultra meminisse labores </line><line> conspectae propius dempsere pauentibus Alpes. </line><line> cuncta gelu canaque aeternum grandine tecta </line><line> atque aeui glaciem cohibent; riget ardua montis </line><line> aetherii facies surgentique obuia Phoebo </line><line> duratas nescit flammis mollire pruinas. </line><line> quantum Tartareus regni pallentis hiatus </line><line> ad manes Imos atque atrae stagna paludis </line><line> a supera tellure patet, tam longa per auras </line><line> erigitur tellus et caelum intercipit umbra. </line><line> nullum uer usquam nullique aestatis honores. </line><line> sola iugis habitat diris sedesque tuetur </line><line> perpetuas deformis hiems; illa undique nubes </line><line> huc atras agit et mixtos cum grandine nimbos. </line><line> iam cuncti flatus uentique furentia regna </line><line> Alpina posuere domo. caligat in altis </line><line> obtutus saxis, abeuntque in nubila montes. </line><line> mixtus Athos Tauro Rhodopeque adiuncta Mimanti </line><line> Ossaque cum Pelio cumque Haemo cesserit Othrys. </line><line> primus inexpertas adiit Tirynthius arces. </line><line> scindentem nubes frangentemque ardua montis </line><line> spectarunt superi longisque ab origine saeclis </line><line> intemerata gradu magna ui saxa domantem. </line><line> At miles dubio tardat uestigia gressu </line><line> impia ceu sacros in fines arma per orbem </line><line> natura prohibente ferant diuisque	860:867	0:1716
