lemma	pos	date	grouping	identifier	description	context	indexes_target_token	indexes_target_sentence
sacramentum	NN	[-100,0]	1	39_0	 	- nam in Sex. Digiti exercitu haud multum spei esse- rem gesturum. seniores negare ad rumores a privatis temere in gratiam magistratuum confictos senatus consulta facienda esse: nisi quod aut praetores ex provinciis scriberent aut legati renuntiarent, nihil ratum haberi debere; si tumultus in Hispania esset, placere tumultuarios milites extra Italiam scribi a praetore. mens ea senatus fuit ut in Hispania tumultuarii milites legerentur. Valerius Antias et in Siciliam navigasse dilectus causa C. Flaminium scribit et, ex Sicilia Hispaniam petentem, tempestate in Africam delatum vagos milites de exercitu P. Africani sacramento rogasse; his duarum provinciarum dilectibus tertium in Hispania adiecisse. Nec in Italia segnius Ligurum bellum crescebat. Pisas iam quadraginta milibus hominum, adfluente cotidie multitudine ad famam belli spemque praedae, circumsedebant. Minucius consul Arretium die quam edixerat ad conveniendum militibus venit. inde quadrato agmine ad Pisas duxit, et cum hostes non plus mille passuum ab oppido trans fluvium movissent castra, consul urbem haud dubie servatam adventu suo est ingressus. postero die et ipse trans fluvium quingentos ferme passus ab hoste posuit castra. inde levibus proeliis a populationibus agrum sociorum tutabatur	620:630	0:1269
sacramentum	NN	[500,600]	1	39_26	 	, duos superatos duces, duas receptas provincias? haec acta diebus XL, quibus in conspectum adversariorum venerit Caesar? An, qui incolumes resistere non potuerunt, perditi resistant? vos autem incerta victoria Caesarem secuti diiudicata iam belli fortuna victum sequamini, cum vestri officii praemia percipere debeatis? Desertos enim se ac proditos a vobis dicunt et prioris sacramenti mentionem faciunt. Vosne vero L. Domitium, an vos Domitius deseruit? Nonne extremam pati fortunam paratos proiecit ille? nonne sibi clam salutem fuga petivit? nonne proditi per illum Caesaris beneficio estis conservati? Sacramento quidem vos tenere qui potuit, cum proiectis fascibus et deposito imperio privatus et captus ipse in alienam venisset potestatem? Relinquitur nova religio, ut eo neglecto sacramento, quo tenemini, respiciatis illud, quod deditione ducis et capitis deminutione sublatum est. At, credo, si Caesarem probatis, in me offenditis. Qui de meis in vos meritis praedicaturus non sum, quae sunt adhuc et mea voluntate et vestra exspectatione leviora; sed tamen sui laboris milites semper eventu belli praemia petiverunt, qui qualis sit futurus, ne vos quidem dubitatis: diligentiam	607:617	0:1189
sacramentum	NN	[-100,0]	1	39_27	 	, non quicquid populus iusserit, ratum esse oportere; deinde nihil rationis adfers quam ob rem, si libertas adimi nullo modo possit, civitas possit. Nam et eodem modo de utraque re traditum nobis est, et, si semel civitas adimi potest, retineri libertas non potest. Qui enim potest iure Quiritium liber esse is qui in numero Quiritium non est? Atque ego hanc adulescentulus causam cum agerem contra hominem disertissimum nostrae civitatis,; C.; Cottam, probavi. Cum Arretinae mulieris libertatem defenderem et Cotta xviris religionem iniecisset non posse nostrum sacramentum iustum iudicari, quod Arretinis adempta civitas esset, et ego vehementius contendissem civitatem adimi non posse, xviri prima actione non iudicaverunt; postea re quaesita et deliberata sacramentum nostrum iustum iudicaverunt. Atque hoc et contra dicente Cotta et Sulla vivo iudicatum est. Iam vero in ceteris rebus ut omnes qui in eadem causa sunt et lege agant et suum ius persequantur, et omni iure civili sine cuiusquam aut magistratus aut iudicis aut periti hominis aut imperiti dubitatione utantur, quid ego commemorem? Dubium esse nemini vestrum certo; scio;. </section><section> Quaeri hoc solere	563:574	0:1179
sacramentum	NN	[-100,0]	1	39_28	 	, praeda ingens sociorum; accitique edicto domini ad res suas noscendas recipiendasque praestituta die. Quarum rerum non exstitit dominus, militi concessae; coactique vendere praedam ne alibi quam in armis animum haberent. Magnum ea populatio Campani agri tumultum Romae praebuerat; et per eos forte dies ex Etruria allatum erat post deductum inde Volumnianum exercitum Etruriam concitam in arma et Gellium Egnatium, Samnitium ducem, et Umbros ad defectionem vocari et Gallos pretio ingenti sollicitari. His nuntiis senatus conterritus iustitium indici, dilectum omnis generis hominum haberi iussit. Nec ingenui modo aut iuniores sacramento adacti sunt sed seniorum etiam cohortes factae libertinique centuriati; et defendendae urbis consilia agitabantur summaeque rerum praetor P. Sempronius praeerat. Ceterum parte curae exonerarunt senatum L. Volumni consulis litterae, quibus caesos fusosque populatores Campaniae cognitum est. Itaque et supplicationes ob rem bene gestam consulis nomine decernunt et iustitium remittitur quod fuerat dies duodeviginti; supplicatioque perlaeta fuit. Tum de praesidio regionis depopulatae ab Samnitibus agitari coeptum; itaque placuit ut duae coloniae circa Vescinum et Falernum agrum deducerentur, una ad ostium Liris fluvii, quae Minturnae appellata, altera in saltu Vescino, Falernum	630:640	0:1323
sacramentum	NN	[-100,0]	1	39_29	 	, quam ut eos prodatis, qui se vobis omnia debere iudicant, in eorum potestatem veniatis, qui se per vos perisse existimant? An vero in Hispania res gestas Caesaris non audistis? duos pulsos exercitus, duos superatos duces, duas receptas provincias? haec acta diebus XL, quibus in conspectum adversariorum venerit Caesar? An, qui incolumes resistere non potuerunt, perditi resistant? vos autem incerta victoria Caesarem secuti diiudicata iam belli fortuna victum sequamini, cum vestri officii praemia percipere debeatis? Desertos enim se ac proditos a vobis dicunt et prioris sacramenti mentionem faciunt. Vosne vero L. Domitium, an vos Domitius deseruit? Nonne extremam pati fortunam paratos proiecit ille? nonne sibi clam salutem fuga petivit? nonne proditi per illum Caesaris beneficio estis conservati? Sacramento quidem vos tenere qui potuit, cum proiectis fascibus et deposito imperio privatus et captus ipse in alienam venisset potestatem? Relinquitur nova religio, ut eo neglecto sacramento, quo tenemini, respiciatis illud, quod deditione ducis et capitis deminutione sublatum est. At, credo, si Caesarem probatis, in me offenditis. Qui de meis in vos	576:586	0:1161
sacramentum	NN	[-100,0]	1	39_30	 	; in eo enim victoriam verti si et loca opportuna et socii praeoccuparentur. Hannibalem quoque sine mora mittendum in Africam esse ad distringendos Romanos. Hannibal non adhibitus est in consilium, propter conloquia cum Villio suspectus regi et in nullo postea honore habitus. primo eam contumeliam tacitus tulit; deinde melius esse ratus et percunctari causam repentinae alienationis et purgare se, tempore apto quaesita simpliciter iracundiae causa auditaque'' pater Hamilcar'' inquit,'' Antioche, parvum admodum me, cum sacrificaret, altaribus admotum iureiurando adegit nunquam amicum fore populi Romani. sub hoc sacramento sex et triginta annos militavi, hoc me in pace patria mea expulit, hoc patria extorrem in tuam regiam adduxit: hoc duce, si tu spem meam destitueris, ubicumque vires, ubi arma esse sciam veniam, toto orbe terrarum quaerens aliquos Romanis hostes. itaque si quibus tuorum meis criminibus apud te crescere libet, aliam materiam crescendi ex me quaerant. odi odioque sum Romanis. id me verum dicere pater Hamilcar et di testes sunt. proinde cum de bello Romano cogitabis, inter primos amicos Hannibalem habeto: si qua res te ad	617:627	0:1153
sacramentum	NN	[-100,0]	1	39_31	 	; optare ne potestas tribunicia, inviolata ipsa, violet intercessione sua Romanum imperium neu populus in se potissimum dictatore vim et ius dictaturae exstinguat. quod si fecisset, non L. Papirium sed tribunos, sed pravum populi iudicium nequiquam posteros accusaturos, cum polluta semel militari disciplina non miles centurionis, non centurio tribuni, non tribunus legati, non legatus consulis, non magister equitum dictatoris pareat imperio, nemo hominum, nemo deorum verecundiam habeat, non edicta imperatorum, non auspicia observentur, sine commeatu vagi milites in pacato, in hostico errent, immemores sacramenti licentia sua se ubi velint exauctorent, infrequentia deserantur signa, neque conveniatur ad edictum, nec discernatur interdiu nocte, aequo iniquo loco,[ iussu] iniussu imperatoris pugnent, et non signa, non ordines servent, latrocinii modo caeca et fortuita pro sollemni et sacrata militia sit.'' horum criminum vos reos in omnia saecula offerte, tribuni plebi; vestra obnoxia capita pro licentia Q. Fabi obicite.'' Stupentes tribunos et suam iam vicem magis anxios quam eius cui auxilium ab se petebatur, liberavit onere consensus populi Romani ad preces et obtestationem	608:618	0:1192
sacramentum	NN	[100,200]	1	39_36	 	aliique complures adulescentes et magnus numerus equitum Romanorum et decurionum, quos ex municipiis Domitius evocaverat. Hos omnes productos a contumeliis militum conviciisque prohibet; pauca apud eos loquitur,[ queritur] quod sibi a parte eorum gratia relata non sit pro suis in eos maximis beneficiis; dimittit omnes incolumes. HS LX, quod advexerat Domitius atque in publico deposuerat, allatum ad se ab IIII viris Corfiniensibus Domitio reddit, ne continentior in vita hominum quam in pecunia fuisse videatur, etsi eam pecuniam publicam esse constabat datamque a Pompeio in stipendium. Milites Domitianos sacramentum apud se dicere iubet atque eo die castra movet iustumque iter conficit VII omnino dies ad Corfinium commoratus, et per fines Marrucinorum, Frentranorum, Larinatium in Apuliam pervenit. </section><section> Pompeius his rebus cognitis, quae erant ad Corfinium gestae, Luceria proficiscitur Canusium atque inde Brundisium. Copias undique omnes ex novis dilectibus ad se cogi iubet; servos, pastores armat atque eis equos attribuit; ex his circiter CCC equites conficit. L. Manlius praetor Alba cum cohortibus sex profugit, Rutilius Lupus praetor Tarracina cum tribus; quae procul equitatum Caesaris conspicatae, cui praeerat	610:621	0:1244
sacramentum	NN	[-100,0]	1	39_38	 	arma pro patria non cepisse, neque patribus satis decorum per metum potius quam postmodo voluntate adflictis civium suorum fortunis consuluisse. Contioni deinde edicto addidit fidem quo edixit ne quis civem Romanum vinctum aut clausum teneret, quo minus ei nominis edendi apud consules potestas fieret, neu quis militis, donec in castris esset, bona possideret aut venderet, liberos nepotesve eius moraretur. Hoc proposito edicto, et qui aderant nexi profiteri extemplo nomina, et undique ex tota urbe proripientium se ex privato, cum retinendi ius creditori non esset, concursus in forum ut sacramento dicerent fieri. Magna ea manus fuit, neque aliorum magis in Volsco bello virtus atque opera enituit. Consul copias contra hostem educit; parvo dirimente intervallo castra ponit. Proxima inde nocte Volsci, discordia Romana freti, si qua nocturna transitio proditiove fieri posset, temptant castra. Sensere vigiles; excitatus exercitus; signo dato concursum est ad arma; ita frustra id inceptum Volscis fuit. Reliquum noctis utrimque quieti datum. Postero die prima luce Volsci fossis repletis vallum invadunt. Iamque ob omni parte munimenta vellebantur, cum consul, quamquam cuncti undique	592:602	0:1192
sacramentum	NN	[-100,0]	1	39_39	 	consules maturassent in provinciam ire. id ut facerent, pro se quisque patrum vociferari. consules nisi confecto dilectu negare se ituros, nec suam segnitiem sed vim morbi in causa esse, quo serius perficeretur. non tamen potuerunt sustinere consensum senatus, quin paludati exirent et militibus, quos conscriptos haberent, diem edicerent, quo Pisas convenirent. permissum, ut, qua irent, protinus subitarios milites scriberent ducerentque se cum. et praetoribus Q. Petilio et Q. Fabio imperatum est, ut Petilius duas legiones civium Romanorum tumultuarias scriberet et omnes minores quinquaginta annis sacramento rogaret, Fabio, ut sociis Latini nominis quindecim milia peditum, octingentos equites imperaret. duumviri navales creati C. Matienus et C. Lucretius, navesque iis ornatae sunt, Matienoque, cuius ad Gallicum sinum provincia erat, imperatum est, ut classem primo quoque tempore duceret in Ligurum oram, si quo usui esse L. Aemilio atque exercitui eius posset. Aemilius, postquam nihil usquam auxilii ostendebatur, interceptos credens equites, non ultra differendum ratus, quin per se fortunam temptaret, priusquam hostes venirent, qui segnius socordiusque oppugnabant, ad quattuor portas exercitum instruxit	603:613	0:1220
sacramentum	NN	[-100,0]	1	39_40	 	consultum factum est; sed triumviros creavere ac misere colonorum quattuor milia insequentes consules M. Valerius P. Decius.[ M. Valerio P. Decio coss.] profligato fere Samnitium bello, priusquam ea cura decederet patribus Romanis, Etrusci belli fama exorta est; nec erat ea tempestate gens alia, cuius secundum Gallicos tumultus arma terribiliora essent cum propinquitate agri tum multitudine hominum. Itaque altero consule in Samnio reliquias belli persequente P. Decius, qui graviter aeger Romae restiterat, auctore senatu dictatorem C. Iunium Bubulcum dixit. Is, prout rei magnitudo postulabat, omnes iuniores sacramento adigit, arma quaeque alia res poscit summa industria parat; nec tantis apparatibus elatus de inferendo bello agitat, quieturus haud dubie, nisi ultro arma Etrusci inferrent. Eadem in comparando cohibendoque bello consilia et apud Etruscos fuere; neutri finibus egressi. Et censura clara eo anno Ap. Claudi et C. Plauti fuit; memoriae tamen felicioris ad posteros nomen Appi, quod viam munivit et aquam in urbem duxit; eaque unus perfecit quia ob infamem atque invidiosam senatus lectionem verecundia victus collega magistratu se abdicaverat, Appius iam inde antiquitus insitam pertinaciam familiae gerendo	614:624	0:1231
sacramentum	NN	[-100,0]	1	39_41	 	cum collegae eius M. Fabio Ambusto Hernici provincia evenisset, adversus Tiburtes iussu populi exercitum duceret. Ad quorum auxilium cum Galli ex Campania redissent, foedae populationes in Labicano Tusculanoque et Albano agro haud dubie Tiburtibus ducibus sunt factae; et, cum adversus Tiburtem hostem duce consule contenta res publica esset, Gallicus tumultus dictatorem creari coegit. Creatus Q. Servilius Ahala T. Quinctium magistrum equitum dixit et ex auctoritate patrum, si prospere id bellum evenisset, ludos magnos vovit. Dictator ad continendos proprio bello Tiburtes consulari exercitu iusso manere, omnes iuniores nullo detractante militiam sacramento adegit. Pugnatum haud procul porta Collina est totius viribus urbis in conspectu parentum coniugumque ac liberorum; quae magna etiam absentibus hortamenta animi tum subiecta oculis simul verecundia misericordiaque militem accendebant. Magna utrimque edita caede avertitur tandem acies Gallorum. Fuga Tibur sicut arcem belli Gallici petunt; palati a consule Poetelio haud procul Tibure excepti, egressis ad opem ferendam Tiburtibus, simul cum iis intra portas compelluntur. Egregie cum ab dictatore tum ab consule res gesta est. Et consul alter Fabius proeliis primum parvis, postremo una insigni pugna, cum hostes totis adorti	652:662	0:1290
sacramentum	NN	[-100,0]	1	39_42	 	Curione maximeque opus esse in conspectum exercitus venire et colloquendi dare facultatem. Qua opinione adductus Varus postero die mane legiones ex castris educit. Facit idem Curio, atque una valle non magna interiecta suas uterque copias instruit. </section><section> Erat in exercitu Vari Sextus Quintilius Varus, quem fuisse Corfinii supra demonstratum est. Hic dimissus a Caesare in Africam venerat, legionesque eas traduxerat Curio, quas superioribus temporibus Corfinio receperat Caesar, adeo ut paucis mutatis centurionibus eidem ordines manipulique constarent. Hanc nactus appellationis causam Quintilius circuire aciem Curionis atque obsecrare milites coepit, ne primam sacramenti, quod apud Domitium atque apud se quaestorem dixissent, memoriam deponerent, neu contra eos arma ferrent, qui eadem essent usi fortuna eademque in obsidione perpessi, neu pro his pugnarent, a quibus cum contumelia perfugae appellarentur. Huc pauca ad spem largitionis addidit, quae ab sua liberalitate, si se atque Attium secuti essent, exspectare deberent. Hac habita oratione nullam in partem ab exercitu Curionis fit significatio, atque ita suas uterque copias reducit. </section><section> At in castris Curionis magnus omnium incessit timor animis. Is variis hominum sermonibus celeriter augetur. Unusquisque	679:689	0:1303
sacramentum	NN	[-100,0]	1	39_43	 	Dictatorem T. Quinctium Poenum eo anno fuisse satis constat et magistrum equitum Ser. Cornelium Maluginensem. Macer Licinius comitiorum habendorum causa et ab Licinio consule dictum scribit, quia collega comitia bello praeferre festinante ut continuaret consulatum, obviam eundum pravae cupiditati fuerit. Quaesita ea propriae familiae laus leviorem auctorem Licinium facit: cum mentionem eius rei in vetustioribus annalibus nullam inveniam, magis ut belli Gallici causa dictatorem creatum arbitrer inclinat animus. Eo certe anno Galli ad tertium lapidem Salaria via trans pontem Anienis castra habuere. Dictator cum tumultus Gallici causa iustitium edixisset, omnes iuniores sacramento adegit ingentique exercitu ab urbe profectus in citeriore ripa Anienis castra posuit. Pons in medio erat, neutris rumpentibus ne timoris indicium esset. Proelia de occupando ponte crebra erant, nec qui potirentur incertis viribus satis discerni poterat. Tum eximia corporis magnitudine in vacuum pontem Gallus processit et quantum maxima voce potuit; quem nunc; inquit; Roma virum fortissimum habet, procedat agedum ad pugnam, ut noster duorum eventus ostendat utra gens bello sit melior.; Diu inter primores iuvenum Romanorum silentium fuit, cum et abnuere certamen vererentur et praecipuam sortem periculi	676:686	0:1295
sacramentum	NN	[-100,0]	1	39_44	 	dictatura se abdicavit. Apparuit causa plebi, suam vicem indignantem magistratu abisse; itaque velut persoluta fide, quoniam per eum non stetisset quin praestaretur, decedentem domum cum favore ac laudibus prosecuti sunt. Timor inde patres incessit ne, si dimissus exercitus foret, rursus coetus occulti coniurationesque fierent. Itaque quamquam per dictatorem dilectus habitus esset, tamen quoniam in consulum verba iurassent sacramento teneri militem rati, per causam renovati ab Aequis belli educi ex urbe legiones iussere. Quo facto maturata est seditio. Et primo agitatum dicitur de consulum caede, ut solverentur sacramento; doctos deinde nullam scelere religionem exsolvi, Sicinio quodam auctore iniussu consulum in Sacrum montem secessisse. Trans Anienem amnem est, tria ab urbe milia passuum. Ea frequentior fama est quam cuius Piso auctor est, in Aventinum secessionem factam esse. Ibi sine ullo duce vallo fossaque communitis castris quieti, rem nullam nisi necessariam ad victum sumendo, per aliquot dies neque lacessiti neque lacessentes sese tenuere. Pavor ingens in urbe, metuque mutuo suspensa erant omnia. Timere relicta ab suis plebis violentiam patrum; timere patres residem in urbe plebem, incerti	619:629	0:1218
sacramentum	NN	[-100,0]	1	39_45	 	earum patroni essent more maiorum. Ac belli quidem aequitas sanctissime fetiali populi Romani iure perscripta est. Ex quo intellegi potest nullum bellum esse iustum, nisi quod aut rebus repetitis geratur aut denuntiatum ante sit et indictum.[ Popilius imperator tenebat provinciam, in cuius exercitu Catonis filius tiro militabat. Cum autem Popilio videretur unam dimittere legionem, Catonis quoque filium, qui in eadem legione militabat, dimisit. Sed cum amore pugnandi in exercitu remansisset, Cato ad Popilium scripsit, ut, si eum patitur in exercitu remanere, secundo eum obliget militiae sacramento, quia priore amisso iure cum hostibus pugnare non poterat. Adeo summa erat observatio in bello movendo.] M. quidem Catonis senis est epistula ad M. filium, in qua scribit se audisse eum missum factum esse a consule cum in Macedonia bello Persico miles esset. Monet igitur ut caveat, ne proelium ineat; negat enim ius esse, qui miles non sit cum hoste pugnare. </section><section> Equidem etiam illud animadverto, quod, qui proprio nomine perduellis esset, is hostis vocaretur, lenitate Vi rei tristitiam mitigatam. Hostis enim apud maiores nostros is	593:603	0:1155
sacramentum	NN	[-100,0]	1	39_46	 	eodem modo de utraque re traditum nobis est, et, si semel civitas adimi potest, retineri libertas non potest. Qui enim potest iure Quiritium liber esse is qui in numero Quiritium non est? Atque ego hanc adulescentulus causam cum agerem contra hominem disertissimum nostrae civitatis,; C.; Cottam, probavi. Cum Arretinae mulieris libertatem defenderem et Cotta xviris religionem iniecisset non posse nostrum sacramentum iustum iudicari, quod Arretinis adempta civitas esset, et ego vehementius contendissem civitatem adimi non posse, xviri prima actione non iudicaverunt; postea re quaesita et deliberata sacramentum nostrum iustum iudicaverunt. Atque hoc et contra dicente Cotta et Sulla vivo iudicatum est. Iam vero in ceteris rebus ut omnes qui in eadem causa sunt et lege agant et suum ius persequantur, et omni iure civili sine cuiusquam aut magistratus aut iudicis aut periti hominis aut imperiti dubitatione utantur, quid ego commemorem? Dubium esse nemini vestrum certo; scio;. </section><section> Quaeri hoc solere me non praeterit-- ut ex me ea quae tibi in mentem non veniunt audias-- quem ad modum, si civitas adimi non possit, in colonias	604:615	0:1151
sacramentum	NN	[-100,0]	1	39_47	 	et consilio civitatem tuentibus, quorum auctoritas maxime florebat, quod cum honore longe antecellerent ceteris, voluptatibus erant inferiores nec pecuniis ferme superiores; eoque erat cuiusque gratior in re publica virtus, quod in rebus privatis diligentissime singulos cives opera consilio re tuebantur. Quo in statu rei publicae Sp. Cassium de occupando regno molientem, summa apud populum gratia florentem, quaestor accusavit, eumque ut audistis cum pater in ea culpa esse conperisse se dixisset, cedente populo morte mactavit. gratamque etiam illam legem quarto circiter et quinquagesimo anno post primos consules de multa et sacramento Sp. Tarpeius et A. Aternius consules comitiis centuriatis tulerunt. annis postea XX ex eo quod L. Papirius P. Pinarius censores multis dicendis vim armentorum a privatis in publicum averterant, levis aestumatio pecudum in multa lege C. Iuli P. Papiri consulum constituta est. Sed aliquot ante annis, cum summa esset auctoritas in senatu populo patiente atque parente, inita ratio est ut et consules et tribuni plebis magistratu se abdicarent, atque ut X viri maxima potestate sine provocatione crearentur, qui et summum imperium haberent et leges scriberent. qui cum X tabulas legum summa aequitate	631:641	0:1241
sacramentum	NN	[-100,0]	1	39_48	 	et intercessionem, secessione quondam plebis partam, vobis eadem vi facitis inritam qua peperistis, non rei publicae magis universae quam vestra causa dictator intercessioni adero eversumque vestrum auxilium imperio tutabor. itaque si C. Licinius et L. Sextius intercessioni collegarum cedunt, nihil patricium magistratum inseram concilio plebis; si adversus intercessionem tamquam captae civitati leges imponere tendent, vim tribuniciam a se ipsa dissolvi non patiar.'' adversus ea cum contemptim tribuni plebis rem nihilo segnius peragerent, tum percitus ira Camillus lictores qui de medio plebem emoverent misit et addidit minas, si pergerent, sacramento omnes iuniores adacturum exercitumque extemplo ex urbe educturum. terrorem ingentem incusserat plebi: ducibus plebis accendit magis certamine animos quam minuit. sed re neutro inclinata magistratu se abdicavit, seu quia vitio creatus erat, ut scripsere quidam, seu quia tribuni plebis tulerunt ad plebem idque plebs scivit, ut, si M. Furius pro dictatore quid egisset, quingentum milium ei multa esset; sed auspiciis magis quam novi exempli rogatione deterritum ut potius credam, cum ipsius viri facit ingenium, tum quod ei suffectus est extemplo P. Manlius dictator- quem quid creari attinebat	647:657	0:1253
sacramentum	NN	[-100,0]	1	39_49	 	in legationes non plus singulis senatoribus invenientes coacti sunt binos equites adicere. Praeterquam ab morbo annonaque nihil eo biennio intestini externive incommodi fuit. At ubi eae sollicitudines discessere, omnia, quibus turbari solita erat civitas, domi discordia, foris bellum exortum. M. Aemilio C. Valerio Potito consulibus bellum Aequi parabant, Volscis, quamquam non publico consilio capessentibus arma, voluntariis mercede secutis militiam. Ad quorum famam hostium- iam enim in Latinum Hernicumque transcenderant agrum- dilectum habentem valerium consulem M. Menenius tribunus plebis legis agrariae lator cum impediret auxilioque tribuni nemo invitus sacramento diceret, repente nuntiatur arcem Carventanam ab hostibus occupatam esse. Ea ignominia accepta cum apud patres invidiae Menenio fuit, tum ceteris tribunis, iam ante praeparatis intercessoribus legis agrariae, praebuit iustiorem causam resistendi collegae. Itaque cum res diu ducta per altercationem esset, consulibus deos hominesque testantibus quidquid ab hostibus cladis ignominiaeque aut iam acceptum esset aut immineret culpam penes Menenium fore qui dilectum impediret, Menenio contra vociferante, si iniusti domini possessione agri publici cederent, se moram dilectui non facere, decreto interposito novem tribuni sustulerunt certamen pronuntiaveruntque ex collegii sententia: C.	664:674	0:1360
