lemma	pos	date	grouping	identifier	description	context	indexes_target_token	indexes_target_sentence
sacramentum	NN	[-100,0]	1	39_50	 	inque ea pugna Iovis Statoris aedem votam, ut Romulus ante voverat; sed fanum tantum, id est locus templo effatus, fuerat; ceterum hoc demum anno ut aedem etiam fieri senatus iuberet bis eiusdem voti damnata re publica in religionem venit. Sequitur hunc annum et consul insignis, L. Papirius Cursor, qua paterna gloria, qua sua, et bellum ingens victoriaque quantam de Samnitibus nemo ad eam diem praeter L. Papirium patrem consulis pepererat. Et forte eodem conatu apparatuque omni opulentia insignium armorum bellum adornaverant; et deorum etiam adhibuerunt opes ritu quodam sacramenti vetusto velut initiatis militibus, dilectu per omne Samnium habito nova lege, ut qui iuniorum non convenisset ad imperatorum edictum quique iniussu abisset caput Iovi sacraretur. Tum exercitus omnis Aquiloniam est indictus. Ad sexaginta milia militum quod roboris in Samnio erat convenerunt. Ibi mediis fere castris locus est consaeptus cratibus pluteisque et linteis contectus, patens ducentos maxime pedes in omnes pariter partes. Ibi ex libro vetere linteo lecto sacrificatum sacerdote Ovio Paccio quodam, homine magno natu, qui se id sacrum petere adfirmabat ex vetusta Samnitium religione, qua quondam usi maiores eorum	577:587	0:1213
sacramentum	NN	[-100,0]	1	39_51	 	intervallo ad respirandum debitoribus dato, postquam quietae res ab hostibus erant, celebrari de integro iuris dictio et tantum abesse spes veteris levandi fenoris, ut tributo novum fenus contraheretur in murum a censoribus locatum saxo quadrato faciundum; cui succumbere oneri coacta plebes, quia quem dilectum impedirent non habebant tribuni plebis. tribunos etiam militares patricios omnes coacta principum opibus fecit, L. Aemilium P. Valerium quartum C. Veturium Ser. Sulpicium L. et C. Quinctios Cincinnatos. iisdem opibus obtinuere ut adversus Latinos Volscosque, qui coniunctis legionibus ad Satricum castra habebant, nullo impediente omnibus iunioribus sacramento adactis tres exercitus scriberent: unum ad praesidium urbis: alterum qui, si qui alibi motus exstitisset, ad subita belli mitti posset: tertium longe validissimum P. Valerius et L. Aemilius ad Satricum duxere. ubi cum aciem instructam hostium loco aequo invenissent, extemplo pugnatum; et ut nondum satis claram victoriam, sic prosperae spei pugnam imber ingentibus procellis fusus diremit. postero die iterata pugna; et aliquamdiu aequa virtute fortunaque Latinae maxime legiones longa societate militiam Romanam edoctae restabant. sed eques immissus ordines turbavit; turbatis signa peditum inlata, quantumque Romana se	662:672	0:1295
sacramentum	NN	[-100,0]	1	39_52	 	iustiorem causam resistendi collegae. Itaque cum res diu ducta per altercationem esset, consulibus deos hominesque testantibus quidquid ab hostibus cladis ignominiaeque aut iam acceptum esset aut immineret culpam penes Menenium fore qui dilectum impediret, Menenio contra vociferante, si iniusti domini possessione agri publici cederent, se moram dilectui non facere, decreto interposito novem tribuni sustulerunt certamen pronuntiaveruntque ex collegii sententia: C. Valerio consuli se, damnum aliamque coercitionem adversus intercessionem collegae dilectus causa detractantibus militiam inhibenti, auxilio futuros esse. Hoc decreto consul armatus cum paucis appellantibus tribunum collum torsisset, metu ceteri sacramento dixere. Ductus exercitus ad Carventanam arcem, quamquam invisus infestusque consuli erat, impigre primo statim adventu deiectis qui in praesidio erant arcem recipit; praedatores ex praesidio per neglegentiam dilapsi occasionem aperuere ad invadendum. Praedae ex adsiduis populationibus, quod omnia in locum tutum congesta erant, fuit aliquantum. Venditum sub hasta consul in aerarium redigere quaestores iussit, tum praedicans participem praedae fore exercitum cum militiam non abnuisset. Auctae inde plebis ac militum in consulem irae. Itaque cum ex senatus consulto urbem ovans introiret, alternis inconditi versus militari licentia iactati quibus consul	713:723	0:1381
sacramentum	NN	[-100,0]	1	39_53	 	legionem primam, parem numerum sociorum peditum equitumque, Ariminum convenire iuberet. Nero paludatus Pisas in provinciam est profectus; Titinius C. Cassio tribuno militum Ariminum, qui praeesset legioni, misso dilectum Romae habuit. M. Iunius consul ex Liguribus in provinciam Galliam transgressus, auxiliis protinus per civitates Galliae militibusque coloniis imperatis, Aquileiam pervenit. ibi certior factus exercitum incolumem esse, scriptis litteris Romam, ne tumultuarentur, ipse remissis auxiliis, quae Gallis imperaverat, ad collegam est profectus. Romae magna ex necopinato laetitia fuit: dilectus omissus est, exauctorati, qui sacramento dixerant, et exercitus, qui Arimini pestilentia adfectus erat, domum dimissus. Histri magnis copiis cum castra haud procul consulis castris haberent, postquam alterum consulem cum exercitu novo advenisse audierunt, passim in civitates dilapsi sunt. consules Aquileiam in hiberna legiones reduxerunt. </section><section> Sedato tandem Histrico tumultu senatus consultum factum est, ut consules inter se compararent, uter eorum ad comitia habenda Romam rediret. cum absentem Manlium tribuni plebis; A.; Licinius Nerva et C. Papirius Turdus in contionibus lacerarent rogationemque promulgarent, ne Manlius post idus Martias prorogatae namque consulibus iam in	639:649	0:1307
sacramentum	NN	[-100,0]	1	39_54	 	Norbam et Cerceios servitia sollicitarent, satis iam omnibus praeparatis, ludis qui Setiae prope diem futuri erant spectaculo intentum populum adgredi statuerant, Setia per caedem et repentinum tumultum capta Norbam et Cerceios occupare; non potueret; servitia. Huius rei tam foedae indicium Romam ad L. Cornelium Lentulum praetorem urbanum delatum est. Servi duo ante lucem ad eum venerunt atque ordine omnia quae acta futuraque erant exposuerunt. Quibus domi custodiri iussis praetor senatu vocato edoctoque quae indices adferrent, proficisci ad eam coniurationem quaerendam atque opprimendam iussus, cum quinque legatis profectus obvios in agris sacramento rogatos arma capere et sequi cogebat. Hoc tumultuario dilectu duobus milibus ferme hominum armatis Setiam omnibus quo pergeret ignaris venit. Ibi raptim principibus coniurationis comprehensis fuga servorum ex oppido facta est. Dimissis deinde per agros qui vestigarent; profugos. . .;. Egregia duorum opera servorum indicum et unius liberi fuit. Ei centum milia gravis aeris dari patres iusserunt, servis vicena quina milia aeris et libertatem: pretium eorum ex aerario solutum est dominis. Haud ita multo post ex eiusdem coniurationis reliquiis nuntiatum est servitia Praeneste occupatura. Eo L. Cornelius praetor	649:659	0:1275
sacramentum	NN	[-100,0]	1	39_55	 	nullas adhuc vires coniuratio, ceterum incrementum ingens virium habet, quod in dies plures fiunt. maiores vestri ne vos quidem, nisi cum aut vexillo in arce posito comitiorum causa exercitus eductus esset, aut plebi concilium tribuni edixissent, aut aliquis ex magistratibus ad contionem vocasset, forte temere coire voluerunt; et ubicumque multitudo esset, ibi et legitimum rectorem multitudinis censebant esse debere. quales primum nocturnos coetus, deinde promiscuos mulierum ac virorum esse creditis? si quibus aetatibus initientur mares sciatis, non misereat vos eorum solum, sed etiam pudeat. hoc sacramento initiatos iuvenes milites faciendos censetis, Quirites? his ex obsceno sacrario eductis arma committenda? hi cooperti stupris suis alienisque pro pudicitia coniugum ac liberorum vestrorum ferro decernent? Minus tamen esset, si flagitiis tantum effeminati forent- ipsorum id magna ex parte dedecus erat--, a facinoribus manus, mentem a fraudibus abstinuissent: numquam tantum malum in re publica fuit, nec ad plures nec ad plura pertinens. quidquid his annis libidine, quidquid fraude, quidquid scelere peccatum est, ex illo uno sacrario scitote ortum esse. necdum omnia, in	604:614	0:1189
sacramentum	NN	[-100,0]	1	39_56	 	per omnes velim- equidem si totum exercitum meum mortem mihi optasse crederem hic statim ante oculos vestros morerer, nec me vita iuvaret invisa civibus et militibus meis. sed multitudo omnis sicut natura maris per se immobilis est,[ et] venti et aurae cient; ita aut tranquillum aut procellae in vobis sunt; et causa atque origo omnis furoris penes auctores est, vos contagione insanistis; qui mihi ne hodie quidem scire videmini quo amentiae progressi sitis, quid facinoris in me, quid in patriam parentesque ac liberos vestros, quid in deos sacramenti testes, quid adversus auspicia sub quibus militatis, quid adversus morem militiae disciplinamque maiorum, quid adversus summi imperii maiestatem ausi sitis.'' De me ipso taceo- temere potius quam avide credideritis, is denique ego sim cuius imperii taedere exercitum minime mirandum sit--: patria quid de vobis meruerat, quam cum Mandonio et Indibili consociando consilia prodebatis? quid populus Romanus, cum imperium ablatum ab tribunis suffragio populi creatis ad homines privatos detulistis, cum eo ipso non contenti si pro tribunis illos haberetis, fasces imperatoris vestri ad eos quibus servus	544:554	0:1156
sacramentum	NN	[-100,0]	1	39_57	 	peragendis consularis officii partem ad se vindicabat. Tum tribuni, eludentes velut vana dicta, persequi quaerendo quonam modo exercitum educturi consules essent quos dilectum habere nemo passurus sit.'' Nobis vero'' inquit Quinctius, nihil dilectu opus est, cum, quo tempore P. Valerius ad recipiundum Capitolium arma plebi dedit, omnes in Va iuraverint conventuros se iussu consulis nec iniussu abituros. Edicimus itaque, omnes qui in Va iurastis crastina die armati ad lacum Regillum adsitis.'' Cavillari tum tribuni et populum exsolvere religione velle: privatum eo tempore Quinctium fuisse cum sacramento adacti sint. Sed nondum haec quae nunc tenet saeculum neglegentia deum venerat, nec interpretando sibi quisque ius iurandum et leges aptas faciebat, sed suos potius mores ad ea accommodabat. Igitur tribuni, ut impediendae rei nulla spes erat, de proferendo exitu agere, eo magis quod et augures iussos adesse ad Regillum lacum fama exierat, locumque inaugurari ubi auspicato cum populo agi posset, ut quidquid Romae vi tribunicia rogatum esset id comitiis ibi abrogaretur: omnes id iussuros quod consules velint; neque enim provocationem esse longius ab urbe mille passuum, et	599:609	0:1187
sacramentum	NN	[-100,0]	1	39_58	 	pontifex maximus creatus fuerat qui sella curuli non sedisset. consules dilectum cum aegre conficerent, quod inopia iuniorum non facile in utrumque ut et novae urbanae legiones et supplementum veteribus scriberetur sufficiebat, senatus absistere eos incepto vetuit et triumviros binos creari iussit, alteros qui citra, alteros qui ultra quinquagesimum lapidem in pagis forisque et conciliabulis omnem copiam ingenuorum inspicerent et, si qui roboris satis ad ferenda arma habere viderentur, etiamsi nondum militari aetate essent, milites facerent; tribuni plebis, si iis videretur, ad populum ferrent ut, qui minores septendecim annis sacramento dixissent, iis perinde stipendia procederent ac si septendecim annorum aut maiores milites facti essent. ex hoc senatus consulto creati triumviri bini conquisitionem ingenuorum per agros habuerunt. Eodem tempore ex Sicilia litterae M. Marcelli de postulatis militum qui cum P. Lentulo militabant in senatu recitatae sunt. Cannensis reliquiae cladis hic exercitus erat, relegatus in Siciliam, sicut ante dictum est, ne ante Punici belli finem in Italiam reportarentur. Hi permissu Lentuli primores equitum centurionumque et robora ex legionibus peditum legatos in hiberna ad M. Marcellum miserunt, e quibus unus potestate dicendi facta:	635:645	0:1282
sacramentum	NN	[-100,0]	1	39_59	 	populo Romano bellum indixerunt. In Samnio quoque, quia decesserat inde Fabius, novi motus exorti. Calatia et Sora praesidiaque quae in his Romana erant expugnata et in captivorum corpora militum foede saevitum. Itaque eo P. Cornelius cum exercitu missus. Marcio novi hostes- iam enim Anagninis Hernicisque aliis bellum iussum erat- decernuntur. Primo ita omnia opportuna loca hostes inter consulum castra inter ceperunt ut pervadere expeditus nuntius non posset et per aliquot dies incerti rerum omnium suspensique de statu alterius uterque consul ageret, Romamque is metus manaret, adeo ut omnes iuniores sacramento adigerentur atque ad subita rerum duo iusti scriberentur exercitus. Ceterum Hernicum bellum nequaquam pro praesenti terrore ac vetusta gentis gloria fuit: nihil usquam dictu dignum ausi, trinis castris intra paucos dies exuti, triginta dierum indutias ita ut ad senatum Romam legatos mitterent pacti sunt bimestri stipendio frumentoque et singulis in militem tunicis. Ab senatu ad Marcium reiecti, cui senatus consulto permissum de Hernicis erat; isque eam gentem in deditionem accepit. Et in Samnio alter consul superior viribus, locis impeditior erat. Omnia itinera obsaepserant hostes saltusque pervios ceperant ne qua subvehi	607:617	0:1248
sacramentum	NN	[2000,2100]	2	39_1	 	-), ad effectum perducatur atque protegatur modo usque fideliore, et idcirco fructuosiore. Id potissimum necessarium videtur eo quod quibusdam in provinciis personalem confessionem deserendi conspicitur proclivitas ac simul licentia adhibendi absolutionem generalem vel collectivam, ita ut ipsa iam non habeatur veluti quoddam extraordinarium instrumentum pro omnino singularibus condicionibus. Cum proprio arbitratu amplificatur condicio, revera sive fidelitas erga divinam sacramenti rationem sive definite confessionis individualis necessitas negleguntur, gravibus spiritali fidelium vitae atque Ecclesiae sanctitati damnis illatis. Itaque hac de re auditis Congregatione pro Doctrina Fidei, Congregatione pro Cultu Divino et Disciplina Sacramentorum atque Pontificio Consilio de Legum Textibus itemque rogatis sententiam Venerabilibus Fratribus Nostris S. R. E. Cardinalibus Dicasteriis Romanae Curiae Praepositis, confirmantes catholicam doctrinam ad sacramentum Paenitentiae et Reconciliationis attinentem in Catechismo Catholicae Ecclesiae declaratam, Nostro de pastorali officio conscii atque plane scientes huius sacramenti necessitatem efficacitatemque usque vigere, quae sequuntur decernimus:),) Cfr Conc. Oecum. Tridentinum, sess. XIV,, can.:) N.:) Cfr CIC, cann. et,;) Cfr Conc. Oecum. Tridentinum, sess. XIV,,	740:753	0:1324
sacramentum	NN	[300,500]	2	39_2	 	, </line><line> Elinguis oris organum fautor moue, </line><line> Largire comptum carmen infantissimo, </line><line> Fac ut tuarum mira laudum concinam, </line><line> Nam scis et ipse posse mutos eloqui. </line><line> Plectrum palati et faucium saeuus tibi </line><line> Tortor reuulsit nec tamen silentium </line><line> Indixit ori quo fatebaris deum. </line><line> Vox ueritatis testis extingui nequit, </line><line> Nec si recisis palpitet meatibus. </line><line> Sic noster haerens sermo lingua debili </line><line> Balbutit et modis laborat absonis, </line><line> Sed, si superno rore respergas iecur </line><line> Et spiritali lacte pectus inriges, </line><line> Vox inpeditos rauca laxabit sonos. </line><line> Euangelista scripsit ipsum talia </line><line> Praecepta Messian dedisse apostolis: </line><line> Nolite uerba, cum sacramentum meum </line><line> Erit canendum, prouidenter quaerere, </line><line> Ego inparatis quae loquantur suggeram." </line><line> Sum mutus ipse, sed potens facundiae </line><line> Mea lingua Christus luculente disseret. </line><line> Ipse explicabit quos supremo spiritu </line><line> Daemon tumultus dum domatur mouerit, </line><line> Furore pestis peior in nouissimo. </line><line> Sic uulneratus anguis ictu spiculi </line><line> Ferrum remordet et dolore saeuior </line><line> Quassando pressis inmoratur dentibus, </line><line> Hastile fixum sed manet profundius </line><line> Nec cassa sentit morsuum pericula. </line><line> Galerius orbis forte Romani statum </line><line> Ductor regebat, ut refert antiquitas, </line><line> Inmitis atrox asper inplacabilis. </line><line> Edicta late mundum in omnem miserat: </line><line> Christum negaret quisque mallet uiuere. </line>	833:844	0:1719
sacramentum	NN	[500,600]	2	39_3	 	, a rege detenebatur, dicente sibi:'' Adhuc aliquid cybi sume''. Cui illa:'' Indulge'', inquid,'' depraecor, domini mi, quia iuxta consuetudinem mulierum contigit mihi, ut pro conceptu consurgam''. Haec ille audiens, obstipuit, sciens, quartum esse mensem, ex quo alium ediderat filium; tamen permisit eam consurgere. Prioribus quoque de regno Chilperici, ut erat Ansovaldus, et reliqui ad filium eius, qui erat, ut superius diximus, quattuor mensuum, se colligerunt, quem Chlotharium vocitaverunt, exegentes sacramenta per civitates, quae ad Chilpericum prius aspexerant, ut scilicit fidelis esse debeant Gunthchramno rege ac nepote suo Chlothario. Gunthchramnus vero rex omnia, quae fidelis regis Chilperici non recte diversis abstulerant, iusticia intercedente, restituit, multa et ipsi eclesiis conferens; testamenta quoque defunctorum, qui eclesias heredis instituerant et ad Chilperico conpressa fuerant, restauravit, multisque se benignum exhibens ac multa pauperibus tribuens. </section><section> Sed quia non erat fidus ab hominibus inter quos venerat, armis se munivit, nec umquam ad eclesiam aut reliqua loca, qua ire delectabat, sine grande	509:519	0:1153
sacramentum	NN	[2000,2100]	2	39_4	 	, a sede Apostolica approbatum, ea sit sancita. </section><section> Ad editiones librorum liturgicorum lingua vulgari exaratas quod attinet, intellegendum est Conferentiae Episcoporum approbationem, necnon Apostolicae Sedis recognitionem, solummodo pro territorio eiusdem Conferentiae valere, neque has editiones sine Apostolicae Sedis licentia in alio territorio adhiberi posse, exceptis in peculiaribus rerum adiunctis, prout supra, ad nn. et, memorata sunt, servatisque normis ibi expositis. </section><section> Ubi Conferentia quaedam Episcoporum bonis vel instrumentis sufficientibus ad librum liturgicum apparandum atque imprimendum careat, Praeses ipsius Conferentiae rem exponat Congregationi de Cultu Divino et Disciplina Sacramentorum, cuius est quamvis aliam dispositionem aut capere aut approbare, quoad libros liturgicos una cum aliis Conferentiis editos illosve alibi iam adhibitos usurpandos. Quae vero licentia Sanctae Sedis solummodo ad actum conceditur. </section><section> Circa translationes formularum sacramentalium, quas Congregatio de Cultu Divino iudicio Summi Pontificis subicere debet, sequentia sunt observanda, praeter ea quae ad translationem aliorum textuum liturgicorum requiruntur: a) Cum de linguis anglica, gallica, germanica, hispanica, italica, lusitana agitur, omnia acta, singulis linguis conscripta, praesententur; b) Si translatio a textu vulgari iam	731:744	0:1392
sacramentum	NN	[2000,2100]	2	39_5	 	, ad normam iuris, apud Episcopum;. Romanus Pontifex,; Vicarius Christi atque universae Ecclesiae his in terris Pastor,[;] vi muneris sui suprema, plena, immediata et universali in Ecclesia gaudet ordinaria potestate, quam semper libere exercere valet;, etiam communicans cum pastoribus et gregibus. Apostolicae Sedis est sacram Liturgiam Ecclesiae universae ordinare, libros liturgicos edere eorumque versiones in linguas vernaculas recognoscere, necnon advigilare ut ordinationes liturgicae, eaeque praesertim quibus augustissimi Sacrificii Missae celebratio moderatur, ubique fideliter observentur. Congregatio de Cultu Divino et Disciplina Sacramentorum; ea agit quae, salva competentia Congregationis de Doctrina Fidei, ad Sedem Apostolicam pertinent quoad moderationem ac promotionem sacrae Liturgiae, in primis Sacramentorum. Sacramentorum disciplinam, praesertim quod attinet ad eorum validitatem et licitam celebrationem, fovet atque tuetur;. Demum; attente invigilat ut ordinationes liturgicae adamussim serventur, abusus praecaveantur iidemque, ubi deprehendantur, exstirpentur;. Qua in re, iuxta universae Ecclesiae traditionem, praeeminet sollicitudo de celebratione sanctae Missae et de cultu, qui sanctissimae Eucharistiae etiam extra Missam tribuitur. Ius habent christifideles, ut auctoritas ecclesiastica plene	644:657	0:1329
sacramentum	NN	[1100,1200]	2	39_6	 	, adesses, mori cum eis putares et afflictione multa deficere. Nocte itaque insecuta, cives, qui capti fuerant, vinculis districti sunt et alligati. Mane autem facto, die quidem dominico, ad dominum papam veniunt quidam de civibus Beneventanis, viri sapientes et discreti, qui omnia, quae Apostolicus exquisierat, assecuti sunt; continuo captivos cives Beneventanos, quos Teutonici comprehenderant, dominus Apostolicus absolvi iussit et ad propria reverti. Et sic, sacramentis firmatis, fidelitatem domino papae complures civium, qui ad ipsum pontificem exierant, iuraverunt. Cumque taliter sacramenta illa perficerentur, vir quidam, Iaquintus nomine, civis Beneventanus, quique per triennium exulaverat, ultionem redere de acceptis excogitans, Teutonicos omnes submovit, ut civitatem ingredientes, quot possent, caperent, et bona eorum auferrent. Qui cursu rapido, armis acceptis, insiliunt et usque portam Ruffini festinaverunt; sed quia portam illam hi, qui intrinsecus erant, firmiter clauserant, civitatem ingredi non potuere. Fama itaque tantae invasionis cum ad aures pontificis Innocentii pervenit, predictum ducem Henricum vocari mandavit, ut exercitum illum compesceret et a tali mortifera agressione illum	591:601	0:1217
sacramentum	NN	[600,700]	2	39_7	 	, adversus Theodericum regem excitantur ad bellum. Commoto exercitu ad locum cui vocabulum est Locofao, interim commissi praelium ineunt, ibique magno certamine dimicantes, plurima pars populi ex utrisque partibus corruit. Devicti cum sociis Martinus atque Pippinus in fugam lapsi sunt; persecutusque eos Ebruinus, maximam partem de illa regione vastavit. Martinus ideoque Lugduno Clavato ingressus, se infra muros ipsius urbis munivit. Persecutusque eum Ebruinus, veniens Erchreco villa, ad Lugdunum Clavatum nuntios dirigit, Aegilbertum ac Reulum, Remensis urbis episcopum, ut fide promissa in incertum super vacuas capsas sacramenta falsa dederent. Qua in re ille credens eos, a Lugduno Clavato egressus, cum sodalibus ac sociis ad Erchrecum veniens, illuc cum suis omnibus interfectus est. XCVIII. Ebruinus quoque magis atque profusius crudeliter Francos opprimebat, donec tandem aliquando Ermenfrido Franco minas parat, resque proprias tollere disponit. Consilio cum suis patrato, nocte collecta manu sociorum, per noctem super eum consurgens, Ebruinum interfecit. AN. DCLXXXI. Quo perempto, ad Pippinum ducem in Auster cum muneribus suis pervenit. Quo facto, Franci, accepto consilio, Waradonem,	625:635	0:1202
sacramentum	NN	[100,200]	2	39_8	 	, aiebat, salvum fecit, et, Remittuntur tibi peccata, credenti utique nec tamen tincto. id si apostolis defuit nescio quorum fides tuta sit. uno verbo domini suscitatus teloneum dereliquit, patrem et navem et artem qua vitam sustentabat deseruit,[ qui] patris exsequias despexit, summum illud domini praeceptum, Qui patrem aut matrem mihi praeposuerit non est me dignus, ante perfecit quam audivit. </section><section> Hinc ergo scelestissimi illi provocantes quaestiones, Adeo, dicunt, baptismus non est necessarius quibus fides satis est: nam et Abraham nullius aquae nisi fidei Sacramento deo placuisse. sed in omnibus posteriora concludunt et sequentia antecedentibus praevalent. fuerit salus retro per fidem nudam ante domini passionem et resurrectionem: at ubi fides aucta est, credentibus in nativitatem passionem resurrectionemque eius addita est ampliato sacramento obsignatio baptismi, vestimentum quodammodo fidei quae retro erat nuda, nec potest iam sine sua; salvare; lege. lex enim tinguendi imposita est, et forma praescripta: Ite, inquit, docete nationes tinguentes eas in nomine patris et filii et spiritus sancti. huic legi collata definitio illa, Nisi quis renatus fuerit ex	581:591	0:1194
sacramentum	NN	[2000,2100]	2	39_9	 	, aliquibus in certis definitisque casibus peculiaribus, sacramenta Eucharistiae, Paenitentiae, Unctionis Infirmorum aliis christianis posse ministrare, qui non in plena sunt communione cum Ecclesia catholica, sed qui ardenter cupiunt illa recipere, ea libere petunt et fidem ostendunt quam Ecclesia catholica in haec confitetur sacramenta. Vicissim in peculiaribus casibus catholici quoque petere possunt eadem sacramenta a ministris earum Ecclesiarum, in quibus ea valida sunt;. Has condiciones oportet bene extollere, quibus nihil detrahi potest, etiamsi de peculiaribus certis agitur casibus, quoniam repudiatio unius aut alterius veritatis fidei de his Sacramentis, et inter quas veritates invenitur etiam necessitas Sacerdotii ministerialis ut sint valida, iam petentem reddit haud idoneum ad legitimam eorum administrationem. Et ex contrario, non valebit catholicus fidelis communionem percipere apud communitatem cui deest validum Ordinis sacramentum. Omnium harum hac in re statutarum regularum fidelis observantia monstrat simulque in tuto collocat amorem tum erga Iesum Christum in Sanctissimo Sacramento tum in fratres ac sorores alterius confessionis christianae, quibus veritatis testificatio debetur, ac postremo etiam erga ipsam causam unitatis promotionis. Relatio finalis, II, C.: L'' Osservatore Romano, Decembris	658:669	0:1333
