lemma	pos	date	grouping	identifier	description	context	indexes_target_token	indexes_target_sentence
sacramentum	NN	[500,600]	2	39_10	 	, Andarchius expetiit Ursum regis praesentiam arcessire. Cumque venisset apud villam Brinnacum, requiret hominem alium Ursum nomen, quem ad altarium clam adductum iurare fecit ac dicere:'' Per hoc locum sanctum et reliquias martyrum beatorum, quia, si filiam meam tibi in matrimonium non tradidero, sidecem milia soledorum tibi satisfacere non morabor''. Stabant enim testes in sacrario, abscultantes occultae verba loquentes, sed personam qui loqueretur paenitus non videntis. Tunc Andarchius demulsit verbis  lenibus Urso, fecitque eum sine regis praesentiam reverti ad patriam. Factoque ex hoc iuramento breve sacramentorum, rege illo protulit discidente, dicens:'' Haec et haec mihi Ursus scripsit; et ideo gloriae vestrae praeceptionem deposco, ut filiam suam mihi tradat in matrimonio. Alioquin liceat mihi res eius possedere, donec, sedicem milibus solidorum acceptis, me ab hac causa removeam''. Tunc, adeptis praeceptionibus, Arvernum redit, ostendit iudici iussionem regis. Ursus autem se in Villavo territurio contulit. Cumque res eius huic consignarentur, et hic in Villavum accessit. Ingressusque unam Ursi domum, caenam sibi praecepit praeparare atque aquas quibus ablueretur calefieri iubet	613:626	0:1206
sacramentum	NN	[2000,2100]	2	39_11	 	, Antiphonalis Romani, necnon aliorum librorum cantus gregoriani, atque editiones librorum Ritus romani tamquam editiones typicas per decretum promulgatas, uti v. gr. sunt Caeremoniale Episcoporum et Calendarium Romanum. </section><section> Quoad libros liturgicos Ritus romani editione typica promulgatos sive ante sive post Concilium Vaticanum II ex decreto Congregationum pro tempore competentium, Sedes Apostolica per Administrationem Patrimonii aut, eius nomine et mandato, per; Libreria Editrice Vaticana; ius proprietatis, quod vulgo dicitur; copyright;, obtinet ac sibi vindicat. Licentia tamen denuo imprimendi ad Congregationem de Cultu Divino et Disciplina Sacramentorum spectat. </section><section> Librorum liturgicorum Ritus romani editiones; iuxta typicam; dicuntur, si agitur de libris lingua latina exaratis qui ex concessione Congregationis de Cultu Divino et Disciplina Sacramentorum ab editore post editionem typicam parantur. </section><section> Ad editiones; iuxta typicam;, usui liturgico destinatas, quod attinet: ius libros liturgicos excudendi, qui unum textum latinum referunt, reservatur ad; Libreria Editrice Vaticana; atque iis editoribus, quibus Congregatio de Cultu Divino et Disciplina Sacramentorum concredere maluit expressis pactionibus, nisi aliud constet ex normis in ipsa editione typica insertis. </section><section> Ius libros liturgicos	668:681	0:1379
sacramentum	NN	[2000,2100]	2	39_12	 	, atque Episcopis, sed etiam Presbyteris, Diaconis et omnibus christifidelibus laicis exponere, ut quisque pro officio et posse haec omnia in effectum ducat. Normae, quae in hac presenti Instructione continentur, ad rem liturgicam pertinere intellegantur in Ritu romano, et, mutatis mutandis, in ceteris Ritibus Ecclesiae latinae iure recognitis.; Nihil dubitatur quin permagnas utilitates attulerit liturgica Concilii reformatio ad magis consciam, actuosam ac fructuosam fidelium participationem sancti Sacrificii altaris;. Attamen; umbrae non desunt;. Sic taceri non possunt abusus etiam gravissimi contra naturam Liturgiae et sacramentorum necnon traditionem et auctoritatem Ecclesiae, qui nostra aetate haud raro in hoc vel illo ecclesiali ambitu celebrationes liturgicas affligunt. Aliquibus in locis abusuum patratio in re liturgica facta est veluti mos, quod patet admitti non posse et cessare debere. Observatio normarum ab Ecclesiae auctoritate emanatarum conformitatem mentis et vocis, actionis externae et attentionis cordis expostulat. Observatio mere externa normarum, sicut patet, essentiae contraria esset sacrae Liturgiae, in qua Christus Dominus congregare vult Ecclesiam suam ut cum ipso fiat; unum corpus et unus spiritus;. Quapropter actio externa illuminata esse	629:642	0:1284
sacramentum	NN	[1100,1200]	2	39_13	 	, bellicis exercitationibus minus assueti, praesentia hostium deterriti, pacem libere ad colloquium cum comite accedendi expetunt: quo a comite concesso, ad tentorium comitis sibi locutum, ut pacem faciant, accedunt. Diversisque circumlocutionibus usi, tandem cum calliditatem principis minus se fallere posse perpendunt, pro libitu comitis primo captivos christianos, quorum plurimam multitudinem infra urbem tenebant, reddunt, et equos et mulos et arma omnia, quae habebant, cum infinita pecunia comiti offerunt. Datam unoquoque anno persolvendo determinantes, urbem comiti se serviendam promittunt: sicque more legis suae, sacramentis datis, comiti confoederati sunt. Videntes autem captivos christianos, ab urbe progredientes, prae gaudio suae insperatae liberationis ab imo quoque cordis lacrimis profundi, ligno vel calamis, prout quisque primo inveniebant, compositas cruces in dexteris ferentes, Kyrie eleyson proclamando, ad pedes comitis provolvi, nostri vero ad talem intuitum pietatis affectu lacrimoso rore perfunduntur. Comes ergo, taliter urbe sibi confoederata, captivos, asportet, per naves ordinans, reditum cum magno timore, prae nimio pondere captivorum, ut submersionem veritus, accelerat. Sed dextera Dei, ut credimus	626:637	0:1240
sacramentum	NN	[2000,2100]	2	39_14	 	, biblicam translationem in lectione adhibitam accurate retineant, si haec congruentia in Ordine lectionum Missae adest. c) Item demum Va, prout in Ordine lectionum Missae praescripta, initio lectionis posita et; incipit; nuncupata, sequantur quam arctissime versionem biblicam in linguam vulgarem, unde de more sumpta sunt, neque aliis translationibus inhaereant. Quod vero ad huiusmodi elementa attinet, quae ipsius textus biblici non sunt, in Lectionariis componendis accurate vertantur ex latino in sermonem vulgarem, nisi Conferentia Episcoporum petierit et consecuta sit praeviam licentiam Congregationis de Cultu Divino et Disciplina Sacramentorum, qua concessum sit, ut alia procedendi ratio in lectionum introitu haberetur. </section><section> Normae supra statutae et eae, quae Sacram Scripturam respiciunt, applicari debent, mutatis mutandis, textibus quoque liturgicis ecclesiastica manu compositis. </section><section> Quoniam translatio thesaurum orationum oportet transmittat perennem sermone quodam expressum, qui scilicet intellegi possit in; contextu culturali;, cui destinatur, regatur etiam persuasione, qua vera precatio liturgica non solum culturae ingenio formatur, sed ipsa ad efformandam culturam confert, quapropter nihil mirum si aliquatenus differre potest a sermocinatione communi. Translatio liturgica, quae debitam auctoritatis	641:654	0:1359
sacramentum	NN	[1100,1200]	2	39_15	 	, caeteros crudeliter occidunt. Videns hoc princeps suisque ex angustia viarum nullum presidium ferre valens, sevissima mentis amaritudine perculsus, rerum tamen, quas ab adolescentia gesserat, ac antiquae virtutis memoria quasi caelesti rore repletus in collem quendam cum paucis, quos adhuc residuos habebat, se recepit. Quem prefatus dux, suis in circuitu[ ipsius] positis magnarumque arborum iactu et clausura reditum negantibus, tamquam clausum tenuit. Tandem Heinrico Saxoniae marchione, qui de sororeducis natus cum rege advenerat, mediante ad pedes imperatoris satisfactionem offerens humiliter dux venit hominiumque sibi cum sacramento fidelitatis exhibens ducatum ab eo suscepit, captivos reddidit; sicque princeps, portatis se cum eorum qui nobiliores erant funeribus, cum multo merore rediit. </section><section> Capitulum Inter caeteros nobilissimus marchio Saxoniae Albertus captus fuerat. Tanta vero strages Saxonum et precipue nobilium et illustrium virorum ibi facta fuit, ut perpetui odii inter Saxones et Boemos fomes tunc accensus nondum extinctus sit. Otto quoque, qui huius concussionis auctor fuerat, ambitionis suae penas luens ibidem necatus est. Sed, ut dicitur:, sic et hunc principem melior fortuna secuta ad tantum apicem provexit,	634:644	0:1261
sacramentum	NN	[1000,1200]	2	39_16	 	, causae uel opportunitates pensandae sunt in singulis. Quod quidam minus attendentes, inde omnia iam respuenda iudicant, quia figurae fuerunt subsecutae ueritatis, et per Christum iam completae. Unde merito illa iam omnino superflua censent, ubi quam praefigurabant ueritas completa est: ne forte si adhuc cum ipsa ueritate retinerentur figurae, quae ipsam praesignarunt, adhuc exspectaretur futurum quod iam est completum. Sed iuxta hanc profecto rationem, omne rei futurae sacramentum uel figuram mysticam manere non conuenit postquam res eius compbeta est. Unde et coniugium, quod Christi et Ecclesiae continet sacramentum, uel ipsam regum et sacerdotum unctionem, cum his, quae praediximus a nobis retineri, cessari iam oportet. Ut iam uidelicet nec sacrificium Melchisedech in figuris sequamur, nec altaria chrismate consecremus, nec ecclesias dedicemus, nec candelabra in ecclesiis erigamus, et caetera quae diximus penitus remoueamus. Quod quia nemo fidelium uel discretorum approbat, constat aliquas esse rationes, cur ex Veteri Testamento nonnulla in rerum signis sicut in uerbis omnia retinemus. Quamuis enim prolationes uerborum manifestius quam figurae sacramentorum demonstrent id quod significant, nulla tamen Veteris Testamenti uerba respuimus,	615:626	0:1261
sacramentum	NN	[200,300]	2	39_17	 	, certis tamen legibus uinctos inspicimus ad metas definiti sibi temporis ducere, ut merito nobis quoque cum apostolo et artificem et opera mirantibus exclamare iam libeat: et reliqua. </section><section> Eadem regula ueritatis docet nos credere post Patrem etiam in Filium Dei Christum Iesum Dominum Deum nostrum, sed Dei Filium, huius Dei qui et unus et solus est, conditor scilicet rerum omnium, ut iam et superius expressum est. Hunc enim Iesum Christum, iterum dicam huius Dei Filium, et in ueteri testamento legimus esse repromissum et in nouo testamento animaduertimus exhibitum, omnium sacramentorum umbras et figuras de praesentia corporatae ueritatis implentem. Hunc enim Abrahae filium, hunc Dauid, hunc non minus et uetera praedicta et euangelia testantur. Hunc ipsa Genesis, cum dicit: hunc, quando luctatum ostendit hominem cum Iacob, hunc, quando dicit: Hunc Moyses, cum dicit: hunc idem, quando testatur: dicendo, hunc, quando dicit: Hunc Esaias: hunc eundem, quando dicit: hunc, quando sanitates ab eo futuras collocat dicens: hunc, quando patientiae uirtutes expromit dicens: Hunc, quando eius euangelia descripsit	594:607	0:1133
sacramentum	NN	[1000,1200]	2	39_18	 	, circumcisus legitur, per quod uidelicet carnalium Abrahae filiorum circumcisio designetur exterior, per quam, ut dictum est, carnalis Ismael cognosceretur. Isaac uero, qui postea natus est, gentilis populi postea uocati spiritualem a uitiis circumcisionem exprimit, quam et proselyti praefigurabant. Recte itaque Apostolus, signum et signaculum distinguens quantum ad Iudaeos carnales Abrahae filios et gentiles filios eiusdem spirituales, dixit primitus signum circunicisionis, id est signum carnalis Israel, per quod uidelicet populus ille a caeteris distinguebatur, et postmodum SIGNACULUM IUSTITIAE FIDEI quae est in praeputio, id est sacramentum spiritualis circumcisionis quam solam habent fideles ex gentibus collecti. Potest etiam signaculum quasi expressum signum intelligi, iuxta quod in laude apostatae angeli dicitur: Tu, signaculum similitudinis. . . etc. Per hoc quippe circumcisionis signum maxime iustus ac spiritualis homo exprimitur qui uoluptatibus carnis propter Deum renuntiat, et a se illas amputat quae maxime in renibus dominantur et per genitalia exercentur. Potest etiam signaculum quasi diminutiuum accipi a'' signo'' id est paruum signum iustitiae Abrahae. Non enim erat magnum illam cuticulam ad imperium Dei amputare, ad comparationem eorum quae	641:652	0:1278
sacramentum	NN	[100,200]	2	39_19	 	, conscios, socios. De nobis nihil tale, cum aeque extorqueri oporteret quod cum falso iactatur, quot quisque iam infanticidia degustasset, quot incesta contenebrasset, qui coqui, qui canes affuissent. O quanta illius praesidis gloria, si eruisset aliquem, qui centum iam infantes comedisset! Atquin invenimus inquisitionem quoque in nos prohibitam. Plinius enim Secundus, cum provinciam regeret, damnatis quibusdam Christianis, quibusdam gradu pulsis, ipsa tamen multitudine perturbatus, quid de cetero ageret, consuluit tunc Traianum imperatorem, adlegans praeter obstinationem non sacrificandi nihil aliud se de sacramentis eorum comperisse quam coetus antelucanos ad canendum Christo ut deo et ad confoederandam disciplinam, homicidium adulterium fraudem perfidiam et cetera scelera prohibentes. Tunc Traianus rescripsit hoc genus inquirendos quidem non esse, oblatos vero puniri oportere. O sententiam necessitate confusam! Negat inquirendos ut innocentes et mandat puniendos ut nocentes. Parcit et saevit, dissimulat et animadvertit. Quid temet ipsam, censura, circumvenis? Si damnas, cur non et inquiris? Si non inquiris, cur non et absolvis? Latronibus vestigandis per universas provincias militaris statio sortitur, in reos maiestatis et	615:626	0:1247
sacramentum	NN	[1900,2000]	2	39_20	 	, conservationem et statum dioecesium. Quare ipsa vigilat super impletis vel minus obligationibus, quibus Ordinarii tenentur; cognoscit ea quae ab Episcopis scripto relata sint de statu suarum dioecesium; indicit visitationes apostolicas examinatque eas quae fuerint absolutae, transmissis in utroque casu ad singulas Congregationes iis ad deliberandum negotiis quae ad eas peculiariter pertinent. Can.. par. Congregationi de disciplina Sacramentorum proposita est universa legislatio circa disciplinam septem Sacramentorum, incolumi iure Congregationis S. Officii circa ea quae in can. statuta sunt, et Sacrorum Rituum Congregationis circa ritus et caeremonias quae in Sacramentis conficiendis, ministrandis et recipiendis servari debent. par. Ad illam itaque spectant ea omnia, quae decerni concedique solent tum in disciplina matrimonii, tum in disciplina aliorum Sacramentorum nec non in celebratione Sacrificii Eucharistici, iis tantum exceptis quae aliis Congregationibus reservata sunt. par. Ipsa cognoscit quoque et exclusive de facto inconsummationis matrimonii et de exsistentia causarum ad dispensationem concedendam, nec non de iis omnibus, quae cum his sunt connexa. Potest tamen cognitionem horum omnium, si id expedire iudicaverit, ad Sacram Romanam Rotam remittere. Pariter ad eam deferri possunt	670:681	0:1313
sacramentum	NN	[500,600]	2	39_21	 	, cum aliquando a quibusdam pro furtu argueritur, ait:; Ibo ad basilicam beati Martini, et sacramentis me exuens, innocens reddar;. Quo ingrediente, elapsa secure de manu eius, ad usteum ruit, gravi cordis dolore perculsus. Confessusque est miser verbis  propriis quae venerat excusare periuriis. Alius simili modo cum de incendiis domus vicini sui argueritur, ait:; Vadam ad templum sancti Martini et, fide data, insons redditurus ero ab hoc crimine;. Manifestum erat enim, hunc domum illam incendio concremasse. Abiens autem ad sacramenta danda, conversus ad eum, dixi ei:; Quantum vicinorum tuorum dictat assertio, non eris innocens ab hoc scelere; sed tamen Deus ubique est, et virtus eius ipsa est forinsecus, quae habetur intrinsecus. Tamen si ita te vana fiducia coepit, quod Deus vel sancti eius in periuribus non ulciscantur, ecce! templum sanctum e contra, iura, ut libet. Nam calcare limen sacrum non permitteris;. Ad ille, elevatis manibus, ait:; Per omnipotentem Deum et virtutem beati Martini antestitis eius, quia hoc incendium	530:540	0:1043
sacramentum	NN	[1000,1200]	2	39_22	 	, cum statim creatio talium perfecta fuisse credenda sit, alioquin diu educanda essent, ut ad perfectionem uenirent. Quod si de auibus quoque intelligamus, non facile apparet unde alimentorum acciperent nutrimentum. REPLETE, hoc est quantum satis sit ad hoc fructificate. AQUAS MARIS, cum tamen et aquae dulces, tam pisces habeant quam uolucres. Sed constat quia omnis congregatio aquarum tam salsa quam dulcis mare dicitur, et omnes aquae ex mari proueniunt. Ubi et quod ait: ANIMAM VIVENTEM ATQUE MOTABILEM de his scilicet animantibus quae producta sunt ex aquis, sacramento baptismi plurimum congruere uidetur, ubi a peccato liberati et quasi de morte suscitati, per uiuificatorem spiritum nasci ac uiuere in deo incipimus, ac de ueteri Adam in nouum promouemur et in membra Christi transformamur. Et attende quod solis animantibus istis ex aqua scilicet creatis et postmodum hominibus, et tandem septimo diei deus inter haec opera benedicere memoratur, benedictione hominis media constituta, tamquam ad illam caeteris duabus conuenientibus. Benedictio quippe hominis a baptismo incipit, remissione plenaria peccatorum ibi percepta, ac postmodum in sabbatum supernae felicitatis promota consummatur, ut hinc quoque	566:576	0:1218
sacramentum	NN	[1100,1200]	2	39_23	 	, cum taliter fama huiusmodi per civitatem ventilaretur, en subito, armis acceptis, maxima civitatis turba in plateas exivit, et furore arrepto, super cardinalem Crescentium insurgens in fugam illum perduxit. Cardinalis autem timore coactus fugiendo deseruit et ad regem festinanter acceleravit; nuntiavit itaque omnia, quae Beneventi acciderant, et qualiter in eum, lapidibus armisque acceptis, insurrexisset turba civitatis. Landulphus autem archiepiscopus sic cardinalem fugientem aspiciens palatium episcopii ascendit et ibi timore coactus morabatur. Quibus ita peractis, populus in unum catervatus, armis eductis, palam vociferabantur, quod sacramenta regi Rogerio noviter facta non observentur:; Nolumus quidem sic regi alligari, et sacramentis astricti in expeditionibus suis cum Siculis et Calabridibus Apulisque sole ardenti et sudore fatigati anelare. In deliciis quidem positi et periculis exercitalibus nunquam assueti, cum tali tantoque rege consortia minime habeamus;. His ita premissis, memoratus princeps et comes Rainulphus, nuntiis acceptis, Beneventanis miserunt pacis verba et securitatis dilectionem:; Notum sit vobis, quoniam princeps et comes, et Rao de Fraineta et Ugo Infans, sacramentis intervenientibus, dimittet in perpetuum Beneventanis omnes fidantias et	646:656	0:1285
sacramentum	NN	[2000,2100]	2	39_24	 	, diei martii: pp.-,-; Litt. ad quemdam Episcopum, diei iulii: pp.- </section><section> Caput III DE SANCTAE MISSAE RECTA CELEBRATIONE De materia Sanctissimae Eucharistiae Panis, qui in sacrosancti eucharistici Sacrificii celebratione adhibetur, debet esse azymus, mere triticeus et recenter confectus, ita ut nullum sit periculum corruptionis. Ideo consequitur panem ex alia substantia etiam cereali conflatum, vel illum cui tanta sit admixta quantitas materiae a tritico diversae, ut, iuxta communem aestimationem, tritici panem esse dici nequeat, materiam validam pro conficiendo Sacrificio et Sacramento eucharistico haud constituere. Gravis est abusus alias substantias, ut sunt fructus vel saccharum vel mel, in panem ad Eucharistiam conficendum introducere. Patet hostias conficiendas esseab iis, qui non solum honestate praestent, sed etiam ipsis conficiendis sint experti, idoneisque instrumentis instructi. Ratione signi convenit, ut aliquae partes panis eucharistici ex fractione provenientes aliquibus saltem fidelibus in Communionem distribuantur.; Parvae tamen hostiae minime excluduntur, quando numerus sacram Communionem sumentium aliaeque rationes pastorales id exigunt;, immo adhibeantur ex more pro magna parte particulae parvae, quae ulteriori fractione non	597:607	0:1278
sacramentum	NN	[500,600]	2	39_25	 	, domine Deus, largire auxilium servo tuo!'' Rex autem dicebat:'' Crimen uxoris meae meum habetur obprobrium. Si ergo censitis, ut super episcopum testes adhibeantur, ecce adsunt! Certe, si videtur, ut haec non fiant et in fidem episcopi committantur, dicite; libenter audiam quae iubetis''. Mirati sunt omnes regis vel prudentiam vel patientiam simul. Tunc cunctis dicentibus:'' Non potest persona inferior super sacerdotem credi'', restitit ad hoc causa, ut, dictis missis in tribus altaribus, me de his verbis  exuerem sacramento. Et licet canonibus essent contraria, pro causa tamen regis impleta sunt. Sed nec hoc sileo, quod Rigunthis regina, condolens doloribus meis, ieiunium cum omni domo sua celebravit, quousque puer nuntiaret, me omnia sic implesse, ut fuerant instituta. Igitur regressi sacerdotes ad regem aiunt:'' Impleta sunt omnia ab episcopo quae imperata sunt. O rex, quid nunc ad te, nisi ut cum Berthramno accusatore fratris communione priveris?'' Et ille:'' Non'', inquid,'' ego nisi audita narravi''. Quaerentibus illis	522:532	0:1043
sacramentum	NN	[100,200]	2	39_32	 	. Nec oblitus ille veteris amicitiae prompte suscipit, meque per scalas complicitis pedibus in superius cenaculum adtracto hortulanus deorsus in ipsa tabernula derepit in quandam cistulam et supergesto delitiscit orificio. At miles ille, ut postea didici, tandem velut emersus gravi crapula, nutabundus tamen et tot plagarum dolore saucius baculoque se vix sustinens, civitatem adventat confususque de impotentia deque inertia sua quicquam ad quemquam referre popularium, sed tacitus iniuriam devorans quosdam commilitones nanctus is tantum clades enarrat suas. Placuit ut ipse quidem contubernio se tantisper absconderet- nam praeter propriam contumeliam militaris etiam sacramenti genium ob amissam spatham verebatur-, ipsi autem signis enotatis investigationi vindictaeque sedulam darent operam. Nec defuit vicinus perfidus, qui nos ilico occultari nuntiaret. Tunc commilitones accersitis magistratibus mentiuntur sese multi pretii vasculum argenteum praesidis in via perdidisse idque hortulanum quendam reperisse nec velle restituere, sed apud familiarem quendam sibi delitescere. Tunc magistratus et damno et praesidis nomine cognito veniunt ad deversori nostri fores claraque voce denuntiant hospiti nostro nos, quos occultaret apud se certo certius, dedere potius quam discrimen proprii subiret capitis. Nec ille tantillum conterritus salutique studens eius,	672:682	0:1366
sacramentum	NN	[100,200]	2	39_33	 	. Quid latrones, quid ferae, quid servitium, quid asperrimorum itinerum ambages reciprocae, quid metus mortis cotidianae nefariae Fortunae profuit? In tutelam iam receptus es Fortunae, sed videntis, quae suae lucis splendore ceteros etiam deos illuminat. Sume iam vultum laetiorem candido isto habitu tuo congruentem, comitare pompam deae sospitatricis inovanti gradu. Videant inreligiosi, videant et errorem suum recognoscant: en ecce pristinis aerumnis absolutus Isidis magnae providentia gaudens Lucius de sua Fortuna triumphat. Quo tamen tutior sis atque munitior, da nomen sanctae huic militiae, cuius non olim sacramento etiam rogabaris, teque iam nunc obsequio religionis nostrae dedica et ministerii iugum subi voluntarium. Nam cum coeperis deae servire, tunc magis senties fructum tuae libertatis.; Ad istum modum vaticinatus sacerdos egregius fatigatos anhelitus trahens conticuit. Exin permixtus agmini religioso procedens comitabar sacrarium totae civitati notus ac conspicuus, digitis hominum nutibusque notabilis. Omnes in me populi fabulabantur:; Hunc omnipotentis hodie deae numen augustum reformavit ad homines. Felix hercule et ter beatus, qui vitae scilicet praecedentis innocentia fideque meruerit tam praeclarum de caelo patrocinium ut renatus quodam modo statim sacrorum	616:626	0:1293
sacramentum	NN	[100,200]	2	39_34	 	ad vicina urbi; in qua omne mortalium genus vis pestilentiae depopulabatur, nulla caeli intemperie quae occurreret oculis. sed domus corporibus exanimis, itinera funeribus complebantur; non sexus, non aetas periculo vacua; servitia perinde et ingenua plebes raptim extingui, inter coniugum et liberorum lamenta, qui dum adsident, dum deflent, saepe eodem rogo cremabantur. equitum senatorumque interitus quamvis promisci minus flebiles erant, tamquam communi mortalitate saevitiam principis praevenirent. Eodem anno dilectus per Galliam Narbonensem Africamque et Asiam habiti sunt supplendis Illyrici legionibus, ex quibus aetate aut valetudine fessi sacramento solvebantur. cladem Lugdunensem quadragies sestertio solatus est princeps, ut amissa urbi reponerent; quam pecuniam Lugdunenses ante obtulerant urbis casibus. </section><section> C. Svetonio Luccio Telesino consulibus Antistius Sosianus, factitatis in Neronem carminibus probrosis exilio, ut dixi, multatus, postquam id honoris indicibus tamque promptum ad caedes principem accepit, inquies animo et occasionum haud segnis Pammenem, eiusdem loci exulem et Chaldaeorum arte famosum eoque multorum amicitiis innexum, similitudine fortunae sibi conciliat, ventitare ad eum nuntios et consultationes non frustra ratus; simul annuam pecuniam a P. Anteio ministrari cognoscit. neque nescium	651:661	0:1347
