lemma	pos	date	grouping	identifier	description	context	indexes_target_token	indexes_target_sentence
salus	NN	[-100,0]	1	38_1	 	- est deductus. Quo cum extemplo concursus omnis generis hominum esset factus, submota cetera multitudine senatus Alorco datus est, cuius talis oratio fuit:; Si civis vester Alco, sicut ad pacem petendam ad Hannibalem venit, ita pacis condiciones ab Hannibale ad vos rettulisset, supervacaneum hoc mihi fuisset iter, quo nec orator Hannibalis nec transfuga ad vos veni; sed cum ille aut vestra aut sua culpa manserit apud hostem- sua, si metum simulavit: vestra, si periculum est apud vos vera referentibus- ego, ne ignoraretis esse et salutis aliquas et pacis vobis condiciones, pro vetusto hospitio quod mihi vobiscum est ad vos veni. Vestra autem causa me nec ullius alterius loqui quae loquor apud vos vel ea fides sit quod neque dum vestris viribus restitistis neque dum auxilia ab Romanis sperastis pacis unquam apud vos mentionem feci. Postquam nec ab Romanis vobis ulla est spes nec vestra vos iam aut arma aut moenia satis defendunt, pacem adfero ad vos magis necessariam quam aequam. Cuius ita aliqua spes est, si eam, quemadmodum ut victor fert Hannibal, sic vos ut victi audiatis	536:543	0:1092
salus	NN	[-100,0]	1	38_10	 	-: sed quamquam ea Tatio sic erant discripta vivo, tamen eo interfecto multo etiam magis Romulus patrum auctoritate consilioque regnavit. </section><section> Quo facto primum vidit iudicavitque idem quod Spartae Lycurgus paulo ante viderat, singulari imperio et potestate regia tum melius gubernari et regi civitates, si esset optimi cuiusque ad illam vim dominationis adiuncta auctoritas. itaque hoc consilio et quasi senatu fultus et munitus, et bella cum finitimis felicissime multa gessit, et cum ipse nihil ex praeda domum suam reportaret, locupletare civis non destitit. Tum, id quod retinemus hodie magna cum salute rei publicae, auspiciis plurimum obsecutus est Romulus. nam et ipse, quod principium rei publicae fuit, urbem condidit auspicato, et omnibus publicis rebus instituendis, qui sibi adessent in auspiciis, ex singulis tribubus singulos cooptavit augures, et habuit plebem in clientelas principum discriptam- quod quantae fuerit utilitati post videro- multaeque dictione ovium et boum- quod tunc erat res in pecore et locorum possessionibus, ex quo pecuniosi et locupletes vocabantur- non vi et suppliciis coercebat. Ac Romulus cum septem et triginta regnavisset annos, et haec egregia duo firmamenta	616:622	0:1219
salus	NN	[-300,0]	1	38_17	 	, </line><line> dum scribo, expleui totas ceras quattuor. </line><line> Sed quid Lyconem quaeris? Mandatumst mihi </line><line> ut has tabellas ad eum ferrem. Quis tu homo es? </line><line> Libertus illius, quem omnes Summanum uocant. </line><line> Summane, salue. Qui Summanus? Fac sciam. </line><line> Quia uestimenta, ubi obdormiui ebrius, </line><line> summano, ob eam rem me omnes Summanum uocant. </line><line> Alibi te meliust quaerere hospitium tibi: </line><line> apud me profecto nihil est Summano loci. </line><line> Sed istum quem quaeris ego sum. Quaeso, tune is es, </line><line> Lyco tarpezita? Ego sum. Multam me tibi </line><line> salutem iussit Therapontigonus dicere, </line><line> et has tabellas dare me iussit. Mihin? Ita. </line><line> Cape, signum nosce. Nostin? Quidni nouerim? </line><line> clupeatus elephantum ubi machaera diligit. </line><line> Quod isti scriptum est, id te orare iusserat </line><line> profecto ut faceres, suam si uelles gratiam. </line><line> Concede, inspiciam quid sit scriptum. Maxume, </line><line> tuo arbitratu, dum auferam aps te id quod peto. </line>  <line> " Miles Lyconi in Epidauro hospiti </line><line> suo Therapontigonus Platagidorus plurumam </line><line> salutem dicit". Meus hic est, hamum uorat. </line>  <line> " Tecum oro et quaeso, qui has tabellas adferet </line>	648:655	0:1336
salus	NN	[-300,0]	1	38_31	 	, </line><line> postquam Polymachaeroplagidem elocutus nomen es. </line><line> Quid agit is? Quod homo edepol fortis atque bellator probus. </line><line> Sed propera hanc pellegere quaeso epistulam ita negotiumst </line><line> atque accipere argentum actutum mulieremque emittere. </line><line> Nam necesse hodie Sicyoni me esse aut cras mortem exsequi, </line><line> ita eru meus est imperiosus. Noui, notis praedicas. </line><line> Propera pellegere epistulam ergo. Id ago, si taceas modo. </line>  <line> " Miles lenoni Ballioni epistulam </line><line> conscriptam mittit Polymachaeroplagides, </line><line> imagine opsignatam quae inter nos duo </line><line> conuenit olim." Sumbolust in epistula. </line><line> Video et cognosco signum. Sed in epistula </line><line> nullam salutem mittere scriptam solet? </line><line> Ita militaris disciplinast, Ballio: </line><line> manu salutem mittunt bene uolentibus; </line><line> eadem malam rem mittunt male uolentibus. </line><line> Sed ut occepisti, perge opera experirier </line><line> quid epistula ista narret. Ausculta modo. </line>  <line> " Harpax calator meus est, ad te qui uenit" </line><line> tun es is Harpax? Ego sum atque ipse GREEK_WORD quidem. </line>  <line> " Qui epistulam istam fert; ab eo argentum accipe; </line><line> cum eo simitu mulierem mitti uolo. </line><line> Salutem scriptam dignum est dignis mittere: </line><line> te si arbitrarem dignum, misissem tibi." </line><line> Quid nunc? Argentum des	779:786	0:1476
salus	NN	[-100,0]	1	38_34	 	, </line><line> tum, mea alumna, tui cum spes integra maneret, </line><line> nam vox ista meas nondum violaverat auris. </line><line> tene etiam fortuna mihi crudelis ademit, </line><line> tene, o sola meae vivendi causa senectae? </line><line> saepe tuo dulci nequiquam capta sopore, </line><line> cum premeret natura, mori me velle negavi, </line><line> ut tibi Corycio glomerarem flammea luto. </line><line> quo nunc me, infelix, aut quae me fata reservant? </line><line> an nescis, qua lege patris de vertice summo </line><line> edita candentis praetexat purpura canos, </line><line> quae tenui patriae spes sit suspensa capillo? </line><line> si nescis, aliquam possum sperare salutem, </line><line> inscia quandoquidem scelus es conata nefandum; </line><line> sin est quod metuo, per te, mea alumna, tuumque </line><line> expertum multis miserae mihi rebus amorem, </line><line> perdere seva precor per flumina elithie </line><line> ne tantum in facinus tam nulla mente feraris. </line><line> non ego te incepto, fieri quod non pote, conor </line><line> flectere amore, nec est cum dis contendere nostrum, </line><line> sed patris incolumi potius denubere regno </line><line> atque aliquos tamen esse velis tibi, alumna, penates; </line><line> hoc unum exilio docta atque experta monebo. </line><line> quod si non ulla poteris ratione parentem </line><line> flectere( sed poteris:	682:689	0:1387
salus	NN	[-300,0]	1	38_35	 	, </line><line> unde aurum ecficiam amanti erili filio. </line><line> Sed fori concrepuit nostra: quinam exit foras? </line><line> Ibo in Piraeum, uisam ecquaen aduenerit </line><line> in portum ex Epheso nauis mercatoria. </line><line> Nam meu formidat animus, nostrum tam diu </line><line> ibi desidere neque redire filium. </line><line> Extexam ego illum pulchre iam, si di uolunt. </line><line> Hau dormitandumst: opus est chryso Chrysalo. </line><line> Adibo hunc, quem quidem ego hodie faciam hic arietem </line><line> Phrixi, itaque tondebo auro usque ad uiuam cutem. </line><line> Seruos salutat Nicobulum Chrysalus. </line><line> Pro di inmortales, Chrysale, ubi mist filius? </line><line> Quin tu salutem primum reddis quam dedi? </line><line> Salue. Sed ubinamst Mnesilochus? Viuit, ualet. </line><line> Venitne? Venit. Euax, aspersisti aquam. </line><line> Benene usque ualuit? Pancratice atque athletice. </line><line> Quid hoc? qua caussa eum hinc in Ephesum miseram, </line><line> accepitne aurum ab hospite Archidemide? </line><line> Heu, cor meum et cerebrum, Nicobule, finditur, </line><line> istius hominis ubi fit quaque mentio. </line><line> Tun hospitem illum nominas hostem tuom? </line><line> Quid ita, opsecro hercle? Quia edepol certo scio, </line><line> Volcanus, Luna, Sol, Dies, di quattuor, </line><line> scelestiorem nullum inluxere alterum	707:714	0:1372
salus	NN	[-100,0]	1	38_36	 	, an rebus gestis atque virtutibus? Quid? a Numa Pompilio minusne gratas dis inmortalibus capudines ac fictiles urnulas fuisse quam felicatas Saliorum pateras arbitramur? Omitto reliquos; sunt enim omnes pares inter se praeter Superbum. Brutum si qui roget, quid egerit in patria liberanda, si quis item reliquos eiusdem consilii socios, quid spectaverint, quid secuti sint, num quis existat, cui voluptas, cui divitiae, cui denique praeter officium fortis et magni viri quicquam aliud propositum fuisse videatur? Quae res ad necem Porsennae C. Mucium inpulit sine ulla spe salutis suae? quae vis Coclitem contra omnes hostium copias tenuit in ponte solum? quae patrem Decium, quae filium devota vita inmisit in armatas hostium copias? quid continentia C. Fabrici, quid tenuitas victus M''. Curi sequebatur? quid? duo propugnacula belli Punici, Cn. et P. Scipiones, qui Carthaginiensium adventum corporibus suis intercludendum putaverunt, quid? Africanus maior,; quid? minor,; quid? inter horum aetates interiectus Cato, quid? innumerabiles alii( nam domesticis exemplis abundamus) cogitassene quicquam in vita sibi esse expetendum, nisi	574:581	0:1138
salus	NN	[-100,0]	1	38_37	 	, aut proditores esse aut desertores salutis meae, cum duo consules empti pactione provinciarum auctores se inimicis rei publicae tradidissent, cum egestatem, avaritiam, libidines suas viderent expleri non posse, nisi; me; constrictum domesticis hostibus dedidissent, cum senatus equites; que; Romani flere pro me ac mutata veste vobis supplicare edictis atque imperiis vetarentur, cum omnium provinciarum pactiones, cum omnia cum omnibus foedera; de; reconciliatione gratiarum sanguine meo sancirentur, cum omnes boni non recusarent, quin vel pro me vel mecum perirent, armis decertare pro mea salute nolui, quod et vincere et vinci luctuosum rei publicae fore putavi. </section><section> At inimici mei, mense Ianuario cum de me ageretur, corporibus civium trucidatis flumine sanguinis meum reditum intercludendum putaverunt. Itaque, dum ego absum, eam rem publicam habuistis, ut aeque me atque illam restituendam putaretis. ego autem, in qua civitate nihil valeret senatus, omnis esset impunitas, nulla iudicia, vis et ferrum in foro versaretur, cum privati parietum se praesidio, non legum tuerentur, tribuni plebis vobis inspectantibus vulnerarentur, ad magistratuum domos cum ferro et facibus	595:601	0:1199
salus	NN	[-100,0]	1	38_38	 	, aut proditores esse aut desertores salutis meae, cum duo consules empti pactione provinciarum auctores se inimicis rei publicae tradidissent, cum egestatem, avaritiam, libidines suas viderent expleri non posse, nisi; me; constrictum domesticis hostibus dedidissent, cum senatus equites; que; Romani flere pro me ac mutata veste vobis supplicare edictis atque imperiis vetarentur, cum omnium provinciarum pactiones, cum omnia cum omnibus foedera; de; reconciliatione gratiarum sanguine meo sancirentur, cum omnes boni non recusarent, quin vel pro me vel mecum perirent, armis decertare pro mea salute nolui, quod et vincere et vinci luctuosum rei publicae fore putavi. At inimici mei, mense Ianuario cum de me ageretur, corporibus civium trucidatis flumine sanguinis meum reditum intercludendum putaverunt. Itaque, dum ego absum, eam rem publicam habuistis, ut aeque me atque illam restituendam putaretis. ego autem, in qua civitate nihil valeret senatus, omnis esset impunitas, nulla iudicia, vis et ferrum in foro versaretur, cum privati parietum se praesidio, non legum tuerentur, tribuni plebis vobis inspectantibus vulnerarentur, ad magistratuum domos cum ferro et facibus	595:601	0:1179
salus	NN	[-100,0]	1	38_39	 	, caedes, ineendia, interitum rei publieae eomparari, et ea per cives, quae tum propter magnitudinem scelerum non nullis incredibilia videbantur, ea non modo cogitata a nefariis civibus, verum etiam suscepta esse sensistis. Illud vero nonne ita praesens est, ut nutu Iovis optimi maximi factum esse videatur, ut, cum hodierno die mane per forum meo iussu et coniurati et eorum indices in aedem Concordiae ducerentur, eo ipso tempore signum statueretur? Quo collocato atque ad vos sena tumque converso omnia[ et senatus et vos], quae erant contra salutem omnium cogitata, inlustrata et patefacta vidistis. Quo etiam maiore sunt isti odio supplicioque digni, qui non solum vestris domiciliis atque tectis sed etiam deorum templis atque delubris sunt funestos ac nefarios ignes inferre conati. Quibus ego si me restitisse dicam, nimium mihi sumam et non sim ferendus; ille, ille Iuppiter restitit; ille Capitolium, ille haec templa, ille cunctam urbem, ille vos omnis salvos esse voluit. Dis ego inmortalibus ducibus hanc mentem, Quirites, voluntatemque suscepi atque ad haec tanta indicia perveni. Iam vero[ illa Allobrogum	546:553	0:1122
salus	NN	[-100,0]	1	38_40	 	, carminibus templorum ac monumentorum aditus exornavit suorum. iam vero ille, qui cum Aetolis Ennio comite bellavit, Fulvius, non dubitavit Martis manubias Musis consecrare. Qua re in qua urbe imperatores prope armati poetarum nomen et Musarum delubra coluerunt, in ea non debent togati iudices a Musarum honore et a poetarum salute abhorrere. Atque ut id libentius faciatis, iam me vobis, iudices, indicabo, et de meo quodam amore gloriae, nimis acri fortasse verum tamen honesto vobis, confitebor. Nam quas res nos in consulatu nostro vobiscum simul pro salute huiusce imperi et pro vita civium prope universa re publica gessimus, attigit hic versibus atque inchoavit: quibus auditis, quod mihi magna res et iucunda visa est, hunc ad perficiendum adornavi. Nullam enim virtus aliam mercedem laborum periculorumque desiderat, praeter hanc laudis et gloriae: qua quidem detracta, iudices, quid est quod in hoc tam exiguo vitae curriculo[ et tam brevi] tantis nos in laboribus exerceamus? Certe si nihil animus praesentiret in posterum, et si quibus regionibus vitae spatium circumscriptum est, eisdem omnis cogitationes terminaret suas; nec	557:563	0:1142
salus	NN	[-100,0]	1	38_41	 	, certe licuit Tusculi se in otio delectare, salubri et propinquo loco. sed homo demens ut isti putant, cum cogeret eum necessitas nulla, in his undis et tempestatibus ad summam senectutem maluit iactari, quam in illa tranquillitate atque otio iucundissime vivere. omitto innumerabilis viros, quorum singuli saluti huic civitati fuerunt, et qui sunt; haut; procul ab aetatis huius; memoria, commemorare eos desino, ne quis se aut suorum aliquem praetermissum queratur. unum hoc definio, tantam esse necessitatem virtutis generi hominum a natura tantumque amorem ad communem salutem defendendam datum, ut ea vis omnia blandimenta voluptatis otique vicerit. Nec vero habere virtutem satis est quasi artem aliquam nisi utare; etsi ars quidem cum ea non utare scientia tamen ipsa teneri potest, virtus in usu sui tota posita est; usus autem eius est maximus civitatis gubernatio, et earum ipsarum rerum quas isti in angulis personant, reapse non oratione perfectio. nihil enim dicitur a philosophis, quod quidem recte honesteque dicatur, quod; non; ab iis partum confirmatumque sit, a quibus civitatibus iura discripta sunt. unde enim pietas	574:581	0:1138
salus	NN	[-100,0]	1	38_42	 	, clarissima auctoritas, egregia fortuna,- dubitatis Quirites, quin hoc tantum boni, quod vobis ab dis immortalibus oblatum et datum est, in rem publicam conservandam atque amplificandam conferatis? Quod si Romae Cn. Pompeius privatus esset hoc tempore, tamen ad tantum bellum is erat deligendus atque mittendus: nunc cum ad ceteras summas utilitates haec quoque opportunitas adiungatur, ut in eis ipsis locis adsit, ut habeat exercitum, ut ab eis qui habent accipere statim possit, quid exspectamus? aut cur non dicibus dis immortalibus eidem, cui cetera summa cum salute rei publicae commissa sunt, hoc quoque bellum regium committamus? At enim vir clarissimus, amantissimus rei publicae, vestris beneficiis amplissimis adfectus, Q. Catulus, itemque summis ornamentis honoris, fortunae, virtutis, ingeni praeditus, Q. Hortensius, ab hac ratione dissentiunt. Quorum ego auctoritatem apud vos multis locis plurimum valuisse et valere oportere confiteor; sed in hac causa, tametsi cognoscitis auctoritates contrarias virorum fortissimorum et clarissimorum, tamen omissis auctoritatibus ipsa re ac ratione exquirere possumus veritatem, atque hoc facilius, quod ea omnia quae a me adhuc dicta sunt	566:572	0:1195
salus	NN	[-100,0]	1	38_43	 	, compressi conatus tuos nefarios amicorum praesidio et copiis nullo tumultu publice concitato; denique, quotienscumque me petisti, per me tibi obstiti, quamquam videbam perniciem meam cum magna calamitate rei publicae esse coniunctam. Nunc iam aperte rem publicam universam petis, templa deorum inmortalium, tecta urbis, vitam omnium civium, Italiam[ denique] totam ad exitium et vastitatem vocas. Quare, quoniam id, quod est primum, et quod huius imperii disciplinaeque maiorum proprium est, facere nondum audeo, faciam id, quod est ad severitatem lenius et ad communem salutem utilius. Nam si te interfici iussero, residebit in re publica reliqua coniuratorum manus; sin tu, quod te iam dudum hortor, exieris, exhaurietur ex urbe tuorum comitum magna et perniciosa sentina rei publicae. Quid est, Catilina? num dubitas id me imperante facere, quod iam tua sponte faciebas? Exire ex urbe iubet consul hostem. Interrogas me, num in exilium; non iubeo, sed, si me consulis, suadeo. Quid est enim, Catilina, quod te iam in hac urbe delectare possit? in qua nemo	572:579	0:1061
salus	NN	[-100,0]	1	38_44	 	, concursu Italiae, referente clarissimo ac fortissimo viro, P. Lentulo, consentiente atque una voce revocavit. Me idem senatus exteris nationibus, me legatis magistratibusque nostris auctoritate sua consularibusque litteris non, ut tu Insuber dicere ausus es, orbatum patria sed, ut senatus illo ipso tempore appellavit, civem servatoremque rei publicae commendavit. Ad meam unius hominis salutem senatus auxilium omnium civium cuncta ex Italia qui rem publicam salvam esse vellent consulis voce et litteris implorandum putavit. Mei capitis conservandi causa Romam uno tempore quasi signo dato Italia tota convenit. De mea salute P. Lentuli, praestantissimi viri atque optimi consulis, Cn. Pompei, clarissimi atque invictissimi civis, ceterorumque principum civitatis celeberrimae et gratissimae contiones fuerunt. De me senatus ita decrevit Cn. Pompeio auctore et eius sententiae principe ut, si quis impedisset reditum meum, in hostium numero putaretur, eisque verbis ea de me senatus auctoritas declarata est ut nemini sit triumphus honorificentius quam mihi salus restitutioque perscripta. De me cum omnes magistratus promulgassent praeter unum praetorem, a quo non fuit postulandum, fratrem inimici mei, praeterque duos de lapide emptos tribunos, legem comitiis	624:630	0:1268
salus	NN	[-100,0]	1	38_45	 	, confirmandis, contrariis confutandis. Argumentationis artificiose tractandae ratio de secundo libro petetur. Sed si acciderit, ut in consultatione alteri ab tuta ratione, alteri ab honesta sententia sit, ut in deliberatione eorum qui a Poeno circumsessi deliberant, quid agant,; qui; tutam rationem sequi suadebit, his locis utetur: nullam rem utiliorem esse incolumitate; virtutibus uti neminem posse, qui suas rationes in tuto non conlocarit;; ne; deos quidem esse auxilio is, qui se inconsulto in periculum mittant; honestum nihil oportere existimari, quod non salutem pariat. Qui tutae rei praeponet rationem honestam, his locis utetur: virtutem nullo tempore relinquendam; vel dolorem, si is timeatur, vel mortem, si ea formidetur, dedecore et infamia leviorem esse; considerare, quae sit turpitudo consequtura: at non inmortalitatem neque aeternam incolumitatem consequi, nec esse exploratum illo vitato periculo nullum in aliud periculum venturum; virtutei vel ultra mortem proficisci esse praeclarum; fortitudini fortunam quoque esse adiumento solere; eum tute vivere, qui honeste vivat, non, qui in praesentia incolumis, et eum, qui turpiter	566:573	0:1153
salus	NN	[-100,0]	1	38_46	 	, coniurati ad ferrum et flammam vocabantur, cum ego te, Flacce, caelum noctemque contestans flens flentem obtestabar, cum tuae fidei optimae et spectatissimae salutem urbis et civium commendabam! Tu tum, Flacce, praetor communis exiti nuntios cepisti, tu inclusam in litteris rei publicae pestem deprehendisti, tu periculorum indicia, tu salutis auxilia ad me et ad senatum attulisti. Quae tibi tum gratiae sunt a me actae, quae ab senatu, quae a bonis omnibus! Quis tibi, quis C. Pomptino, fortissimo viro, quemquam bonum putaret umquam non salutem verum honorem ullum denegaturum? O Nonae illae Decembres quae me consule fuistis! quem ego diem vere natalem huius urbis aut certe salutarem appellare possum. O nox illa quam iste est dies consecutus, fausta huic urbi, miserum me, metuo ne funesta nobis! Qui tum animus L. Flacci- nihil dicam enim de me- qui amor in patriam, quae virtus, quae gravitas exstitit! Sed quid ea commemoro quae tum cum agebantur uno consensu omnium, una voce populi Romani, uno orbis terrae testimonio in caelum laudibus efferebantur, nunc vereor	543:550	0:1077
salus	NN	[-100,0]	1	38_47	 	, conloquia serendi cum hoste iniussuque praetorum miscendi eos agmini suo, comprehendi inicique catenas iusserunt Hippocrati. ad quam vocem tantus extemplo primum a Cretensibus clamor est ortus, deinde exceptus ab aliis, ut facile, si ultra tenderent, appareret eis timendum esse. solliciti incertique rerum suarum Megara, unde profecti erant, referri signa iubent nuntiosque de statu praesenti Syracusas mittunt. fraudem quoque Hippocrates addit inclinatis ad omnem suspicionem animis et Cretensium quibusdam ad itinera insidenda missis velut interceptas litteras quas ipse composuerat, recitat:'' praetores Syracusani consuli Marcello.'' secundum salutem, ut adsolet, scriptum erat recte eum atque ordine fecisse quod in Leontinis nulli pepercisset; sed omnium mercennariorum militum eandem esse causam nec unquam Syracusas quieturas donec quicquam externorum auxiliorum aut in urbe aut in exercitu suo esset. itaque daret operam, ut eos qui cum suis praetoribus castra ad Megara haberent in suam potestatem redigeret ac supplicio eorum liberaret tandem Syracusas. haec cum recitata essent, cum tanto clamore ad arma discursum est ut praetores inter tumultum pavidi abequitaverint Syracusas. et ne fuga quidem eorum seditio compressa est impetusque in Syracusanos milites fiebant nec	650:657	0:1287
salus	NN	[-100,0]	1	38_48	 	, crederem non omnia, caverem omnia, dico hoc quod initio dixi, nullius indicio, nullius nuntio, nullius suspicione, nullius litteris de P. Sulla rem ullam ad me esse delatam. </section><section> Quam ob rem vos, di patrii ac penates, qui huic urbi atque huic rei publicae praesidetis, qui hoc imperium, qui hanc libertatem, qui populum Romanum, qui haec tecta atque templa me consule vestro numine auxilioque servastis, testor integro me animo ac libero P. Sullae causam defendere, nullum a me sciente facinus occultari, nullum scelus susceptum contra salutem omnium defendi ac tegi. Nihil de hoc consul comperi, nihil suspicatus sum, nihil audivi. Itaque idem ego ille qui vehemens in alios, qui inexorabilis in ceteros esse visus sum, persolvi patriae quod debui; reliqua iam a me meae perpetuae consuetudini naturaeque debentur; tam sum misericors, iudices, quam vos, tam mitis quam qui lenissimus; in quo vehemens fui vobiscum nihil feci nisi coactus, rei publicae praecipitanti subveni, patriam demersam extuli; misericordia civium adducti tum fuimus tam vehementes quam necesse fuit. Salus esset amissa omnium una	553:560	0:1121
salus	NN	[-100,0]	1	38_49	 	, cum hic ipse P. Servilius, quo tu imperatore, Labiene, meruisti, cum hic Q. Catulus, admodum tum adulescens, cum hic C. Curio, cum denique omnes clarissimi viri cum consulibus essent: quid tandem C. Rabirium facere convenit? utrum inclusum atque abditum latere in occulto atque ignaviam suam tenebrarum ac parietum custodiis tegere, an in Capitolium pergere atque ibi se cum tuo patruo et ceteris ad mortem propter vitae turpitudinem confugientibus congregare, an cum Mario, Scauro, Catulo, Metello, Scaevola, cum bonis denique omnibus coire non modo salutis verum etiam periculi societatem? </section><section> Tu denique, Labiene, quid faceres tali in re ac tempore? Cum ignaviae ratio te in fugam atque in latebras impelleret, improbitas et furor L. Saturnini in Capitolium arcesseret, consules ad patriae salutem ac libertatem vocarent, quam tandem auctoritatem, quam vocem, cuius sectam sequi, cuius imperio parere potissimum velles?'' Patruus,'' inquit,'' meus cum Saturnino fuit.'' Quid? pater quicum? quid? propinqui vestri, equites Romani? quid? omnis praefectura, regio, vicinitas vestra? quid	553:560	0:1106
