lemma	pos	date	grouping	identifier	description	context	indexes_target_token	indexes_target_sentence
salus	NN	[400,700]	2	38_13	 	, </line><line> aut magis Argolico pange canora sopho. </line><line> barbara fraxineis pingatur rhuna tabellis, </line><line> quodque papyrus agit uirgula plana ualet. </line><line> pagina uel redeat perscripta dolatile charta: </line><line> quod relegi poterit, fructus amantis erit. </book></section></line><line><section><book> Quam bene conueniunt genitor quos sustulit unus, </line><line> si simul hos unum pectus utrosque tenet! </line><line> uisceribus hisdem genitos Flauum Euodiumque </line><line> prorsus amore uno uiscera nostra tegunt. </line><line> alter in alterius mihi uisu uisus habetur, </line><line> et fratris speciem fratris imago dedit. </line><line> unius ex facie facies mihi nota secundi: </line><line> sic speculo similem forma repressa refert. </line><line> ergo pari uoto paribus dans uota salutis </line><line> ambos inter ego tertius alter ero: </line><line> hoc cupiens, ut quos caris amplexibus idem </line><line> tres amor unus habet, nos quoque charta liget. </book></section></line><line><section><book> Fixus amore tuo uotis inhiantibus astans </line><line> quae tibi, care, salus, saepe requiro uiros: </line><line> quisque uiator adest properans Aquilonis ab axe, </line><line> quamuis festinum sollicitando moror; </line><line> seu priuata uirum seu publica cura citabit, </line><line> hinc, nisi perconter, nullus abibit iter. </line><line> quam uegetus membris? quae te loca, care, coercent? </line><line> ordine disposito cuncta requirit amor. </line><line> si grauis arma tenens Italas terit hospes harenas </line><line> aut quae	818:825	0:1573
salus	NN	[400,500]	2	38_14	 	, </line><line> Condensas iussos lateres praebebat ad urbes, </line><line> Ut durus labor, et saeuae inclementia mortis, </line><line> Omnes terribilis populi consumeret annos. </line><line> Sed non ista Deo patribus illata remoto, </line><line> Ipse docet, curamque sibi probat esse suorum, </line><line> Nam iubet electum Pharaoni edicere Mosen, </line><line> Ut sinat Aegypto Domini discedere plebem. </line><line> Ni faciat, multis plectenda superbia plagis, </line><line> Sentiet excitam quae regni uis habet iram. </line><line> Ille quidem quoties patitur caelestia tela, </line><line> Cedit, et obsequium simulat; sed clade remota, </line><line> Duratur parcente Deo, causas pereundi </line><line> Impius inde trahens, quo posset habere salutem </line><line> Donec ui uictus laxat fera iura tyrannus, </line><line> Ditia barbaricis et Moses agmina gazis, </line><line> Promouet, insigni sulco monstrante columna </line><line> Per deserta uiam: quae formam in tempus utrumque </line><line> Temperat, alterna ut tribuat uice commoda castris, </line><line> Luce tegens, et nocte regens, eadem ignis et umbra, </line><line> Discutiens flammis tenebras, et nube calores. </line><line> Quid loquar et trepidis patribus cum incumberet hostis, </line><line> Diuisum pelagus, solidoque rigore ligatas </line><line> Instar montis aquas, uacuo cessisse profundo; </line><line> Quaque gradum illaesa tulerant tot millia plebis, </line><line> Oppressum Aegypti populum coeuntibus undis? </line><line> Omnis enim auctori seruit	744:751	0:1521
salus	NN	[400,700]	2	38_15	 	, </line><line> cuius amor Christi fundit ubique fidem! </line><line> ecce pari uoto, Augusti, certatis utrimque: </line><line> ipsa tuum sexum subrigis, ille suum; </line><line> uir Constantinum, Helenam pia femina reddis: </line><line> sicut honor similis, sic amor ipse crucis. </line><line> illa inuenit opem, tu spargis ubique salutem, </line><line> implet et Occasum quod prius Ortus erat. </line><line> gloria summa tibi, rerum sator atque redemptor, </line><line> quod tenet augustum celsa Sophia gradum. </line><line> per te crux domini totum sibi uindicat orbem: </line><line> quo nescita fuit, hoc modo uisa tegit. </line><line> accessit genti maior fiducia Christi, </line><line> quando salutis opem spes oculata uidet, </line><line> sensibus et duplicata fides, cum munere uestro </line><line> plus animae credant quod cruce teste probant. </line><line> hoc Augusta colens, quod apostolus, instat aratro: </line><line> tu ligno, hic uerbo laetificatis agrum. </line><line> haec iam fama fauet qua se septentrio tendit, </line><line> Ortus et Occasus militat ore tibi. </line><line> illinc Romanus, hinc laudes barbarus ipse, </line><line> Germanus Batauus Uasco Britannus agit. </line><line> pars tua cum cruce sit florens, Augusta, per aeuum, </line><line> cui facis extremis crescere uota locis. </line><line> hanc prostrata solo supplex Radegundis adorat </line><line> et uestro imperio tempora longa rogat	699:706	0:1423
salus	NN	[500,600]	2	38_16	 	, </line><line> Cum celebrauit iter, cum tempora carnis habere </line><line> Se uoluit, de luce nouat purgatque figuram </line><line> Quam delicta dabant, moxque integra fulsit imago </line><line> Quae meruit sentire Deum: Pars iuncta cerebro </line><line> Maxima sunt oculi; creat hos in munere Christus, </line><line> Qui caput et splendor rerum est. Pars omnibus ima </line><line> Sunt in fine pedes; hos sanat in aggere cura </line><line> Vocis apostolicae, quoniam speciosa uocantur </line><line> Quae pacem cunctis portant uestigia terris. </line><line> Exortum est lumen tenebris per dona Magistri. </line><line> Hi statuunt gressus quibus est sors tradita uerbi, </line><line> Vt uigeat medicina sequens bonitate prioris </line><line> Paulatimque salus in totum transeat orbem. </subsection></line><line><subsection> Iam rabidas hominum Paulus superauerat iras; </line><line> Velificante fide subitas uomuere procellas </line><line> Iudaica de nube doli non primitus ulli </line><line> Posse lauacra dari quam circumcisio carnis </line><line> Accedat de Lege Dei. Gens dura, quid ultra </line><line> Ad lapides ferrumque uocas? Hoc umbra figurae, </line><line> Non species mansura fuit; simulata relinque, </line><line> Quae iam certa uides; Christi processit ab ore </line><line> Vita manens omnesque iubet de fonte renasci </line><line> Qui ueniunt. Cur membra secent partemque resoluant </line><line> Cum totum saluare queant? Ne quaere uetusto </line><line> More premi nouitatis opem deflexaque retro </line><line> Lumina constitui postquam uia rectior	755:760	0:1565
salus	NN	[500,600]	2	38_18	 	, </line><line> Et mutata uident nocturna crepuscula solem. </line><line> Custodum uallante manu inter uincula Petro </line><line> Corpore somnus erat; sed cum uigilaret in illo </line><line> Quae nescit dormire fides, hoc Cantica clamant: </line>  <line> " Dormio corde uigil." Laeti documenta figurae </line><line> Discite, qui liquido meruistis fonte renasci, </line><line> Et quae forma manet sacrato in corpore Petri </line><line> Cernite corde pio: Docet hanc uirtutis apertae </line><line> Angelus ipse uiam; tangens latus impulit in qua </line><line> Ecclesiae stat parte caput; qua nuntius ortam </line><line> Nouerat, inde leuat. Lateri subnexuit arcae </line><line> Ostia sancta Noe clausis animalibus; hinc est </line><line> Diluuio uastante salus. Producitur Eua </line><line> Dormitante uiro lateris generata propago, </line><line> Nomen habens uitae, si numquam culpa fuisset, </line><line> Sic mansura magis. Christus post, mysticus Adam, </line><line> Dignatus dare membra cruci atque in carne perempta </line><line> Morte premi qua uita redit, noua dona liquoris </line><line> Per lateris sacrauit iter. Nunc angelus illa </line><line> Petrum parte uocat, mens credat ut omnis in ipso </line><line> Ecclesiae constare decus teneatque superno </line><line> Assertore fidem, quo calciamenta monente </line><line> Hi meruere pedes, tetigit quos dextra Magistri, </line><line> Quae totum mundauit aquis. Gradientibus illis </line><line> Conclusae cessere fores; putat omnia somno </line><line> Ludificante geri,	754:759	0:1526
salus	NN	[300,500]	2	38_19	 	, </line><line> ex quo nulla tuo mihi littera uenit ab ore, </line><line> nulla tua uidi scripta notata manu, </line><line> ante salutifero felix quam charta libello </line><line> dona negata diu multiplicata daret. </line><line> trina etenim uario florebat epistola textu, </line><line> sed numerosa triplex pagina carmen erat. </line><line> dulcia multimodis quaedam sub amara querellis </line><line> anxia censurae miscuerat pietas. </line><line> sed mihi mite patris plus quam censoris acerbum </line><line> sedit et e blandis aspera penso animo. </line><line> ista suo regerenda loco tamen et grauiore </line><line> uindicis heroi sunt agitanda sono. </line><line> interea leuior paucis praecurret iambus </line><line> discreto referens mutua uerba pede. </line><line> nunc elegi saluere iubent dictaque salute, </line><line> ut fecere aliis orsa gradumque, silent. </line><line> Quid abdicatas in meam curam, pater, </line><line> redire Musas praecipis? </line><line> negant Camenis nec patent Apollini </line><line> dicata Christo pectora. </line><line> fuit ista quondam non ope, sed studio pari </line><line> tecum mihi concordia </line><line> ciere surdum Delphica Phoebum specu, </line><line> uocare Musas numina </line><line> fandique munus munere indultum dei </line><line> petere e nemoribus aut iugis. </line><line> nunc alia mentem uis agit, maior deus, </line><line> aliosque mores postulat, </line><line> sibi reposcens ab homine munus suum, </line><line> uiuamus ut uitae patri. </line><line> uacare uanis, otio aut negotio, </line><line> et fabulosis litteris </line><line> uetat, suis	809:815	0:1606
salus	NN	[400,700]	2	38_20	 	, </line><line> flamine seu rapidi rura grauante noti, </line><line> succedunt iterum uernalia tempora mundo </line><line> grataque post glaciem prouocat aura diem. </line><line> rursus odoriferis renouantur floribus arua, </line><line> frondibus arboreis et uiret omne nemus; </line><line> dulce saporatis curuantur robora pomis, </line><line> et redeunte sibi gramine ridet ager. </line><line> sic quoque iam, domini, post tristia damna dolentes </line><line> uos meliore animo laetificate, precor. </line><line> ecce dies placidi reuocant paschalia Christi, </line><line> orbs quoque totus item per noua uota fremit. </line><line> gaudia plus faueant per celsa palatia regum </line><line> et per uos famuli festa beata colant. </line><line> omnipotens nobis uestram addat in orbe salutem </line><line> atque diu patriam culmina uestra regant. </book></section></line><line><section><book> Flere monent populum crudelia funera regum, </line><line> cum caput orbis humo maesta sepulchra tegunt. </line><line> hoc igitur tumulo recubans Chlodobercthus habetur, </line><line> qui tria lustra gerens raptus ab orbe fuit, </line><line> de proauo ueniens Chlodouecho celsa propago, </line><line> Chlodacharique nepos Chilpericique genus; </line><line> quem de regina sumpsit Fredegunde iugali, </line><line> auserat et nascens Francica uota puer. </line><line> quo patris et patriae dum spes adolesceret ampla, </line><line> accelerante die sors inimica tulit. </line><line> sed cui nulla nocent queruli contagia mundi, </line><line> non fleat ullus amor, quem modo cingit honor. </line><line> nam puer innocuus	783:790	0:1608
salus	NN	[0,100]	2	38_21	 	, </line><line> lumina noctivagae tollit Pharus aemula lunae, </line><line> caraque non molli iuga Surrentina Lyaeo, </line><line> quae meus ante alios habitator Pollius auget, </line><line> Dinarumque lacus medicos Stabiasque renatas. </line><line> mille tibi nostrae referam telluris amores?, </line><line> sed satis hoc, coniunx, satis est dixisse: creavit </line><line> me tibi, me socium longos astrinxit in annos. </line><line> nonne haec amborum genetrix altrixque videri </line><line> digna? sed ingratus qui plura adnecto tuisque </line><line> moribus indubito: venies, carissima coniunx, </line><line> praeveniesque etiam. sine me tibi ductor aquarum </line><line> Thybris et armiferi sordebunt tecta Quirini. </section></line><section> LIBER QUARTUS STATIUS MARCELLO SUO SALUTEM Inveni librum, Marcelle carissime, quem pietati tuae dedicarem. reor equidem aliter quam invocato numine maximi imperatoris nullum opusculum meum coepisse; sed hic liber tres habet[...] se quam quod quarta ad honorem tuum pertinet. primo autem septimum decimum Germanici nostri consulatum adoravi; secundo gratias egi sacratissimis eius epulis honoratus; tertio viam Domitianam miratus sum qua gravissimam harenarum moram exemit: cuius beneficio tu quoque maturius epistolam meam accipies, quam tibi in hoc libro a Neapoli scribo. proximum est lyricum carmen ad Septimium Severum, iuvenem, uti scis,	782:789	0:1390
salus	NN	[500,600]	2	38_22	 	, </line><line> mente ferox rapuit bellum." pater optime," dixit, </line>  <line> " ingeminans bellum nostro reparare labore </line><line> uxores natosque potes: nam fundere uitam </line><line> et bellis finire placet. quae fama per omnes </line><line> gentis erit populos, si nostrae iniuria caedis </line><line> indefensa manens latum referatur in orbem? </line><line> absorptas melius subito telluris hiatu </line><line> mors rapiat gentes, extendant Tartara fauces </line><line> et nigrae pallore domus, Proserpina regnum </line><line> patris inops teneat nigri per bella mariti. </line><line> sunt acies, sunt arma tibi: surge, arripe bellum. </line><line> te duce confisus ponam sine crimine uitam. </line><line> haec est certa salus. tu nostrae gloria gentis, </line><line> tu uirtutis honor, tu spes fidissima Mauris." </line><line> uix ea Bruten ait, cuncti clamore sequuntur </line><line> Carcasanque fremunt, Carcasan omnibus unum </line><line> gentibus esse ducem linguis animisque fatentur. </line><line> ille ut conceptum populis auxisse furorem </line><line> uidit et insani rabiem succrescere Martis, </line><line> Marmaridum fines, habitat quo corniger Ammon, </line><line> inde petit, durique Iouis responsa poposcit. </line><line> semper amat miseras deceptor fallere mentes </line><line> Iuppiter hic quem, uane, rogas: in sanguine gaudet </line><line> horridus et cunctas quaerit disperdere gentes. </line><line> asper in aduersa percussus fronte bipenni </line><line> taurus ut occubuit,	734:739	0:1510
salus	NN	[300,500]	2	38_23	 	, </line><line> mentibus et quicumque hominum famulantia corda </line><line> iudicio regitis rerumque tenetis habenas, </line><line> deseruite deo trepidi mixtoque fideles </line><line> exultate metu; fiat discordia concors </line><line> dissimiles socians affectus pectore in uno, </line><line> ne timor affligat mentes uel gaudia soluant, </line><line> si careant laeto pauidi formidine leti. </line><line> dicite iustitiam rectosque capessite mores </line><line> et iusto trepidate deo, gaudete benigno, </line><line> ne quando meritum deus irascatur in orbem </line><line> uosque uia iusta iuste pereatis abacti. </line><line> amodo iam resilire uia properetis iniqua; </line><line> ecce breui cum magna potentis inarserit ira, </line><line> uentilet ut totum diuino examine mundum </line><line> segreget et paleas igni, frumenta saluti, </line><line> tunc omnes, quibus est in eo spes fida, beati. </book></section></line><line><section><book> Sedimus ignotos dirae Babylonis ad amnes </line><line> captiui, Iudaea manus, miserabile flentes, </line><line> cum patrium memori traheremus pectore Sion </line><line> et meritum iusta suspiraremus ab ira </line><line> exilium, lentis qua consita ripa salictis </line><line> hospitibus populis umbras praebebat amicas. </line><line> illic Assyriae mediis in moenibus urbis </line><line> obliti laetas per maesta silentia uoces </line><line> de salicum ramis suspendimus organa nostra. </line><line> namque dabat nobis durum grauis ira dolorem, </line><line> quod solita in sancto depromi cantica templo </line><line> haec ad delicias sibi nos cantare iubebat </line><line> impius ille domo qui nox abduxerat hostis	834:840	0:1665
salus	NN	[500,600]	2	38_24	 	, </line><line> mergitur alter aquis. placidam per membra quietem </line><line> accipit omne genus, dulcique impressa sopore </line><line> cetera per campos fessis animalia membris </line><line> somnus habebat iners, pecudes uariasque uolucres </line><line> horribilesque feras gelidosque in litore pisces, </line><line> cum uigil insomnem, flagrans iam Marte, Iohannes </line><line> ducebat noctem cautoque in pectore sollers </line><line> uoluebat magnas dispensans ordine curas. </line><line> quem iuxta sapiens Ricinarius horrida bella </line><line> pectore pensabat placido sensuque sagaci </line><line> percurrens uarias relegebat in ordine causas. </line><line> alternis animos releuabant uocibus ambo </line><line> mutuaque ex oculis arcebat fabula somnos. </line><line> o quotiens adiere pares dominumque potentem </line><line> pro rerum, populi, Libyae propriaque salute </line><line> cum lacrimis petiere diu! nec fundit inanes </line><line> tristis uterque preces. orantes uidit ab alta </line><line> sede pater, terrarum orbem qui fulmine terret, </line><line> et finem imposuit tanto per bella labori. </line><line> Marmaridum interea nocturnis dedita sacris </line><line> castra fremunt, statuuntque aras et inania poscunt </line><line> numina. producunt pecudes altaria circum </line><line> et fundunt miserum riuis per prata cruorem. </line><line> hi mactant Gurzil, alii tibi, corniger Ammon; </line><line> hi Sinifere colunt, quem Mazax numina Martis </line><line> accipit atque deum belli putat esse potentem, </line><line> Mastiman alii. Maurorum hoc nomine gentes </line><line> Taenarium dixere Iouem, cui sanguine multo </line>	874:880	0:1651
salus	NN	[400,700]	2	38_25	 	, </line><line> militiae sanctus cuncta emolumenta recusat. </line><line> hinc sibi Caesareas fremuit Iulianus in iras: </line><line> imperat ut clausum teneat custodia iustum </line><line> ac ueniente die primus properaret in agmen; </line><line> quo tamen ante aciem sacer ire fatetur inermis. </line><line> uenerat ergo dies belli: pacem expetit hostis </line><line> atque orante uno cecidit furor omnibus armis </line><line> innumerasque acies solus sine sanguine uicit. </line><line> Hinc loca latronum incedens, ratus ire per Alpes, </line><line> uinctis post tergum manibus deductus ab uno, </line><line> tempore sub mortis hostis compendia tractans, </line><line> credit latro deum dum praedicat iste colendum, </line><line> et dare qui uoluit mortem capit ore salutem. </line><line> ducitur ille ferox a religione ligatus </line><line> atque suus praedo Martini praeda fit ultro. </line><line> quam bonus ille isti, sed plus pius hic fuit illi. </line><line> seruantur simul, ille fide, hic corpore uiuens; </line><line> ambo ualent, dum nemo cadit: sic uicit uterque. </line><line> Hinc loca praeteriens pulcherrima Mediolani, </line><line> florea rura terens per amoena uirecta uiator, </line><line> obuius occurrit uetus et temerarius hostis, </line><line> mentitus speciem humanae sub imagine formae. </line><line> falsiloquax pereunte fide, male doctus in arte </line><line> quod peteretur iter quaerit: cui comminus ille </line><line> huc properare refert qua se deus ire uocaret	769:776	0:1495
salus	NN	[400,700]	2	38_26	 	, </line><line> nam sanguis latices hinc gelat unde ligat. </line><line> si qua calens animo recitanda poemata pangam, </line><line> scis ipse hoc studium quam grauet arte labor. </line><line> nam cruor ablatus magis otia lenta requirit, </line><line> quo neque frigus hiat nec uapor ustus arat: </line><line> secretumque petit, neu flabilis aura flagellet, </line><line> quo recreans animum stat uiror, halat odor. </line><line> ast ego posthabeo affectu mea seria uestro: </line><line> cura tui faciem, nam mea terga tenet. </line><line> post sudorem habui modo nam dare membra quieti: </line><line> ordine postposito tempora rumpit amor. </line><line> duco parum propriam, tibi dum uolo ferre salutem, </line><line> sed mea prospicio, cum tua uota colo. </line><line> nunc cape parua, cate et pollens duilance Dynami, </line><line> clare decore tuo, care fauore meo, </line><line> partibus Italiae aduecto mihi Rhenus et Hister </line><line> quem cecinere prius quam daret ipse locus, </line><line> insignem specie, celsum lare, lege sagacem, </line><line> omnibus aequalem spe sale pace fide. </line><line> incidit unde mihi, fateor, te sorte uidendi </line><line> Arctoi gelida sub regione calor, </line><line> plusque libens uultus efferueo totus in illos, </line><line> ad patriae reditus quam peregrina cohors, </line><line> uisibus atque tuis issem uelocius, ac si </line><line> ad patris amplexus	696:703	0:1407
salus	NN	[400,700]	2	38_27	 	, </line><line> nec ieiunus erit qui sua rura colit. </line><line> per mare nauta uolat quo multa pecunia crescat: </line><line> mercibus ut placeat per mare nauta uolat; </line><line> non timet ille necem rabie turbante procellae: </line><line> ut lucretur opes non timet ille necem. </line><line> miles ad arma uenit quaerens per uulnera, palmam: </line><line> ut redeat uictor, miles ad arma uenit. </line><line> proelia sume libens mihi tu quoque, care sodalis: </line><line> unde triumphus erit, proelia sume libens. </line><line> quisquis amore uenit nescit se ferre laborem: </line><line> nemo labore iacet quisquis amore uenit. </line><line> carmina parua ferens tibi debita reddo salutis: </line><line> des meliora, precor, carmina parua ferens. </book></section></line><line><section><book> Quamuis cuncta auido rapiantur ab orbe uolatu, </line><line> attamen extendit uita beata diem, </line><line> nec damnum de fine capit cui, gloria, uiuis, </line><line> aeternumque locum missus ad astra tenet. </line><line> hoc igitur tumulo requiescit Eumerius almo, </line><line> per quem pontificum surgit opimus honor. </line><line> stemmate deducit fulgens ab origine culmen, </line><line> et meritis priscos crescere fecit auos. </line><line> emicuit populis geminum memorabile donum: </line><line> inde gradu iudex, hinc pietate pater. </line><line> dulcis in eloquio, placidus moderamine sacro, </line><line> in cuius sensu perdidit ira locum, </line><line> alterius	689:696	0:1475
salus	NN	[300,500]	2	38_28	 	, </line><line> nisi Christus illum ceu manu prensum sua </line><line> rapuisset e mortis lacu. </line><line> sicut recussis fugit olim uestibus </line><line> Ioseph furentem feminam. </line><line> sic hic relictis omnibus nudus fuga </line><line> euasit infidam ratem. </line><line> et sicut olim iussa Ionan obuio </line><line> excepit ore belua </line><line> et hiulca late lubricum per guttura </line><line> transmisit in uentrem suum, </line><line> incolume corpus dente suspenso uorans </line><line> et quem uorabat non edens: </line><line> sic hunc ab alta naue in undas cernuum </line><line> suscepit occurrens scapha </line><line> tutoque uexit fida per noctem sinu, </line><line> donec referret portui. </line><line> sed mentione magni uatis edita, </line><line> in quo pii mysterii </line><line> imago mortem triduani funeris </line><line> reduci salute praetulit, </line><line> paucis reflexo carminis uestigio </line><line> recurrere ad Ionan libet. </line><line> commenta domini mira; mersus aequore </line><line> intactus undis fluctuat. </line><line> uiuit uoratus, quique glutiuit manet </line><line> uiuente ieiunus cibo, </line><line> et praeda cum sit, esca non est beluae </line><line> domoque uentris utitur. </line><line> o digna sancto claustra fugitiuo dei! </line><line> capitur mari, quo fugerat, </line><line> altumque uastae missus in uentrem ferae </line><line> uiuo tenetur carcere. </line><line> de naue iactus perit et undis nauigat, </line><line> exul soli, hospes sali; </line><line> spatiatur antro beluini corporis </line><line> captiuus et liber reus. </line><line> nam liber undis, intra mare et exter maris, </line>	858:864	0:1656
salus	NN	[400,500]	2	38_29	 	, </line><line> oblata ad trepidam peruenit epistula dextram, </line><line> quam pius antistes maesto mittebat amico. </line><line> ille ubi perlectae gauisus munere chartae </line><line> pressit in absentem congaudens oscula dextram, </line><line> conclusit celeri ueneranda uolumina motu </line><line> et stomacho raptim properans admouit anhelo. </line><line> o uere pretiosa fides! depulsa fugatur </line><line> febris et igniti remouetur flamma caloris. </line><line> arentes penetrat praesens benedictio uenas </line><line> et rigat exhaustas uerborum rore medullas, </line><line> restituens celerem domini pietate salutem: </line><line> ad cuius laudem recte referemus ouantes, </line><line> quae nunc miramur seruos potuisse fideles. </line><line> nec solam haec membris tribuit medicina medellam, </line><line> sed cordi adiecit ueram fides aucta salutem. </line><line> confestim nam nota deo sacra uirgo per illum </line><line> offertur domino, per quem ualet eruta morbo. </line><line> sic tribus indulta est simul huius gratia doni: </line><line> consecrat antistes, pater offert, uirgo sacratur. </line><line> Quin et Paulino similis medicina salutem </line><line> reddidit, insignis fidei quem gloria late </line><line> extulit obducta cuius tum nube latebat </line><line> uisus, et infusis caligo extenta tenebris </line><line> arcebat cunctam macularum tegmine lucem. </line><line> quam leuis et tenui tactu suspensa fugauit </line><line> spongia, uicino benedictae munere dextrae </line><line> uix admota oculo. didicit iam reddita lucem </line><line> ferre acies lumenque nouum mirata recepit. </line><line> atque utinam nostri tenebras	856:863	0:1655
