lemma	pos	date	grouping	identifier	description	context	indexes_target_token	indexes_target_sentence
salus	NN	[-100,0]	1	38_50	 	, cum vestrorum in nos beneficiorum memoria ac fama moriatur? qui illo ipso tempore, cum vi, ferro, metu, minis obsessi teneremini, non multo post discessum meum me universi revocavistis referente L. Ninnio, fortissimo atque optimo viro, quem habuit ille pestifer annus et maxime fidelem et minime timidum, si dimicare placuisset, defensorem salutis meae. postea quam vobis decernendi potestas facta non est per eum tribunum plebis, qui, cum per se rem publicam lacerare non posset, sub alieno scelere delituit, numquam de me siluistis, numquam meam salutem non ab iis consulibus, qui vendiderant, flagitavistis. Itaque vestro studio atque auctoritate perfectum est, ut ipse ille annus, quem ego mihi quam patriae malueram esse fatalem, octo tribunos haberet, qui et promulgarent de salute mea et ad vos saepe numero referrent. nam consules modesti legumque metuentes impediebantur lege, non ea, quae de me, sed ea, quae de ipsis lata erat, cum meus inimicus promulgavit, ut, si revixissent ii, qui haec paene delerunt, tum ego redirem; quo facto utrumque confessus est, et	550:557	0:1074
salus	NN	[-100,0]	1	38_51	 	, dignissimum esse Pompeium, sed ad unum tamen omnia deferri non oportere. Obsolevit iam ista oratio, re multo magis quam verbis refutata. Nam tu idem, Q. Hortensi, multa pro tua summa copia ac singulari facultate dicendi et in senatu contra virum fortem, A. Gabinium, graviter ornateque dixisti, cum is de uno imperatore contra praedones constituendo legem promulgasset, et ex hoc ipso loco permuta item contra eam legem verba fecisti. </section><section> Quid? tum( per deos immortalis!) si plus apud populum Romanum auctoritas tua quam ipsius populi Romani salus et vera causa valuisset, hodie hanc gloriam atque hoc orbis terrae imperium teneremus? An tibi tum imperium hoc esse videbatur, cum populi Romani legati quaestores praetoresque capiebantur? cum ex omnibus provinciis commeatu et privato et publico prohibebamur? cum ita clausa nobis erant maria omnia, ut neque privatam rem transmarinam neque publicam iam obire possemus? </section><section> Quae civitas antea umquam fuit,-- non dico Atheniensium, quae satis late quondam mare tenuisse dicitur; non Karthaginiensium, qui permultum classe ac maritimis rebus valuerunt; non Rhodiorum, quorum usque ad nostram memoriam	560:565	0:1182
salus	NN	[-100,0]	1	38_52	 	, duabus simul portis erumpitur; et ad clamorem erumpentium ingens strepitus e muris ortus ululantium mulierum cum crepitu undique aeris, et incondita multitudo turba inmixta servili variis vocibus personabat. Hic tam multiplex undique obiectus terror effecit, ne sustinere primam procellam eruptionis Romani possent. Itaque fugientes plures quam pugnantes interempti sunt; vix duo milia hominum cum ipso legato in castra perfugerunt. Quo longius iter in castra erat, eo pluris fessos consectandi hostibus copia fuit. Ne moratus quidem in castris Appius, ut suos dissipatos fuga colligeret, quae res palatis per agros saluti fuisset, ad Lychnidum protinus reliquias cladis reduxit. Haec et alia haud prospere in Macedonia gesta ex Sex. Digitio tribuno militum, qui sacrificii causa Romam venerat, sunt audita. Propter quae veriti patres, ne qua maior ignominia acciperetur, legatos in Macedoniam M. Fulvium Flaccum et M. Caninium Rebilum miserunt, qui conperta, quae agerentur, referrent; et ut A. Atilius consul comitia consulibus rogandis ita ediceret, uti mense Ianuario confici possent, et ut primo quoque tempore in urbem rediret. Interim M. Raecio praetori mandatum, ut edicto senatores omnes ex	618:624	0:1202
salus	NN	[-100,0]	1	38_53	 	, et quidem incolumis nondum tot luminibus extinctis, quod in hostem togatum decerni est solitum more maiorum. Et tu apud patres conscriptos contra me dicere ausus es, cum ab hoc ordine ego conservator essem, tu hostis rei publicae iudicatus? Commemoratio illius tui sceleris intermissa est, non memoria deleta. Dum genus hominum, dum populi Romani nomen extabit( quod quidem erit, si per te licebit, sempiternum), tua illa pestifera intercessio nominabitur. Quid cupide a senatu, quid temere fiebat, cum tu unus adulescens universum ordinem decernere de salute rei publicae prohibuisti, neque id semel, sed saepius, neque tu tecum de senatus auctoritate agi passus es? Quid autem agebatur, nisi ne deleri et everti rem publicam funditus velles? Cum te neque principes civitatis rogando neque maiores natu monendo neque frequens senatus agendo de vendita atque addicta sententia movere potuisset, tum illud multis rebus ante temptatis necessario tibi vulnus inflictum est, quod paucis ante te, quorum incolumis fuit nemo; tum contra te dedit arma hic ordo consulibus reliquisque imperiis et potestatibus; quae non effugisses, nisi te ad arma	555:561	0:1142
salus	NN	[-100,0]	1	38_54	 	, haec antea singula per illos habuerimus, nunc universa per vos reciperarimus. Itaque, patres conscripti, quod ne optandum quidem est homini, immortalitatem quandam per vos esse adepti videmur. quod enim tempus erit umquam, cum vestrorum in nos beneficiorum memoria ac fama moriatur? qui illo ipso tempore, cum vi, ferro, metu, minis obsessi teneremini, non multo post discessum meum me universi revocavistis referente L. Ninnio, fortissimo atque optimo viro, quem habuit ille pestifer annus et maxime fidelem et minime timidum, si dimicare placuisset, defensorem salutis meae. postea quam vobis decernendi potestas facta non est per eum tribunum plebis, qui, cum per se rem publicam lacerare non posset, sub alieno scelere delituit, numquam de me siluistis, numquam meam salutem non ab iis consulibus, qui vendiderant, flagitavistis. Itaque vestro studio atque auctoritate perfectum est, ut ipse ille annus, quem ego mihi quam patriae malueram esse fatalem, octo tribunos haberet, qui et promulgarent de salute mea et ad vos saepe numero referrent. nam consules modesti legumque metuentes impediebantur lege, non ea, quae	565:572	0:1124
salus	NN	[-100,0]	1	38_55	 	, ignoscitote; nam et illam meam cladem vos et omnes boni maximum esse rei publicae vulnus iudicastis, et P. Sestius est reus non suo, sed meo nomine: qui cum omnem vim sui tribunatus in mea salute consumpserit, necesse est meam causam praeteriti temporis cum huius praesenti defensione esse coniunctam. </section><section> XIV erat igitur in luctu senatus, squalebat civitas publico consilio veste mutata, nullum erat Italiae municipium, nulla colonia, nulla praefectura, nulla Romae societas vectigalium, nullum conlegium aut concilium aut omnino aliquod commune consilium quod tum non honorificentissime de mea salute decrevisset: cum subito edicunt duo consules ut ad suum vestitum senatores redirent. quis umquam consul senatum ipsius decretis parere prohibuit? quis tyrannus miseros lugere vetuit? Parumne est, Piso, ut omittam Gabinium, quod tantum homines fefellisti ut neglegeres auctoritatem senatus, optimi cuiusque consilia contemneres, rem publicam proderes, consulare nomen adfligeres? etiamne edicere audebas ne maererent homines meam, suam, rei publicae calamitatem, ne hunc suum dolorem veste significarent? Sive illa vestis mutatio ad luctum ipsorum sive ad deprecandum valebat, quis umquam tam crudelis fuit qui prohiberet	614:620	0:1242
salus	NN	[-100,0]	1	38_56	 	, in eius castra perfugere catervatim non intermittunt. Quorum ex numero electis hominibus inlustrioribus[ Gaetulos] et litteris ad suos cives datis cohortatus uti manu facta se suosque defenderent, ne suis inimicis adversariisque dicto audientes essent, mittit. </section><section> Dum haec ad Ruspinam fiunt, legati ex Acylla civitate libera et immunique, ad Caesarem veniunt seque paratos quaecumque imperasset, et libenti animo facturos pollicentur; tantum orare et petere ab eo uti sibi praesidium daret, quo tutius id et sine periculo facere possent; se et frumentum et quaecumque res eis suppeteret, communis salutis gratia subministraturos. Quibus rebus facile a Caesare impetratis praesidioque dato, C. Messium aedilicia functum potestate Acyllam iubet proficisci. Quibus rebus cognitis Considius Longus qui Hadrumeti cum duabus legionibus et equitibus DCC praeerat, celeriter ibi parte praesidii relicta cum VIII cohortibus ad Acyllam ire contendit. Messius celerius itinere confecto prior Acyllam cum cohortibus pervenit. Considius interim cum ad urbem cum copiis accessisset et animadvertisset praesidium Caesaris ibi esse, non ausus periculum suorum facere nulla re gesta pro multitudine hominum rursus se Hadrumetum recepit; deinde paucis post diebus equestribus copiis a Labieno adductis rursus	616:623	0:1310
salus	NN	[-100,0]	1	38_57	 	, in qua me non infitior mediocriter esse versatum, aut si huiusce rei ratio aliqua ab optimarum artium studiis ac disciplina profecta, a qua ego nullum confiteor aetatis meae tempus abhorruisse, earum rerum omnium vel in primis hic A. Licinius fructum a me repetere prope suo iure debet. Nam quoad longissime potest mens mea respicere spatium praeteriti temporis, et pueritiae memoriam recordari ultimam, inde usque repetens hunc video mihi principem et ad suscipiendam et ad ingrediendam rationem horum studiorum exstitisse. Quod si haec vox, huius hortatu praeceptisque conformata, non nullis aliquando saluti fuit, a quo id accepimus quo ceteris opitulari et alios servare possemus, huic profecto ipsi, quantum est situm in nobis, et opem et salutem ferre debemus. Ac ne quis a nobis hoc ita dici forte miretur, quod alia quaedam in hoc facultas sit ingeni, neque haec dicendi ratio aut disciplina, ne nos quidem huic uni studio penitus umquam dediti fuimus. Etenim omnes artes, quae ad humanitatem pertinent, habent quoddam commune vinculum, et quasi cognatione quadam inter se continentur. Sed ne cui vestrum mirum esse videatur me in	606:612	0:1141
salus	NN	[-100,0]	1	38_58	 	, in quo decem fuimus consulares; qui si omnes viverent, bellum omnino hoc non fuisset; auctoritati cessisset audacia. Sed quantum praesidii fuerit in ceteris, hinc intellegi potest, quod ego unus relictus ex multis contudi et fregi adiuvantibus vobis exultantis praedonis audaciam. Quodsi non Fortuna nobis modo eripuisset Ser. Sulpicium eiusque collegam ante,. Marcellum,( quos civis, quos viros!) si duos consules amicissimos patriae simul ex Italia eiectos, si L. Afranium, summum ducem, si P. Lentulum, civem cum in ceteris rebus, tum in salute mea singularem, si M. Bibulum, cuius est in rem publicam semper merito laudata constantia, si L. Domitium, praestantissimum civem, si Appium Claudium pari nobilitate et voluntate praeditum, si P. Scipionem, clarissimum virum maiorumque suorum simillimum, res publica tenere potuisset, certe iis consularibus non esset Pompeianus despiciendus senatus. Utrum igitur aequius, utrum melius rei publicae fuit Cn. Pompeium an sectorem Cn. Pompei vivere, Antonium? Qui vero praetorii! quorum princeps M. Cato idemque omnium gentium virtute princeps. Quid reliquos clarissimos viros commemorem? Nostis omnes. Magis	543:549	0:1157
salus	NN	[-100,0]	1	38_59	 	, in universo denique belli iure atque pacis; nisi forte ea quae nos libri docent in umbra atque otio, ea Cn. Pompeium neque cum requiesceret litterae, neque cum rem gereret regiones ipsae docere potuerunt. </section><section> b. Atque, ut ego sentio, iudices, causa dicta est. Temporum magis ego nunc vitiis quam genere iudici plura dicam; est enim haec saeculi quaedam macula atque labes, virtuti invidere, velle ipsum florem dignitatis infringere. Etenim si Pompeius abhinc annos quingentos fuisset, is vir a quo senatus adulescentulo atque equite Romano saepe communi saluti auxilium expetisset, cuius res gestae omnis gentis cum clarissima victoria terra marique peragrassent, cuius tres triumphi testes essent totum orbem terrarum nostro imperio teneri, quem populus Romanus; honoribus; insignibus singularibusque decorasset,-- si nunc apud nos id quod is fecisset contra foedus factum diceretur, quis audiret? Nemo profecto; mors enim cum exstinxisset invidiam, res eius gestae sempiterni nominis gloria niterentur. Cuius igitur audita virtus dubitationi locum non daret, huius; visa; atque perspecta obtrectatorum voce laedetur? </section><section> Omittam igitur Pompeium iam oratione mea reliqua, sed	572:578	0:1211
salus	NN	[2000,2100]	2	38_0	 	- Amoris qui; sic dilexit mundum, ut Filium suum unigenitum daret;(,). Hoc quidem, prout in Declaratione recenter in luce est positum, subici nequit cuidam speciei dialogicae pactionis, ac si esset pro nobis simplex opinio; est nobis autem gratia quae gaudio nos replet; est nuntius, quem nuntiare tenemur. Ecclesia igitur detrahi nequit ab actione missionali inter populos, et uti munus primarium missionis ad gentes permanet nuntius qui est in Christo,; Via et Veritate et Vita;( cfr,), in quo homines salutem inveniunt. Dialogus interreligiosus; nuntium simpliciter substituere nequit, ad nuntium tamen usque convertitur;. Missionale tamen munus non impedit nos quin dialogum suscipiamus. Novimus enim, coram gratiae mysterio dimensionibus et consectariis infinite ditato pro vita et historia hominis, Ecclesiam ipsam nullo tempore investigationes esse intermissuram, quoniam auxilio se committit Paracliti, Spiritus veritatis(,), cui competit eam deducere; in omnem veritatem;(,). Hoc principium fundamentum est non tantum inexhausti perscrutationis theologicae de christiana veritate, verum etiam de christiano colloquio cum philosophiis, culturis,	504:511	0:1154
salus	NN	[200,300]	2	38_2	 	- nihil enim a deo non bonum, quia divinum, quia rationale----, sensui vero malum videtur, erit status in tuto, sensus in vitio. Statu optima res pudicitia et veritas et iustitia, quae a multorum sensu displicent; numquid ideo status sensui addicitur? Ita et persecutio statu bona est, quia divina et rationalis dispositio, sensui eorum vero, quorum malo venit, displicet. Sed qui; vi; de[ s] t etiam illud malum rationale apud deum haberi, cum quis in persecutione evertitur de salute, sicut et bonum illud ratione contingere, cum quis ex persecutione proficit in salute---- nisi si inrationaliter quis aut perit apud dominum aut salvus est----, is non poterit persecutionem malum dicere, quae etiam in mali parte bonum est, dum ratione administratur. Ita si bonum persecutio quoquo modo, quia de statu constat, merito definimus, quod bonum est, vitari non oportere, quia delictum sit, quod bonum est, recusare, eo amplius, quod deo visum est, iam vero nec posse vitari	479:485	0:971
salus	NN	[1000,1200]	2	38_3	 	--------------------------- </section><section> Quid est quod fidelium mentes Dominus componens, et ea computans bona, quibus beatitudinem promereri possunt, modlo in singulis dicit eos beatos, in quibus sunt, tamquam unum quodque facere sufficiat beatum, sicut esse declanatur ex remuneratione eonum sunbiecta? Sic quippe dicitur: Beati pauperes spiritu, quoniam ipsorum est regnum caelorum. Et similiter in caeteris singulis remuneratio supponitur, ex qua unaquaeque gratia suufficere uidetur ad salutem. Quas etiam distingui petimus diligenter, quo melius appareat, utrum singulae sufficiant, si non in eodem homine simul occurrant. SOLUTIO Septem sunt bona tamquam septem beatitudinibus distincta, quibus ad supernae gaudia uitae meremur pertingere. Nam illa, quae quasi octaua supponitur, probatio magis est praecedentium beatitudinum, quam illis tanquam diuersa connumeranda, ubi uidelicet dicitur: Beati qui persecutionem patiuntur propter iustitiam, quoniam ipsorum est regnum caelorum. Nam quia fidelibus beatis persecutiones maxime constat immninere, ne quis eos proptem hoc crederet minus esse beatos, ideo praedictis beatitudinibus istud	498:505	0:1150
salus	NN	[1000,1200]	2	38_4	 	------------------------------------------------------------- </section><section> Quid est: Oratio eius fiat in peccatum? SOLUTIO Ita in reprobum sensum tradatur, ut magis eligat orare nociua, quam profutura, et obtinere precibus ea, quae ad peccatum magis per trahant, quam ad salutem perducant.--------------------------------------------------------------------------------------------------	278:285	0:395
salus	NN	[1000,1200]	2	38_5	 	---------------------------------------------------------------------- </section><section> SERMONES AD VIRGINES PARACLITENSES IN ANNUNTIATIONE BEATAE VIRGINIS MARIAE Exordium nostrae redemptionis, hodiernus est conceptus dominicae matris. Concepit Dominum femina, ut Creatorem pareret creature. Communis quidem salus haec est hominum, sed specialis gloria feminarum. Primus Adam de terra plasmatus, non de femina est natus: imo de eius costa femina est formata. Secundus Adam, ac prioris et omnium tam factor quam redemptor, nostri sexus formam de femina decreuit assumere, ut in utroque sexu consisteret gratia, sicut in utroque praecesserat culpa, et eaedem naturae, per quas uulnus est inflictum, curationis afferrent medicamentum, et unde illata est plaga, inde mirabiliter conficeretur cataplasma. Actor plagae diabolus, minister curationis angelus. De quo nunc dicitur:	311:316	0:876
salus	NN	[200,300]	2	38_6	 	--, sensui vero malum videtur, erit status in tuto, sensus in vitio. Statu optima res pudicitia et veritas et iustitia, quae a multorum sensu displicent; numquid ideo status sensui addicitur? Ita et persecutio statu bona est, quia divina et rationalis dispositio, sensui eorum vero, quorum malo venit, displicet. Sed qui; vi; de[ s] t etiam illud malum rationale apud deum haberi, cum quis in persecutione evertitur de salute, sicut et bonum illud ratione contingere, cum quis ex persecutione proficit in salute ---- nisi si inrationaliter quis aut perit apud dominum aut salvus est----, is non poterit persecutionem malum dicere, quae etiam in mali parte bonum est, dum ratione administratur. Ita si bonum persecutio quoquo modo, quia de statu constat, merito definimus, quod bonum est, vitari non oportere, quia delictum sit, quod bonum est, recusare, eo amplius, quod deo visum est, iam vero nec posse vitari, quia a deo evenit, cuius voluntas non vitari poterit.; Ad;	505:511	0:972
salus	NN	[1900,2000]	2	38_7	 	-, q., a.:; Si loquamur de poena satisfactoria, quae voluntarie assumitur, contingit quod linus portet poenam alterius, inquantum sunt quodammodo unum. . . Si autem loquamur de poena pro peccato inflicta, inquantum habet rationem poenae, sic solum unusquisque pro peccato suo punitur: quia actus peccati aliquid personale est. Si autem loquamur de poena quae habet rationem medicinae, sic contingit quod unus punitur pro peccato alterius. Dictum est enim quod detrimenta corporalium rerum, vel etiam ipsius corporis, sunt quaedam poenales medicinae ordinatae ad salutem animae. Unde nihil prohibet talibus poenis aliquem puniri pro peccato alterius, vel a Deo vel ab homine;.) Cf. Leo XIII, Epist. encycl.; Nihil est enim aliud sanctorum communio. . . nisi mutua auxilii, expiationis, precum, beneficiorum communicatio inter fideles vel caelesti patria potitos vel igni piaculari addictos vel adhuc in terris peregrinantes, in unam coalescentes civitatem, cuius caput Christus, cuius forma caritas;: p.; D.- S.) Cf.,-:; Sivut enim corpus unum est et	562:569	0:1050
salus	NN	[1900,2000]	2	38_8	 	-; Quaestio de recusatione expeditissime definienda est auditis partibus.; Actus positi a iudice, antequam recusatur, validi sunt; qui autem positi sunt post propositam recusationem, rescindi debent, si pars petit, intra decem dies ab admissa recusatione computandos; post admissam recusationem invalidi sunt. Can.-; In negotio, quod privatorum solummodo interest, iudex procedere potest dumtaxat ad instantiam partis; causa autem legitime introducta iudex procedere potest et debet, etiam ex officio, in causis poenalibus et aliis causis, quae ad bonum publicum Ecclesiae aut ad salutem animarum spectant.; Potest autem praeterea iudex partium neglegentiam in probationibus afferendis vel in exceptionibus opponendis supplere, quoties id necessarium censet ad vitandam graviter iniustam sententiam firmo can. Can.- Iudices et tribunalia curent, ut quam primum salva iustitia causae omnes terminentur ita, ut in primo gradu iudicii ultra annum ne protrahantur, in gradu appellationis vero non ultra sex menses. Can.- Omnes, qui tribunal constituunt aut eidem opem ferunt, promissionem de munere fideliter implendo facere debent. Can.-; In iudicio poenali semper, in iudicio	580:587	0:1174
salus	NN	[0,100]	2	38_9	 	: nullus erit in illis scriptis liber, qui non plurima varietatis humanae incertorumque casuum et lacrimarum ex alia atque alia causa fluentium exempla tibi suggerat. Lege, quanto spiritu ingentibus intonueris Vis: pudebit te subito deficere et ex tanta orationis magnitudine desciscere. Ne commiseris, ut quisquis exemplaris modo scripta tua mirabatur quaerat quomodo tam grandia tamque solida tam fragilis animus conceperit. </section><section> Potius ab istis te, quae torquent, ad haec tot et tanta, quae consolantur, converte ac respice pro omnium horum salute hac tecum portione Fortuna decidit. Multos habes, in quibus adquiescas. Ab hac te infamia vindica, ne videatur omnibus plus apud te valere unus dolor quam haec tam multa solacia. Omnis istos una tecum perculsos vides nec posse tibi subvenire, immo etiam ultro expectare, ut a te subleventur, intellegis; et ideo quanto minus in illis doctrinae minusque ingenii est, tanto magis obsistere te necesse est communi malo. Est autem hoc ipsum solacii loco, inter multos dolorem suum dividere; qui quia dispensatur inter plures, exigua debet apud te	559:565	0:1109
salus	NN	[2000,2100]	2	38_11	 	-) et tamquam officium profluens ex amore erga universos homines,; annuntiat et annuntiare tenetur indesinenter Christum, qui est; via et veritas et vita;( Io,), in quo homines plenitudinem vitae religiosae inveniunt, in quo Deus omnia Sibi reconciliavit;. Missio ad gentes, etiam per dialogum interreligiosum ad effectum adducenda,; vim suam et necessitatem hodie sicut et semper integram servat;. Re enim vera; Deus; omnes homines vult salvos fieri et ad agnitionem veritatis venire;( Tim,). Deus vult omnium salutem per veritatis agnitionem. Salus in veritate invenitur. Qui motioni Spiritus veritatis oboediunt, sunt iam in salutis via; sed Ecclesia, cui haec veritas concredita est, eorum optato debet occurrere ut eisdem eam afferat. Quia ipsa consilium salutis credit universale, missionaria esse debet;. Dialogus ergo, quamvis missionis evangelizatricis elementum efficiat, pars est solummodo officii ab Ecclesia adimplendi in missione eius ad gentes. Aequalitas, quae ad dialogum requiritur, non ad doctrinae argumentum ac materiam attinet, eoque minus ad Iesum Christum- qui est ipse Deus Homo factus	511:518	0:1111
salus	NN	[400,700]	2	38_12	 	, </line><line> apostolos, navis Christi proretas </line><line> et martyres, omnes peto athletas, </line><line> uti me per illos salus saepiat </line><line> atque omne malum a me pereat, </line><line> Christus mecum pactum firmum feriat, </line><line> timor, tremor taetras turbas terreat. </line><line> Deus, impenetrabili tutela </line><line> undique me defende potentia! </line><line> Mei gibrae pernas omnes libera </line><line> tuta pelta protegente singula, </line><line> ut non taetri daemones in latera </line><line> mea librent, ut solent, iacula: </line><line> gigram, cephalem cum iaris et conas, </line><line> patham liganam sennas atque michinas </line><line> cladum crassum madianum talias </line><line> bathma exugiam atque idumas. </line><line> Meo ergo cum capillis vertici </line><line> galea salutis esto capiti, </line><line> fronti oculis et cerebro triformi, </line><line> rostro labio faciei timpori </line><line> mento barbae superciliis auribus </line><line> genis buccis internaso naribus </line><line> pupillis rotis palpebris tautonibus </line><line> gingis anhelae maxillis et faucibus; </line><line> dentibus linguae ori uvae gutturi </line><line> gurgulioni et sublinguae cervici </line><line> capitali ceutro cartilagini </line><line> collo clemens adesto tutamini! </line><line> Deinde esto lorica tutissima </line><line> erga membra, erga mea viscera, </line><line> ut retrudas a me invisibiles </line><line> sudum clavos, quos figunt odibiles. </line><line> Tege ergo, Deus, forti lorica </line><line> cum scapulis umeros et bracchia, </line><line> tege ulnas cum cubis et manibus, </line><line> pugnas palmas digitos cum unguibus! </line><line> Tege spinam et	811:818	0:1696
