lemma	pos	date	grouping	identifier	description	context	indexes_target_token	indexes_target_sentence
senatus	NN	[100,200]	2	24_22	 	, aut sufficit? Et sane aequum est, tantum ceteris praestare consulibus ipsum, qui consules facit: quippe etiam Fortunae videbatur indignum, si posset honores dare, qui gerere non posset. Facturus consules doceat, accepturisque amplissimum honorem persuadeat, scire se, quid sit, quod daturus sit: sic fit, ut illi quoque sciant, quid acceperit. LXXVIII. Quo iustius senatus, ut susciperes quartum consulatum, et rogavit et iussit. Imperii hoc Vum, non adulationis esse, obsequio tuo crede: quod non alia in re magis aut senatus exigere a te, aut tu praestare senatui debes. Ut enim ceterorum hominum, ita principum, illorum etiam, qui dii sibi videntur, aevum omne ei breve et fragile est. Itaque optimum quemque niti et contendere decet, ut post se quoque reipublicae prosit, moderationis scilicet iustitiaeque monumentis, quae plurima statuere consul potest. Haec nempe intentio tua, ut libertatem revoces ac reducas. Quem ergo honorem magis amare, quod nomen usurpare saepius debes, quam quod primum invenit recuperata libertas? Non est minus civile, et principem esse pariter,	521:528	0:1082
senatus	NN	[300,400]	2	24_27	 	, Campaniam et Apuliam. L. Papirius Cursor cum honore dictatoris ad id bellum profectus est. Qui cum Romam rediret, Q. Fabio Maximo, magistro equitum, quem apud exercitum reliquit, praecepit, ne se absente pugnaret. Ille occasione reperta felicissime dimicavit et Samnitas delevit. Ob quam rem a dictatore capitis damnatus, quod se vetante pugnasset, ingenti favore militum et populi liberatus est tanta Papirio seditione commota, ut paene ipse interficeretur. Postea Samnites Romanos T. Veturio et Sp. Postumio consulibus ingenti dedecore vicerunt et sub iugum miserunt. Pax tamen a senatu et populo soluta est, quae cum ipsis propter necessitatem facta fuerat. Postea Samnites victi sunt a L. Papirio consule, septem milia eorum sub iugum missa. Papirius primus de Samnitibus triumphavit. Eo tempore Ap. Claudius censor aquam Claudiam induxit et viam Appiam stravit. Samnites reparato bello Q. Fabium Maximum vicerunt tribus milibus hominum occisis. Postea, cum pater ei Fabius Maximus legatus datus fuisset, et Samnitas vicit et plurima ipsorum oppida cepit. Deinde P. Cornelius Rufinus M. Curius Dentatus, ambo consules, contra Samnitas missi ingentibus proeliis eos confecere.	584:590	0:1182
senatus	NN	[0,100]	2	24_28	 	, candidatis Caesaris, proxime a nobilissimis ac sacerdotalibus viris destinari praetoribus contigit, consecutis quidem, ut neque post nos quemquam divus Augustus neque ante nos Caesar commendaret Tiberius. Tulit protinus et voti et consilii sui pretium res publica, neque diu latuit aut quid non impetrando passuri fuissemus aut quid impetrando profecissemus. Quippe exercitus, qui in Germania militabat praesentisque Germanici imperio regebatur, simulque legiones, quae in Illyrico erant, rabie quadam et profunda confudendi omnia cupiditate novum ducem, novum statum, novam quaerebant rem publicam; quin etiam ausi sunt minaridaturos se senatui, daturos principi leges; modum stipendii, finem militiae sibi ipsi constituere conati sunt. Processum etiam in arma ferrumque strictum est et paene in ultima gladiorum erupit impunitas, defuitque, qui contra rem publicam duceret, non qui sequerentur. Sed haec omnia veteris imperatoris maturitas, multa inhibentis, aliqua cum gravitate pollicentis, et inter severam praecipue noxiorum ultionem mitis aliorum castigatio brevi sopiit ac sustulit. Quo quidem tempore ut pleraque non ignave Germanicus, ita Drusus, qui a patre in id ipsum plurimo quidem igne emicans incendium militaris tumultus missus erat,	640:647	0:1253
senatus	NN	[0,300]	2	24_32	 	, celeri superum petit aethera curru optatum Latii tandem potura cruorem. diua deae parere parat magnumque Libyssae ductorem gentis nulli conspecta petebat. ille uirum coetu tum forte remotus ab omni incertos rerum euentus bellique uolutans anxia ducebat uigili suspiria uoce. cui dea sic dictis curas solatur amicis:" quid tantum ulterius, rex o fortissime gentis Sidoniae, ducis cura aegrescente dolorem? omnis iam placata tibi manet ira deorum omnis Agenoridis rediit fauor. eia, age, segnes rumpe moras, rape Marmaricas in proelia uires. mutati fasces. iam bellum atque arma senatus ex inconsulto posuit Tirynthius heros cumque alio tibi Flaminio sunt bella gerenda me tibi, ne dubites, summi matrona Tonantis misit. ego Oenotris aeternum numen in oris concelebror, uestri generata e sanguine Beli. haud mora sit; rapido belli rape fulmina cursu celsus Iapygios ubi se Garganus in agros explicat. haud longe tellus; huc dirige signa." dixit et in nubes umentia sustulit ora. Cui dux promissae reuirescens pignore laudis" nympha, decus generis, quo non sacratius ullum numen" ait" nobis, felix oblata secundes. ast ego	579:586	0:1122
senatus	NN	[100,200]	2	24_33	 	, cetera aulae; miles in forum, miles in curiam comitabatur. litteras ad exercitus tamquam adepto principatu misit, nusquam cunctabundus nisi cum in senatu loqueretur. causa praecipua ex formidine, ne Germanicus, in cuius manu tot legiones, immensa sociorum auxilia, mirus apud populum favor, habere imperium quam exspectare mallet. dabat et famae, ut vocatus electusque potius a re publica videretur quam per uxorium ambitum et senili adoptione inrepsisse. postea cognitum est ad introspiciendas etiam procerum voluntates inductam dubitationem: nam verba vultus in crimen detorquens recondebat. Nihil primo senatus die agi passus[ est] nisi de supremis Augusti, cuius testamentum inlatum per virgines Vestae Tiberium et Liviam heredes habuit. Livia in familiam Iuliam nomenque Augustum adumebatur; in spem secundam nepotes pronepotesque, tertio gradu primores civitatis scripserat, plerosque invisos sibi, sed iactantia gloriaque ad posteros. legata non ultra civilem modum, nisi quod opulo et plebi quadringentiens triciens quinquiens, praetoriarum cohortium militibus singula nummum milia,[ urbanis quingenos], legionariis aut cohortibus civium Romanorum trecenos nummos viritim dedit. tum conultatum de honoribus; ex quis[ qui]	608:615	0:1232
senatus	NN	[0,300]	2	24_34	 	, ciuisque superbi constitit ante pedes; uultu tamen alta minaci nobilitas recta ferrum ceruice poposcit. Scit Caesar poenamque peti ueniamque timeri:" Uiue, licet nolis, et nostro munere" dixit" cerne diem. uictis iam spes bona partibus esto exemplumque mei; uel, si libet, arma retempta, et nihil hac uenia, si uiceris ipse, paciscor." Fatur et astrictis laxari uincula palmis imperat. Heu quanto melius uel caede peracta parcere Romano potuit fortuna pudori! Poenarum extremum ciui, quod castra secutus sit patriae Magnumque ducem totumque senatum, ignosci. Premit ille grauis interritus iras et se cum:" Romamne petes pacisque recessus degener? In medios belli non ire furores iam dudum moriture paras? Rue certus et omnis lucis rumpe moras et Caesaris effuge munus." Nescius interea capti ducis arma parabat Magnus, ut immixto firmaret robore partis. Iamque secuturo iussurus classica Phoebo temptandasque ratus moturi militis iras alloquitur tacitas ueneranda uoce cohortes:" O scelerum ultores melioraque signa secuti, o uere Romana manus, quibus arma senatus non priuata dedit, uotis deposcite pugnam. Ardent Hesperii saeuis	543:550	0:1133
senatus	NN	[100,200]	2	24_37	 	, conixique sunt Rhodienses legationibus Romam saepe missis id bellum inter eos componere. Sed ubi ista pacificatio perpetrari nequivit, verba a plerisque Rhodiensibus in contionibus eorum ad populum facta sunt, ut, si pax non fieret, Rhodienses regem adversus populum Romanum adiutarent. Sed nullum super ea re publicum decretum factum est. At ubi Perses victus captusque est, Rhodienses pertimuere ob ea, quae conpluriens in coetibus populi acta dictaque erant, legatosque Romam miserunt, qui temeritatem quorundam popularium suorum deprecarentur et fidem consiliumque publicum expurgarent. Legati postquam Romam venerunt et in senatum intromissi sunt Visque suppliciter pro causa sua factis e curia excesserunt, sententiae rogari coeptae; cumque partim senatorum de Rhodiensibus quererentur maleque animatos eos fuisse dicerent bellumque illis faciendum censerent, tum M. Cato exsurgit et optimos fidissimosque socios, quorum opibus diripiendis possidendisque non pauci ex summatibus viris intenti infensique erant, defensum conservatumque pergit orationemque inclutam dicit, quae et seorsum fertur inscriptaque est pro Rhodiensibus et in quintae originis libro scripta est. Tiro autem Tullius, M. Ciceronis libertus, sane quidem fuit ingenio homo eleganti et haudquaquam rerum litterarumque veterum indoctus, eoque ab	630:637	0:1322
senatus	NN	[0,100]	2	24_39	 	, consul armis compescuit hominesque exitiabibis in Hostilia curia morte multavit. Deinde interiectis paucis annis tribunatum iniit M. Livius Drusus, vir nobilissimus, eloquentissimus, sanctissimus, meliore in omnia ingenio animoque quam fortuna usus. Qui cum senatui priscum restituere cuperet decus et iudicia ab equitibus ad eum transferre ordinem( quippe eam potestatem nacti equites Gracchanis legibus cum in multos clarissimos atque innocentissimos viros saevissent, tum P. Rutilium, virum non saeculi sui, sed omnis aevi optimum, interrogatum lege repetundarum maximo cum gemitu civitatis damnaverant), in iis ipsis, quae pro senatu moliebatur, senatum habuit adversarium non intellegentem, s; qua de plebis commodis ab eo agerentur, veluti inescandae inliciendaeque multitudinis causa fieri, ut minoribus perceptis maiora permitteret. Denique ea fortuna Drusi fuit, ut malefacta collegarum quam quaevis optime ab ipso cogitata senatus probaret magis, et honorem, qui ab eo deferebatur, sperneret, iniunas, quae ab illis intendebantur, aequo animo reciperet, et huius summae gloriae invideret, illorum modicam ferret. Tum conversus Drusi animus, quando bene incepta male cedebant, ad dandam civitatem Italiae. Quod cum moliens	633:639	0:1234
senatus	NN	[0,100]	2	24_40	 	, consulem religiosum, imperatorem strenuum, timoris modum, poenae genus, spei uiam uno mentis impetu rapiendo. Nunc ad senatus acta transgrediar. cum aduersus Hannibalem Claudium Neronem et Liuium Salinatorem consules mitteret eosque ut uirtutibus pares, ita inimicitiis acerrime inter se dissidentes uideret, summo studio in gratiam reduxit, ne propter priuatas dissensiones rem publicam parum utiliter administrarent, quia consulum imperio nisi concordia inest, maior aliena opera interpellandi quam sua edendi cupiditas nascitur. ubi uero etiam pertinax intercedit odium, alter alteri quam uterque contrariis castris certior hostis proficiscitur. eosdem senatus, cum ob nimis aspere actam censuram a Cn. Baebio tribuno pl. pro rostris agerentur rei, causae dictione decreto suo liberauit uacuum omnis iudicii metu eum honorem reddendo, qui exigere deberet rationem, non reddere. Par illa sapientia senatus. Ti. Gracchum tribunum pl. agrariam legem promulgare ausum morte multauit. idem ut secundum legem eius per triumuiros ager populo uiritim diuideretur egregie censuit, si quidem grauissimae seditionis eodem tempore et auctorem et causam sustulit. Quam deinde se prudenter in rege Masinissa gessit! nam cum promptissima et fidelissima eius opera aduersus Karthaginienses	658:665	0:1279
senatus	NN	[100,200]	2	24_41	 	, Crassum Pompeiumque in urbem prouinciae suae Lucam extractos conpulit, ut detrudendi Domitii causa consulatum alterum peterent, perfecitque[ per] utrumque, ut in quinquennium sibi imperium prorogaretur. qua fiducia ad legiones, quas a re publica acceperat, alias priuato sumptu addidit, unam etiam ex Transalpinis conscriptam, uocabulo quoque Gallico Alauda enim appellabatur, quam disciplina cultuque Romano institutam et ornatam postea uniuersam ciuitate donauit. nec deinde ulla belli occasione,[ ne] iniusti quidem ac periculosi abstinuit, tam foederatis quam infestis ac feris gentibus ultro lacessitis, adeo ut senatus quondam legatos ad explorandum statum Galliarum mittendos decreuerit ac nonnulli dedendum eum hostibus censuerint. sed prospere[ de] cedentibus rebus et saepius et plurium quam quisquam umquam dierum supplicationes impetrauit. Gessit autem nouem annis, quibus in imperio fuit, haec fere. Omnem Galliam, quae saltu Pyrenaeo Alpibusque et monte Cebenna, fluminibus Rheno ac Rhodano continetur patetque circuitu ad bis et tricies centum milia passuum, praeter socias ac bene meritas ciuitates in prouinciae formam redegit, eique[ CCCC] in singulos annos stipendii nomine inposuit. Germanos, qui trans Rhenum incolunt	619:626	0:1241
senatus	NN	[0,100]	2	24_43	 	, cum alter consul iusto esset ferocior, Lentulus vero salva re publica salvus esse non posset, M. autem Cato moriendum ante, quam ullam condicionem civis accipiendam rei publicae contenderet. Vir antiquus et gravis Pompei partes laudaret magis, prudens sequeretur Caesaris, et illa gloriosiora, haec terribiliora duceret. Ut deinde spretis omnibus quae Caesar postulaverat, tantummodo contentus cum una legione titulum retinere provinciae, privatus in urbem veniret et se in petitione consulatus suffragiis populi Rornani committeret decrevere, ratus bellandum Caesar cum exercitu Rubiconem transiit. Cn. Pompeius consulesque et maior pars senatus relicta urbe ac deinde Italia transmisere Dyrrachium. At Caesar Domitio legionibusque, Corfini quae una cum eo fuerant, potitus, duce aliisque, qui voluerant abire ad Pompeium, sine dilatione dimissis, persecutus Brundusium, ita ut appareret male integris rebus et conditionibus finire bellum quam opprimere fugientis, cum transgressos reperisset consules, in urbem revertit redditaque ratione consiliorum suorum in senatu et in contione ac miserrimae necessitudinis, cum alienis armis ad arma compulsus esset, Hispanias petere decrevit. Festinationem itineris eius aliquamdiu morata Massilia est, fide melior quam consilio prudentior, intempestive	641:648	0:1298
senatus	NN	[0,100]	2	24_44	 	, cum Antonii librarius, cum obscenissimarum rerum et auctor et minister, cum in omnia et omnibus venalis, cum caeruleatus et nudus caputque redimitus arundine et caudam trahens, genihus innixus Glaucum saltasset in convivio, refrigeratus ab Antonio ob manifestarum rapinarum indicia transfugit ad Caesarem. Et idem postea clementiam victoris pro sua virtute interpretabatur, dictitans id probatum a Caesare, cui ille ignoverat; mox autem hunc avunculum Titius imitatus est. Haud absurde Coponius, vir e praetoriis gravissimus, P. Silii socer, cum recens transfuga multa ac nefanda Plancus absenti Antonio in senatu obiceret,; multa,;, inquit,; mehercules fecit Antonius pridie quam tu illum relinqueres;. Caesare deinde et Messala Corvino consulibus debellatum apud Actium, ubi longe ante quam dimicaretur exploratissima Iulianarum partium fuit victoria. Vigebat in hac parte miles atque imperator, in illa marcebant omnia; hinc remiges firmissimi, illinc inopia adfectissimi; navium haec magnitudo modica nec celeritati adversa, illa specie terribilior; hinc ad Antonium nemo, illinc ad Caesarem cotidie aliquis transfugiebat; rex Amyntas meliora et utiliora secutus; nam Dellius exempli sui tenax ut a	609:615	0:1205
senatus	NN	[500,600]	2	24_52	 	, cum pater vester a callistrato mutuam sumpsisset pecuniam, velut hanc eius uxor accepisset, instrumentum conscriptum est, nec ad exceptionis tractatum ex senatus consulto veniente pervenire necesse est, cum eam veritatis substantia, constituta potior quam simulata gesta, tueatur. diocl. et maxim. aa. et cc. alexandro.; a iii id. mart. cc. conss.; CJ.: Imperatores Diocletianus, Maximianus Feminis alienas novas vel veteres obligationes aliqua ratione suscipientibus subvenitur, nisi creditor aliqua ratione per mulierem deceptus sit: nam tunc replicatione doli senatus consulti exceptionem removeri constitutum est. diocl. et maxim. aa. et cc. zotico.; a s. vi id. nov. antiochiae cc. conss.; CJ.: Imperatores Diocletianus, Maximianus Cum ad eas etiam obligationes, quae ex mulieris persona calliditate creditoris sumpserunt primordium, decretum patrum, quod de intercessione feminarum factum est, pertinere edicto perpetuo declaratur, si tamen creditor, qui contrahere cum alio proposuerat, mulieris personam elegit, exceptione contra petitores secundum ea quae adseveras defendi potes. diocl. et maxim. aa	565:572	0:1112
senatus	NN	[100,200]	2	24_53	 	, cum propinquis comitiis aut sorte provinciarum plerique orbi fictis adoptionibus adsciscerent filios, praeturasque et provincias inter patres sortiti statim emitterent manu, quos adoptaverant.[ igitur qui filios genuerant] magna cum invidia senatum adeunt, ius naturae, labores educandi adversus fraudem et artes et brevitatem adoptionis enumerant. satis pretii esse orbis, quod multa securitate, nullis oneribus gratiam honores, cuncta prompta et obvia haberent. sibi promissa legum diu exspectata in ludibrium verti, quando quis sine sollicitudine parens, sine luctu orbus longa patrum vota repente adaequaret. factum ex eo senatus consultum, ne simulata adoptio in ulla parte muneris publici iuvaret ac ne usurpandis quidem hereditatibus prodesset. Exim Claudius Timarchus Cretensis reus agitur, ceteris criminibus, ut solent praevalidi provincialium et opibus nimiis ad iniurias minorum elati: una vox eius usque ad contumeliam senatus penetraverat, quod dictitasset in sua potestate situm, an proconsulibus, qui Cretam obtinuissent, grates agerentur. quam occasionem Paetus Thrasea ad bonum publicum vertens, postquam de reo censuerat provincia Creta depellendum, haec addidit:; usu probatum est, patres conscripti, leges egregias, exempla honesta apud	628:635	0:1260
senatus	NN	[0,100]	2	24_54	 	, cum[ p] er totum i[ mperium po] puli Roma[ ni terra marique es] set parta victoriis pax, cum pr[ ius quam] nascerer, a co[ ndita] u[ rb] e bis omnino clausum[ f] uisse prodatur m[ emori] ae, ter me princi] pe senat] us claudendum esse censui[ t].[ Fil] ios meos, quos iuv[ enes] mihi eripuit for[ tuna], Gaium et Lucium Caesares, TABULA III honoris mei caussa senatus populusque Romanus annum quintum et decimum agentis consules designavit, ut[ e] um magistratum inirent post quinquennium. Et ex eo die, quo deducti[ s] unt in forum ut interessent consiliis publicis decrevit sena[ t] us. Equites[ a] utem Romani universi principem iuventutis utrumque eorum parm[ is] et hastis argenteis donatum appellaverunt. Plebei Romanae viritum HS trecenos numeravi ex testamento patris mei. et nomine meo HS quadringenos ex bellorum manibiis consul quintum dedi, iterum autem in consulatu decimo ex[ p] atrimonio meo HS	362:369	0:912
senatus	NN	[1500,1600]	2	24_55	 	, cur non mea Laena resurgit, ut modo fecisti poltronam surgere Bertam? Omnia buttavi pro te comprare, quid ergo, quid codesella facis? sic me, cortelle, gababis?; Sed nec de venis, nec polsis mortua battit. Tunc villanorum diverso murmure stolus contrahitur, faciturque frequens cantone senatus. Consul erat Gobbus, quo non astutior alter, frater zuratus semper fuit ipse Tognazzo; fecissetque nihil maium sine mente Tognazzi. Ipse cipadanos pro rostris congregat omnes, et positis scannis sederunt ante Tognazzum. Tota Cipada ruit, magno clamante senatu. Mox nutu Gobbi boccas tenuere seratas. Tognazzus grandem ramparat supra tinazzum, atque comenzavit sic sic aperire ganassas: Tunc Zanardonus surexit de sedimento, et sub centura palmam ficcavit utramque. Postquam rascavit sapiens bis terque catarrum, sic ait:; O cancar, quantum bene barba Tognazzus parlavit, parens alter Ciceronus et ille grandus Aristotel, cecinit qui carmine docto scribere clericulis, Troiae qui primus ab oris. Sed penso quod non Cingar trapolabitur unquam. Vos causam scitis, senza quod dicere voiam, imo caleffabit tandem nos, imo soiabit.	549:555	0:1122
senatus	NN	[100,200]	2	24_56	 	, de ambitu, de maritandis ordinibus. Hanc cum aliquanto severius quam ceteras emendasset, prae tumultu recusantium perferre non potuit nisi adempta demum lenitave parte poenarum et vacatione trienni data auctisque praemiis. Sic quoque abolitionem eius publico spectaculo pertinaciter postulante equite, accitos Germanici liberos receptosque partim ad se partim in patris gremium ostentavit, manu vultuque significans ne gravarentur imitari iuvenis exemplum. Cumque etiam inmaturitate sponsarum et matrimoniorum crebra mutatione vim legis eludi sentiret, tempus sponsas habendi coartavit, divortiis modum imposuit. Auctor et aliarum rerum fuit, in quis: ne acta senatus publicarentur, ne magistratus deposito honore statim in provincias mitterentur, ut proconsulibus ad mulos et tabernacula, quae publice locari solebant, certa pecunia constitueretur, ut cura aerari a quaestoribus urbanis ad praetorios praetoresve transiret, ut centumviralem hastam quam quaesturam Tluncti consuerant cogere decemviri cogerent. Quoque plures partem administrandae rei p. caperent, nova officia excogitavit: curam operum publicorum, viarum, aquarum, alvei Tiberis, frumenti populo dividundi, praefecturam urbis, triumviratum legendi senatus et alterum recognoscendi turmas equitum, quotiensque opus esset. Censores creari desitos longo intervallo creavit.	662:669	0:1340
senatus	NN	[500,600]	2	24_57	 	, decuriis atque collegiis distributus, summaque regis sollertia ita est ordinata res publica, ut omnia patrimonii dignitatis aetatis artium officiorumque discrimina in tabulas referrentur ac sic maxima civitas minimae domus diligentia conteneretur. Postremus fuit omnium regum Tarquinius, cui cognomen Superbo ex moribus datum. Hic regnum avitum, quod a Servio tenebatur, rapere maluit quam expectare, missisque in eum percussoribus scelere partam potestatem non melius egit quam adquisiverat. Nec abhorrebat moribus uxor Tullia, que, ut virum regem salutaret, supra cruentum patrem vecta carpento consternatos equos exegit. Sed ipse in senatum caedibus, in plebem Veribus, in omnes superbia, que crudelitate gravior est bonis, grassatus cum sevitiam domi fatigasset, tandem in ostes conversus est. Sic valida Latio oppida capta sunt, Ardea, Ocricolum, Gavii, Suessa Pometia. Tum coque cruentus in suos. Neque enim filium Verare dubitavit, ut simulantis transfugam apud hostes hinc fides esset. Quo a Gaviis ut voluerat recepto et per nuntios consulenti quid fieri vellet, eminentia forte papaverum capita virgula excutiens, cum per hoc interficiendos esse principes vellet intellegi, qua superbia sic respondit,	638:645	0:1214
senatus	NN	[0,100]	2	24_58	 	, deuictaeque gentis suae interitus animum comminuit, etiam dis inmortalibus indignum ratis ab uno eius nationis interfici Marium, quam totam deleuerat. Minturnenses autem maiestate illius capti conprehensum iam et constrictum dira fati necessitate incolumem praestiterunt. nec fuit eis timori asperrima Sullae uictoria, cum praesertim ipse Marius eos a conseruando Mario absterrere posset. M. quoque Porcium Catonem admiratio fortis ac sincerae uitae adeo uenerabilem senatui fecit, ut, cum inuito C. Caesare consule aduersus publicanos dicendo in curia diem traheret; et; ob id iussu eius a lictore in carcerem duceretur, uniuersus senatus illum sequi non dubitaret. quae res diuini animi perseuerantiam flexit. Eodem ludos Florales, quos Messius aedilis faciebat, spectante populus ut mimae nudarentur postulare erubuit. quod cum ex Fauonio amicissimo sibi una sedente cognosset, discessit e theatro, ne praesentia sua spectaculi consuetudinem impediret. quem abeuntem ingenti plausu populus prosecutus priscum morem iocorum in scaenam reuocauit, confessus plus se maiestatis uni illi tribuere quam sibi uniuerso uindicare. quibus opibus, quibus imperiis, quibus triumphis hoc datum est? exiguum uiri patrimonium, astricti continentia mores, modicae clientelae, domus ambitioni	634:641	0:1281
senatus	NN	[1500,1600]	2	24_59	 	, dicitur. Haec nitida cute, probeque saginato corpore nomen habet. Videtis et Deos, puellis admixtos, quorum alterum uocant, alterum. Inquam, famulitii fidelibus auxiliis genus omne rerum meae subiicio ditioni, ipsis etiam imperans imperatoribus. Genus, educationem, et comites audistis. Nunc, ne cui sine causa uidear mihi Deae nomen usurpare, quantis commoditatibus Deos simul et homines adficiam, quamque late meum pateat numen arrectis auribus accipite. Etenim si non inscite scripsit quidam, hoc demum esse Deum, iuuare mortales, et si merito in Deorum senatum adsciti sunt, qui uinum, aut frumentum aut unam aliquam huiusmodi commoditatem mortalibus ostenderunt, cur non ego iure, Deorum omnium dicar, habearque, quae una omnibus largior omnia? Principio quid esse potest uita ipsa uel dulcius, uel pretiosius? At huius exordium cui tandem acceptum ferri conuenit, nisi mihi? Neque enim aut hasta Palladis, aut Iouis aegis hominum genus uel progignit, uel propagat. Verum ipse Deum pater atque hominum Rex, qui totum nutu tremefactat Olympum, fulmen illud trisulcum ponat oportet, et uultum illum Titanicum, quo	559:566	0:1119
