lemma	pos	date	grouping	identifier	description	context	indexes_target_token	indexes_target_sentence
senatus	NN	[-100,0]	1	24_0	 	- quid enim facere poteramus?- paulisper stetimus in illo ganearum tuarum nidore atque fumo; unde tu nos cum improbissime respondendo, tum turpissime ructando eiecisti. Idem illo fere biduo productus in contionem ab eo cui sicam quandam praebebas consulatum tuum, cum esses interrogatus quid sentires de consulatu meo, gravis auctor, Calatinus credo aliquis aut Africanus aut Maximus et non Caesoninus Semiplacentinus Calventius, respondes altero ad frontem sublato, altero ad mentum depresso supercilio crudelitatem tibi non placere. Hic te ille homo dignissimus tuis laudibus conlaudavit. Crudelitatis tu, furcifer, senatum consul in contione condemnas? non enim me qui senatui parvi; nam relatio illa salutaris et diligens fuerat consulis, animadversio quidem et iudicium senatus. Quae cum reprehendis, ostendis qualis tu, si ita forte accidisset, fueris illo tempore consul futurus. Stipendio me hercule et frumento Catilinam esse putasses iuvandum. Quid enim interfuit inter Catilinam et eum cui tu senatus auctoritatem, salutem civitatis, totam rem publicam provinciae praemio vendidisti? Quae enim L. Catilinam conantem consul prohibui, ea P. Clodium facientem consules adiuverunt. Voluit ille senatum interficere, vos sustulistis	618:625	0:1238
senatus	NN	[-100,0]	1	24_1	 	- sensim exprobrat- et invidisse Decium concordibus collegis tribus. Postremo se tendere nihil ultra quam ut, si dignum provincia ducerent, in eam mitterent; in senatus arbitrio se fuisse et in potestate populi futurum. P. Decius senatus iniuriam querebatur: quoad potuerint, patres adnisos ne plebeiis aditus ad magnos honores esset; postquam ipsa virtus pervicerit ne in ullo genere hominum inhonorata esset, quaeri quemadmodum inrita sint non suffragia modo populi sed arbitria etiam fortunae et in paucorum potestatem vertantur. Omnes ante se consules sortitos provincias esse: nunc extra sortem Fabio senatum provinciam dare,- si honoris eius causa, ita eum de se deque re publica meritum esse ut faveat Q. Fabi gloriae quae modo non sua contumelia splendeat. Cui autem dubium esse, ubi unum bellum sit asperum ac difficile, cum id alteri extra sortem mandetur, quin alter consul pro supervacaneo atque inutili habeatur? gloriari Fabium rebus in Etruria gestis; velle et P. Decium gloriari; et forsitan, quem ille obrutum ignem reliquerit, ita ut totiens novum ex improviso incendium daret, eum se exstincturum. Postremo se collegae honores praemiaque concessurum	606:613	0:1169
senatus	NN	[-100,0]	1	24_2	 	- te, Cn. Lentule, cuius abavi manibus esset accepta,- spectatorem esse voluit. Quod ni tu Megalesia illo die spectare voluisses, haud scio an vivere nobis atque his de rebus iam queri; non; liceret. Vis enim innumerabilis incitata ex omnibus vicis conlecta servorum ab hoc aedile religioso repente; e; fornicibus ostiisque omnibus in scaenam signo dato inmissa inrupit. Tua tum, tua, Cn. Lentule, eadem virtus fuit quae in privato quondam tuo proavo; te, nomen, imperium, vocem, aspectum, impetum tuum stans senatus equitesque Romani et omnes boni sequebantur, cum ille servorum eludentium multitudini senatum populumque Romanum vinctum ipso consessu et constrictum spectaculis atque impeditum turba et angustiis tradidisset. An si ludius constitit, aut tibicen repente conticuit, aut puer ille patrimus et matrimus si tensam non tenuit, si lorum omisit, aut si aedilis verbo aut simpuvio aberravit, ludi sunt non rite facti, eaque errata expiantur, et mentes deorum immortalium ludorum instauratione placantur: si ludi ab laetitia ad metum traducti, si non intermissi sed perempti atque sublati sunt, si civitati universae,	509:516	0:1126
senatus	NN	[-100,0]	1	24_3	 	, a mitra, a muliebribus soleis purpureisque fasceolis, a strophio, a psalterio, a flagitio, a stupro est factus repente popularis. Nisi eum mulieres exornatum ita deprendissent, nisi ex eo loco quo eum adire fas non fuerat ancillarum beneficio emissus esset, populari homine populus Romanus, res publica cive tali careret. Hanc ob amentiam in discordiis nostris, de quibus ipsis his prodigiis recentibus a dis immortalibus admonemur, arreptus est unus ex patriciis cui tribuno plebis fieri non liceret. Quod anno ante frater Metellus et concors etiam tum senatus, senatus principe Cn. Pompeio sententiam dicente, excluserat acerrimeque una voce ac mente restiterat, id post discidium optimatium, de quo ipso nunc monemur, ita perturbatum itaque permutatum est ut, quod frater consul ne fieret obstiterat, quod adfinis et sodalis clarissimus vir, qui illum reum non laudarat, excluserat, id is consul efficeret in discordiis principum qui illi unus inimicissimus esse debuerat, eo fecisse auctore se diceret cuius auctoritatis neminem posset paenitere. Iniecta fax est foeda ac luctuosa rei publicae; petita est auctoritas vestra, gravitas amplissimorum ordinum, consensio bonorum omnium	565:572	0:1188
senatus	NN	[-100,0]	1	24_4	 	, a vagis per agros pabulatoribus Romanis ad Q. Claudium propraetorem deducuntur. eum primo incertis implicantes responsis ut metus tormentorum admotus fateri vera coegit, edocuerunt litteras se ab Hasdrubale ad Hannibalem ferre. cum iis litteris, sicut erant, signatis L. Verginio tribuno militum ducendi ad Claudium consulem traduntur; duae simul turmae Samnitium praesidii causa missae. qui ubi ad consulem pervenerunt litteraeque lectae per interpretem sunt et ex captivis percontatio facta, tum Claudius non id tempus esse rei publicae ratus quo consiliis ordinariis provinciae suae quisque finibus per exercitus suos cum hoste destinato ab senatu bellum gereret- audendum ac novandum aliquid improvisum, inopinatum, quod coeptum non minorem apud cives quam hostes terrorem faceret, perpetratum in magnam laetitiam ex magno metu verteret--, litteris Hasdrubalis Romam ad senatum missis simul et ipse patres conscriptos quid pararet edocet; monet ut cum in Umbria se occursurum Hasdrubal fratri scribat legionem a Capua Romam arcessant, dilectum Romae habeant, exercitum urbanum ad Narniam hosti opponant. haec senatu scripta. praemissi item per agrum Larinatem Marrucinum Frentanum Praetutianum, qua exercitum ducturus erat, ut omnes ex agris urbibusque commeatus paratos	646:652	0:1277
senatus	NN	[-100,0]	1	24_5	 	, acerrime contemplemini. Nihil religione testatum, nihil veritate fundatum, nihil dolore expressum, contraque omnia corrupta libidine, iracundia, studio, pretio, periurio reperientur. Etenim iam universa istorum cognita cupiditate accedam ad singulas querelas criminationesque Graecorum. Classis nomine pecuniam civitatibus imperatam queruntur. Quod nos factum, iudices, confitemur. Sed si hoc crimen est, aut in eo est quod non licuerit imperare, aut in eo quod non opus fuerit navibus, aut in eo quod nulla hoc praetore classis navigarit. Licuisse ut intellegas, cognosce quid me consule senatus decreverit, cum quidem nihil a superioribus continuorum annorum decretis discesserit. Senatvs consvltvm. Proximum est ergo ut opus fuerit classe necne quaeramus. Vtrum igitur hoc Graeci statuent aut ullae exterae nationes, an nostri praetores, nostri duces, nostri imperatores? Equidem existimo in eius modi regione atque provincia quae mari cincta, portibus distincta, insulis circumdata esset, non solum praesidi sed etiam ornandi imperi causa navigandum fuisse. Haec enim ratio ac magnitudo animorum in maioribus nostris fuit ut, cum in privatis rebus suisque sumptibus minimo contenti tenuissimo cultu viverent, in	591:598	0:1218
senatus	NN	[-100,0]	1	24_8	 	, ad se ex iis omnia ornamenta transtulerit, caedis et incendiorum causam quaesierit ex funere, duobus aut tribus senatus consultis bene et e re publica factis reliquas res ad lucrum praedamque revocaverit, vendiderit immunitates, civitates liberaverit, provincias universas ex imperii populi Romani iure sustulerit, exules reduxerit, falsas leges C. Caesaris nomine et falsa decreta in aes incidenda et in Capitolio figenda curaverit earumque rerum omnium domesticum mercatum instituerit, populo Romano leges imposuerit, armis et praesidiis populum et magistratus foro excluserit, senatum stiparit armatis, armatos in cella Concordiae, cum senatum haberet, incluserit, ad legiones Brundisium cucurrerit, ex iis optime sentientis centuriones iugulaverit, cum exercitu Romam sit ad interitum nostrum et ad dispertitionem urbis venire conatus? Atque is ab hoc impetu abstractus consilio et copiis Caesaris, consensu veteranorum, virtute legionum, ne fortuna quidem fractus minuit audaciam nec ruere demens nec furere desinit. In Galliam mutilatum ducit exercitum, cum una legione, et ea vacillante, L. fratrem expectat, quo neminem reperire potest sui similiorem. Ille autem ex myrmillone dux, ex gladiatore imperator quas effecit strages, ubicumque posuit	641:648	0:1255
senatus	NN	[-100,0]	1	24_10	 	, adfirmantes se non modo suam quosque patriam, sed totam Siciliam relicturos si eo Marcellus iterum cum imperio redisset. nullo suo merito eum ante implacabilem in se fuisse: quid iratum quod Romam de se questum venisse Siculos sciat facturum? obrui Aetnae ignibus aut mergi freto satius illi insulae esse quam velut dedi noxae inimico. hae Siculorum querellae domos primum nobilium circumlatae celebrataeque sermonibus, quos partim misericordia Siculorum, partim invidia Marcelli excitabat, in senatum etiam pervenerunt. postulatum a consulibus est ut de permutandis provinciis senatum consulerent. Marcellus si iam auditi ab senatu Siculi essent aliam forsitan futuram fuisse sententiam suam dicere: nunc ne quis timore frenari eos dicere posset quo minus de eo libere querantur in cuius potestate mox futuri sint, si collegae nihil intersit mutare se provinciam paratum esse, deprecari senatus praeiudicium; nam cum extra sortem collegae optionem dari provinciae iniquum fuerit, quanto maiorem iniuriam, immo contumeliam esse, sortem suam ad eum transferri? ita senatus cum quid placeret magis ostendisset quam decrevisset, dimittitur. inter ipsos consules permutatio provinciarum rapiente fato Marcellum ad Hannibalem facta est, ut ex quo primus post	628:634	0:1256
senatus	NN	[-100,0]	1	24_12	 	, aedem Albam Capuae portamque Romanam; muri pinnae aliquot locis decussae erant. haec inter prodigia nuntiatum et ab Reate tripedem natum mulum. ob ea decemviri iussi adire libros edidere, quibus diis et quot hostiis sacrificaretur, et[ fulminibus complura loca deformata aedem Iovis] ut supplicatio diem unum esset. ludi deinde votivi Q. Fulvii consulis per dies decem magno apparatu facti. Censorum inde comitia habita: creati M. Aemilius Lepidus pontifex maximus et M. Fulvius Nobilior, qui ex Aetolis triumphaverat. inter hos viros nobiles inimicitiae erant, saepe multis et in senatu et ad populum atrocibus celebratae certaminibus. comitiis confectis, ut traditum antiquitus est, censores in Campo ad aram Martis sellis curulibus consederunt; quo repente principes senatorum cum agmine venerunt civitatis, inter quos Q. Caecilius Metellus verba fecit.'' Non obliti sumus, censores, vos paulo ante ab universo populo Romano moribus nostris praepositos esse, et nos a vobis et admoneri et regi, non vos a nobis debere. indicandum tamen est, quid omnes bonos in vobis aut offendat aut certe mutatum malint. singulos cum intuemur, M. Aemili, M.	583:589	0:1148
senatus	NN	[-100,0]	1	24_17	 	, Antoni, quorum facta imitere, eorum exitus non perhorrescere. Atque hoc in aliis minus mirabar. Nemo enim illorum inimicus mihi fuit voluntarius, omnes a me rei publicae causa lacessiti. Tu ne Vo quidem violatus, ut audacior quam Catilina, furiosior quam Clodius viderere, ultro me maledictis lacessisti, tuamque a me alienationem commendationem tibi ad impios civis fore putavisti. Quid putem? contemptumne me? Non video, nec in vita nec in gratia nec in rebus gestis nec in hac mea mediocritate ingeni quid despicere possit Antonius. An in senatu facillime de me detrahi posse credidit? qui ordo clarissimis civibus bene gestae rei publicae testimonium multis, mihi uni conservatae dedit. An decertare mecum voluit contentione dicendi? Hoc quidem est beneficium. Quid enim plenius, quid uberius quam mihi et pro me et contra Antonium dicere? Illud profecto[ est]: non existimavit sui similibus probari posse se esse hostem patriae, nisi mihi esset inimicus. Cui priusquam de ceteris rebus respondeo, de amicitia quam a me violatam esse criminatus est, quod ego gravissimum crimen iudico, pauca dicam. Contra	544:550	0:1112
senatus	NN	[-100,0]	1	24_20	 	, at carebo mala, et quam primum tetigero bene moratam et liberam civitatem, in ea conquiescam. O frustra, inquit, mihi suscepti labores! O spes fallaces et cogitationes inanes meae! Ego cum tribunus plebis re publica oppressa me senatui dedissem, quem exstinctum acceperam, equitibus Romanis, quorum vires erant debiles, bonis viris, qui omnem auctoritatem Clodianis armis abiecerant, mihi umquam bonorum praesidium defuturum putarem? ego cum te-- mecum enim saepissime loquitur-- patriae reddidissem, mihi putarem in patria non futurum locum? Ubi nunc senatus est, quem secuti sumus? ubi equites Romani illi[ illi], inquit, tui? ubi studia municipiorum? ubi Italiae voces? ubi denique tua illa, M. Tulli, quae plurimis fuit auxilio, vox atque defensio? mihine ea soli, qui pro te totiens morti me obtuli, nihil potest opitulari? Nec vero haec, iudices, ut ego nunc, flens, sed hoc eodem loquitur voltu quo videtis. Negat enim, negat ingratis civibus fecisse se quae fecerit; timidis et omnia circumspicientibus pericula non negat. Plebem et	554:561	0:1043
senatus	NN	[-100,0]	1	24_21	 	, aut in quorum manu essent, tradebant, ut ipsi in privato animadverterent in eas: si nemo erat idoneus supplicii exactor, in publico animadvertebatur. datum deinde consulibus negotium est, ut omnia Bacchanalia Romae primum, deinde per totam Italiam diruerent, extra quam si qua ibi vetusta ara aut signum consecratum esset. in reliquum deinde senatus consulto cautum est, ne qua Bacchanalia Romae neve in Italia essent. si quis tale sacrum sollemne et necessarium duceret, nec sine religione et piaculo se id omittere posse, apud praetorem urbanum profiteretur, praetor senatum consuleret. si ei permissum esset, cum in senatu centum non minus essent, ita id sacrum faceret, dum ne plus quinque sacrificio interessent, neu qua pecunia communis neu quis magister sacrorum aut sacerdos esset. Aliud deinde huic coniunctum referente Q. Marcio consule senatus consultum factum est, ut de iis, quos pro indicibus consules habuissent, integra res ad senatum referretur, cum Sp. Postumius quaestionibus perfectis Romam redisset. Minium Cerrinium Campanum Ardeam in vincula mittendum censuerunt, magistratibusque Ardeatium praedicendum, ut intentiore eum custodia adservarent, non solum ne effugeret,	571:578	0:1194
senatus	NN	[-100,0]	1	24_23	 	, belli princeps, crudelitatis auctor, praedae socius, testamento, ut dicebas ipse, filius, appellatus es de pecunia, quam pro domo, pro hortis, pro sectione debebas. Primo respondisti plane ferociter et, ne omnia videar contra te, prope modum aequa et iusta dicebas:'' A me C. Caesar pecuniam? cur potius quam ego ab illo? an sine me ille vicit? At ne potuit quidem. Ego ad illum belli civilis causam attuli, ego leges perniciosas rogavi, ego arma contra consules imperatoresque populi Romani, contra senatum populumque Romanum, contra deos patrios arasque et focos, contra patriam tuli. Num sibi soli vicit? Quorum facinus est commune, cur non sit eorum praeda communis?'' Ius postulabas, sed quid ad rem? Plus ille poterat. Itaque excussis tuis vocibus et ad te et ad praedes tuos milites misit, cum repente a te praeclara illa tabula prolata est. Qui risus hominum, tantam esse tabulam, tam varias, tam multas possessiones, ex quibus praeter partem Miseni nihil erat, quod, qui auctionaretur, posset suum dicere!	502:509	0:1017
senatus	NN	[-100,0]	1	24_24	 	, C. Claudi, qui patruus Appi decemviri erat, oratio fuit precibus quam iurgio similior, orantis per sui fratris parentisque eius manes ut civilis potius societatis in qua natus esset, quam foederis nefarie icti cum collegis meminisset. Multo id magis se illius causa orare quam rei publicae; quippe rem publicam, si a volentibus nequeat, ab invitis ius expetituram; sed ex magno certamine magnas excitari ferme iras; earum eventum se horrere. Cum aliud praeterquam de quo rettulissent decemviri dicere prohiberent, Claudium interpellandi verecundia fuit. Sententiam igitur peregit nullum placere senatus consultum fieri. Omnesque ita accipiebant privatos eos a Claudio iudicatos; multique ex consularibus Vo adsensi sunt. Alia sententia, asperior in speciem, vim minorem aliquanto habuit, quae patricios coire ad prodendum interregem iubebat. Censendo enim quodcumque, magistratus esse qui senatum haberent iudicabat, quos privatos fecerat auctor nullius senatus consulti faciendi. Ita labente iam causa decemvirorum, L. Cornelius Maluginensis, M. Corneli decemviri frater, cum ex consularibus ad ultimum dicendi locum consulto servatus esset, simulando curam belli fratrem collegasque eius tuebatur, quonam fato incidisset mirari se dictitans ut	597:604	0:1248
senatus	NN	[-100,0]	1	24_25	 	, C. Fannius, quorum habetis cognitam voluntatem in rem publicam eamque perpetuam atque constantem, nuntiant se Pompei conveniundi causa devertisse Massiliam eumque cognovisse paratissimo animo, ut cum suis copiis iret ad Mutinam, ni vereretur, ne veteranorum animos offenderet. Est vero eius patris filius, qui sapienter faciebat non minus multa quam fortiter. Itaque intellegitis et animum ei praesto fuisse nec consilium defuisse. Atque etiam hoc M. Lepido providendum est, ne quid arrogantius, quam eius mores ferunt, facere videatur. Si enim nos exercitu terret, non meminit illum exercitum senatus populique Romani atque universae rei publicae esse, non suum. At uti potest pro suo. Quid tum? omniane bonis viris, quae facere possunt, facienda sunt, etiamne, si turpia, si perniciosa erunt, si facere omnino non licebit? Quid autem turpius aut foedius aut quod minus deceat quam contra senatum, contra cives, contra patriam exercitum ducere? quid vero magis vituperandum quam id facere, quod non liceat? Licet autem nemini contra patriam ducere exercitum, siquidem licere id dicimus, quod legibus, quod more maiorum institutisque conceditur	596:603	0:1147
senatus	NN	[-100,0]	1	24_26	 	, calvam auro caelavere, idque sacrum vas iis erat quo sollemnibus libarent poculumque idem sacerdoti esset ac templi antistitibus. Praeda quoque haud minor Gallis quam victoria fuit; nam etsi magna pars animalium strage silvae oppressa erat, tamen ceterae res, quia nihil dissipatum fuga est, stratae per omnem iacentis agminis ordinem inventae sunt. Hac nuntiata clade cum per dies multos in tanto pavore fuisset civitas ut tabernis clausis velut nocturna solitudine per urbem acta senatus aedilibus negotium daret ut urbem circumirent aperirique tabernas et maestitiae publicae speciem urbi demi iuberent, tum Ti. Sempronius senatum habuit consolatusque patres est, et adhortatus ne qui Cannensi ruinae non succubuissent ad minores calamitates animos summitterent: quod ad Carthaginienses hostes Hannibalemque attineret, prospera modo essent, sicut speraret, futura, Gallicum bellum et omitti tuto et differri posse ultionemque eam fraudis in deorum ac populi Romani potestate fore: de hoste Poeno exercitibusque, per quos id bellum gereretur, consultandum atque agitandum. Ipse primum quid peditum equitumque, quid civium, quid sociorum in exercitu esset dictatoris, disseruit; tum Marcellus suarum copiarum summam exposuit. Quid in Apulia cum C. Terentio	628:635	0:1260
senatus	NN	[-100,0]	1	24_29	 	, Carvilius ad Veliam oppugnandam legiones ducunt. Litterae consulum ingenti laetitia et in curia et in contione auditae, et quatridui supplicatione publicum gaudium privatis studiis celebratum est. Nec populo Romano magna solum sed peropportuna etiam ea victoria fuit, quia per idem forte tempus rebellasse Etruscos allatum est; subibat cogitatio animum quonam modo tolerabilis futura Etruria fuisset si quid in Samnio adversi evenisset, quae coniuratione Samnitium erecta, quoniam ambo consules omnisque Romana vis aversa in Samnium esset, occupationem populi Romani pro occasione rebellandi habuisset. Legationes sociorum, a M. Atilio praetore in senatum introductae, querebantur uri ac vastari agros a finitimis Etruscis quod desciscere a populo Romano nollent obtestabanturque patres conscriptos ut se a vi atque iniuria communium hostium tutarentur. Responsum legatis curae senatui futurum ne socios fidei suae paeniteret: Etruscorum propediem eandem fortunam quam Samnitium fore. Segnius tamen, quod ad Etruriam attinebat, acta res esset, ni Faliscos quoque, qui per multos annos in amicitia fuerant, allatum foret arma Etruscis iunxisse. Huius propinquitas populi acuit curam patribus ut fetiales mittendos ad res repetendas censerent; quibus non redditis ex auctoritate patrum iussu populi	650:657	0:1299
senatus	NN	[-100,0]	1	24_30	 	, castris exuerit, quorum gentem biduo post pugnam totam acceperit in deditionem, a quibus obsides abduxerit, pacis futurae pignus. verum enimvero illud multo maius esse, quod tantum numerum Gallorum occiderit in acie, quot cum milibus certe Boiorum nemo ante se imperator pugnaverit. plus partem dimidiam ex quinquaginta milibus hominum caesam, multa milia capta; senes puerosque Bois superesse. itaque id quemquam mirari posse, cur victor exercitus, cum hostem in provincia neminem reliquisset, Romam venerit ad celebrandum consulis triumphum? quorum militum si et in alia provincia opera uti senatus velit, utro tandem modo promptiores ad aliud periculum novumque laborem ituros credat, si persoluta eis sine detractatione prioris periculi laborisque merces sit, an si spem pro re ferentis dimittant, iam semel in prima spe deceptos? nam quod ad se attineat, sibi gloriae in omnem vitam illo die satis quaesitum esse, quo se virum optimum iudicatum ad accipiendam matrem Idaeam misisset senatus. hoc titulo, etsi nec consulatus nec triumphus addatur, satis honestam honoratamque P. Scipionis Nasicae imaginem fore. universus senatus non ipse modo ad decernendum triumphum consensit, sed etiam	595:602	0:1196
senatus	NN	[-100,0]	1	24_31	 	, causasque criminum ad plebem, seditionum inde ac legum novarum praebituram; satius igitur esse reconciliari eo dono plebis animos, exhaustis atque exinanitis tributo tot annorum succurri, et sentire praedae fructum ex eo bello in quo prope consenuerint. Gratius id fore laetiusque quod quisque sua manu ex hoste captum domum rettulerit quam si multiplex alterius arbitrio accipiat. Ipsum dictatorem fugere invidiam ex eo criminaque; eo delegasse ad senatum; senatum quoque debere reiectam rem ad se permittere plebi ac pati habere quod cuique fors belli dederit. Haec tutior visa sententia est quae popularem senatum faceret. Edictum itaque est ad praedam Veientem quibus videretur in castra ad dictatorem proficiscerentur. Ingens profecta multitudo replevit castra. Tum dictator auspicato egressus cum edixisset ut arma milites caperent,; tuo ductu; inquit,; Pythice Apollo, tuoque numine instinctus pergo ad delendam urbem Veios, tibique hinc decimam partem praedae voveo. Te simul, Iuno regina, quae nunc Veios colis, precor, ut nos victores in nostram tuamque mox futuram urbem sequare, ubi te dignum amplitudine tua templum accipiat;. Haec precatus, superante multitudine ab omnibus locis	611:618	0:1196
senatus	NN	[-100,0]	1	24_35	 	, clarissumum atque optumum virum, Deiotarum regem, commemorem? Qui nihil umquam nisi auspicato gerit. Qui cum ex itinere quodam proposito et constituto revertisset aquilae admonitus volatu, conclave illud, ubi erat mansurus, si ire perrexisset, proxima nocte corruit. Itaque, ut ex ipso audiebam, persaepe revertit ex itinere, cum iam progressus esset multorum dierum viam. Quoius quidem hoc praeclarissimum est, quod, posteaquam a Caesare tetrarchia et regno pecuniaque multatus est, negat se tamen eorum auspiciorum, quac sibi ad Pompeium proficiscenti secunda evenerint, paenitere; senatus enim auctoritatem et populi Romani libertatem atque imperii dignitatem suis armis esse defensam, sibique eas aves, quibus auctoribus officium et fidem secutus esset, bene consuluisse; antiquiorem enim sibi fuisse possessionibus suis gloriari. Ille mihi videtur igitur vere augurari. Nam nostri quidem magistratus auspiciis utuntur coactis; necesse est enim offa obiecta cadere frustum ex pulli ore, cum pascitur; quod autem scriptum habetis,[ aut] tripudium fieri, si ex ea quid in solidum ceciderit, hoc quoque, quod dixi, coactum tripudium solistimum dicitis. Itaque multa auguria,	586:593	0:1178
