lemma	pos	date	grouping	identifier	description	context	indexes_target_token	indexes_target_sentence
senatus	NN	[-100,0]	1	24_36	 	, concludam illud de optimatibus eorumque principibus ac rei publicae defensoribus, vosque, adulescentes, et qui nobiles estis, ad maiorum vestrorum imitationem excitabo, et qui ingenio ac virtute nobilitatem potestis consequi, ad eam rationem in qua multi homines novi et honore et gloria floruerunt cohortabor. haec est una via, mihi credite, et laudis et dignitatis et honoris, a bonis viris sapientibus et bene natura constitutis laudari et diligi; nosse discriptionem civitatis a maioribus nostris sapientissime constitutam; qui cum regum potestatem non tulissent, ita magistratus annuos creaverunt ut consilium senatus rei publicae praeponerent sempiternum, deligerentur autem in id consilium ab universo populo aditusque in illum summum ordinem omnium civium industriae ac virtuti pateret. senatum rei publicae custodem, praesidem, propugnatorem conlocaverunt; huius ordinis auctoritate uti magistratus et quasi ministros gravissimi consili esse voluerunt; senatum autem ipsum proximorum ordinum splendorem confirmare, plebis libertatem et commoda tueri atque augere voluerunt. LXVI haec qui pro virili parte defendunt optimates sunt, cuiuscumque sunt ordinis; qui autem praecipue suis cervicibus tanta munia atque rem publicam sustinent, hi semper habiti sunt optimatium principes, auctores et	617:624	0:1302
senatus	NN	[-100,0]	1	24_38	 	, consilio C. Caesaris summoque consensu militum veteranorum, qui eius auctoritatem secuti rei publicae praesidio sunt et fuerunt, a gravissimis periculis populus Romanus defensus sit et hoc tempore defendatur; cumque legio Martia Albae constiterit, in municipio fidelissimo et fortissimo, seseque ad senatus auctoritatem populique Romani libertatem contulerit; et quod pari consilio eademque virtute legio quarta usa L. Egnatuleio quaestore duce, civi egregio, senatus auctoritatem populique Romani libertatem defendat ac defenderit: senatui magnae curae esse ac fore, ut pro tantis eorum in rem publicam meritis honores eis habeantur gratiaeque referantur. Senatui placere, uti C. Pansa A. Hirtius, consules designati, cum magistratum inissent, si eis videretur, primo quoque tempore de his rebus ad hunc ordinem referrent, ita uti e re publica fideque sua videretur. IN M. ANTONIVM ORATIO PHILIPPICA QVARTA Frequentia vestrum incredibilis, Quirites, contioque tanta, quantam meminisse non videor, et alacritatem mihi summam defendendae rei publicae adfert et spem recuperandae. Quamquam animus mihi quidem numquam defuit, tempora defuerunt, quae simul ac primum aliquid lucis ostendere visa sunt, princeps vestrae libertatis defendendae fui. Quodsi id ante	659:666	0:1260
senatus	NN	[-100,0]	1	24_42	 	, credo iis futura fuisse communia. Nam cum serperet in urbe infinitum malum idque manaret in dies latius idemque bustum in foro facerent, qui illam insepultam sepulturam effecerat, et cotidie magis magisque perditi homines cum sui similibus servis tectis ac templis urbis minitarentur, talis animadversio fuit Dolabellae cum in audacis sceleratosque servos, tum in impuros et nefarios liberos, talisque eversio illius exsecratae columnae, ut mihi mirum videatur tum valde reliquum tempus ab illo uno die dissensisse. Ecce enim Kalendis Iuniis, quibus ut adessemus, edixerat, mutata omnia: nihil per senatum, multa et magna per populum et absente populo et invito. Consules designati negabant se audere in senatum venire; patriae liberatores urbe carebant ea, cuius a cervicibus iugum servile deiecerant; quos tamen ipsi consules in contionibus et in omni sermone laudabant. Veterani qui appellabantur, quibus hic ordo diligentissime caverat, non ad conservationem earum rerum, quas habebant, sed ad spem novarum praedarum incitabantur. Quae cum audire mallem quam videre haberemque ius legationis liberum, ea mente discessi, ut adessem Kalendis Ianuarris, quod initium senatus cogendi fore videbatur. Eui	600:607	0:1206
senatus	NN	[-100,0]	1	24_45	 	, cum aut res quae sit tota quaeratur, aut pars eius, aut vocabulum quod habeat, aut quippiam, rem illam quod attingat; extrinsecus autem, cum ea, quae sunt foris neque haerent in rei natura, conliguntur. Si res tota quaeritur, definitione universa vis explicanda est, sic:; si maiestas est amplitudo ac dignitas civitatis, is eam minuit, qui exercitum hostibus populi Romani tradidit, non qui eum, qui id fecisset, populi Romani potestati tradidit.; Sin pars, partitione, hoc modo:; aut senatui parendum de salute rei publicae fuit aut aliud consilium instituendum aut sua sponte faciendum; aliud consilium, superbum; suum, adrogans; utendum igitur fuit consilio senatus.; Si ex vocabulo, ut Carbo:; si consul est, qui consulit patriae, quid aliud fecit Opimius?; Sin ab eo, quod rem attingit, plures sunt argumentorum sedes ac loci, nam et coniuncta quaeremus et genera et partis generibus subiectas et similitudines et dissimilitudines et contraria et consequentia et consentanea et quasi praecurrentia et repugnantia et causas rerum vestigabimus et ea,	488:495	0:1057
senatus	NN	[-100,0]	1	24_46	 	, cum causa non telum quaereretur, qui sui defendendi causa telo esset usus non minis occidendi causa habuisse telum iudicaretur. Quapropter hoc maneat in causa, iudices, non enim dubito quin probaturus sim vobis defensionem meam, si id memineritis quod oblivisci non potestis, insidiatorem iure interfici posse. Sequitur illud, quod a Milonis inimicis saepissime dicitur, caedem in qua P. Clodius occisus est senatum iudicasse contra rem publicam esse factam. Illam vero senatus non sententiis suis solum, sed etiam studiis comprobavit. Quotiens enim est illa causa a nobis acta in senatu! quibus adsensionibus universi ordinis, quam nec tacitis nec occultis! Quando enim frequentissimo senatu quattuor aut summum quinque sunt inventi qui Milonis causam non probarent? Declarant huius ambusti tribuni plebis illae intermortuae contiones, quibus cotidie meam potentiam invidiose criminabatur, eum diceret senatum non quod sentiret, sed quod ego vellem decernere. Quae quidem si potentia est appellanda-- potius quam aut propter magna in rem publicam merita mediocris in bonis causis auctoritas, aut propter hos officiosos labores meos non nulla apud bonos gratia,-- appellatur ita sane, dum modo	583:589	0:1196
senatus	NN	[-100,0]	1	24_47	 	, cum dignitas hominis, cum ratio humanitatis, cum meae vitae perpetua consuetudo ad C. Rabirium defendendum est adhortata, tum vero, ut id studiosissime facerem, salus rei publicae, consulare officium, consulatus denique ipse mihi una; a; vobis cum salute rei publicae commendatus coegit. Non enim C. Rabirium culpa delicti, non invidia vitae, Quirites, non denique veteres iustae gravesque inimicitiae civium in discrimen capitis vocaverunt, sed ut illud summum auxilium maiestatis atque imperi quod nobis a maioribus est traditum de re publica tolleretur, ut nihil posthac auctoritas senatus, nihil consulare imperium, nihil consensio bonorum contra pestem ac perniciem civitatis valeret, idcirco in his rebus evertendis unius hominis senectus, infirmitas solitudoque temptata est. Quam ob rem si est boni consulis, cum cuncta auxilia rei publicae labefactari convellique videat, ferre opem patriae, succurrere saluti fortunisque communibus, implorare civium fidem, suam salutem posteriorem salute communi ducere, est etiam bonorum et fortium civium, quales vos omnibus rei publicae temporibus exstitistis, intercludere omnis seditionum vias, munire praesidia rei publicae, summum in consulibus imperium, summum in senatu consilium	587:594	0:1235
senatus	NN	[-100,0]	1	24_48	 	, cum duobus consulibus duo consulares exercitus amissi nuntiabantur nec ulla iam castra Romana nec ducem nec militem esse; Hannibalis Apuliam, Samnium ac iam prope totam Italiam factam. Nulla profecto alia gens tanta mole cladis non obruta esset. compares cladem ad Aegates insulas Carthaginiensium proelio navali acceptam, qua fracti Sicilia ac Sardinia cessere, inde vectigales ac stipendiarios fieri se passi sunt, aut pugnam adversam in Africa, cui postea hic ipse Hannibal succubuit; nulla ex parte comparandae sunt nisi quod minore animo latae sunt. P. Furius Philus et M. Pomponius praetores senatum in curiam Hostiliam vocaverunt, ut de urbis custodia consulerent; neque enim dubitabant deletis exercitibus hostem ad oppugnandam Romam, quod unum opus belli restaret, venturum. Cum in malis sicuti ingentibus ita ignotis ne consilium quidem satis expedirent obstreperetque clamor lamentantium mulierum et nondum palam facto vivi mortuique et per omnes paene domos promiscue complorarentur, tum Q. Fabius Maximus censuit equites expeditos et Appia et Latina via mittendos, qui obvios percontando- aliquos profecto ex fuga passim dissipatos fore- referant quae fortuna consulum atque exercituum sit et, si quid di immortales miseriti imperii	600:607	0:1248
senatus	NN	[-100,0]	1	24_49	 	, cum illius nefarii gladiatoris voces percrebruissent quas habuisse in contione domestica dicebatur, cum miserorum fidelem defensorem negasset inveniri posse nisi eum qui ipse miser esset; integrorum et fortunatorum promissis saucios et miseros credere non oportere; qua re qui consumpta replere, erepta reciperare vellent, spectarent quid ipse deberet, quid possideret, quid auderet; minime timidum et valde calamitosum esse oportere eum qui esset futurus dux et signifer calamitosorum. Tum igitur, his rebus auditis, meministis fieri senatus consultum referente me ne postero die comitia haberentur, ut de his rebus in senatu agere possemus. Itaque postridie frequenti senatu Catilinam excitavi atque eum de his rebus iussi, si quid vellet, quae ad me adlatae essent dicere. Atque ille, ut semper fuit apertissimus, non se purgavit sed indicavit atque induit. Tum enim dixit duo corpora esse rei publicae, unum debile infirmo capite, alterum firmum sine capite; huic, si ita de se meritum esset, caput se vivo non defuturum. Congemuit senatus frequens neque tamen satis severe pro rei indignitate decrevit; nam partim ideo fortes in decernendo non erant, quia nihil	622:628	0:1169
senatus	NN	[-100,0]	1	24_50	 	, cum omnes pontifices qui erant huius ordinis adessent, cumque alii qui honoribus populi Romani antecedebant multa de conlegi iudicio verba fecissent, omnesque idem scribendo adessent, domum meam iudicio pontificum religione liberatam videri. De hoc igitur loco sacro potissimum videntur haruspices dicere, qui locus solus ex privatis locis omnibus hoc praecipue iuris habet, ut ab ipsis qui sacris praesunt sacer non esse iudicatus sit? Verum referte, quod ex senatus consulto facere debetis. Aut vobis cognitio dabitur, qui primi de hac domo sententiam dixistis et eam religione omni liberastis, aut senatus ipse iudicabit, qui uno illo solo antistite sacrorum dissentiente frequentissimus antea iudicavit, aut,- id quod certe fiet,- ad pontifices reicietur, quorum auctoritati fidei prudentiae maiores nostri sacra religionesque et privatas et publicas commendarunt. Quid ergo ii possunt aliud iudicare ac iudicaverunt? Multae sunt domus in hac urbe, patres conscripti, atque haud scio an paene cunctae iure optimo, sed tamen iure privato, iure hereditario, iure auctoritatis, iure mancipi, iure nexi: nego esse ullam domum aliam privato eodem quo quae optima lege, publico vero	603:610	0:1183
senatus	NN	[-100,0]	1	24_51	 	, cum omnium provinciarum pactiones, cum omnia cum omnibus foedera; de; reconciliatione gratiarum sanguine meo sancirentur, cum omnes boni non recusarent, quin vel pro me vel mecum perirent, armis decertare pro mea salute nolui, quod et vincere et vinci luctuosum rei publicae fore putavi. At inimici mei, mense Ianuario cum de me ageretur, corporibus civium trucidatis flumine sanguinis meum reditum intercludendum putaverunt. Itaque, dum ego absum, eam rem publicam habuistis, ut aeque me atque illam restituendam putaretis. ego autem, in qua civitate nihil valeret senatus, omnis esset impunitas, nulla iudicia, vis et ferrum in foro versaretur, cum privati parietum se praesidio, non legum tuerentur, tribuni plebis vobis inspectantibus vulnerarentur, ad magistratuum domos cum ferro et facibus iretur, consulis fasces frangerentur, deorum immortalium templa incenderentur, rem publicam esse nullam putavi. itaque neque re publica exterminata mihi locum in hac urbe esse duxi, nec, si illa restitueretur, dubitavi, quin me se cum ipsa reduceret. An ego, cum mihi esset exploratissimum P. Lentulum proximo anno consulem futurum, qui illis ipsis	568:575	0:1148
senatus	NN	[1400,1500]	2	24_6	 	, Acrinne, non patrum istorum sententia( nunquam enim si satis eos novi tam iniqui iudices essent) sed quovis alio pacto ornamenta tibi hec occuparis, superisque volentibus tu patrem ab inferis excitatum ornatus offenderis. rogatusque ut scelus honestares ita patri ea tibi ob istas quas attulisti causas fuisse adiudicata diceres, quid censes? num parum exclamaret, an non voce maxima patrum iniquitatem detestaretur?'' Siccine, patres, ornamenta hec que patria mea virtuti premium contribuit, que universa civitas sue in me beneficentie meritorumque meorum testificationem quandam fore voluere, quibus me senatus populusque Lacenas cunctique civium ordines ob pericula, ob labores, ob vigilias, ob propulsatum inimicorum impetum, ob libertatem, otium, quietem tranquillitatemque civibus meis a me servatam condecoravit, vos ea adiudicastis insignia homini huic qui suspicionibus suis ineptaque et futili curiositate otium quietemque domesticam funditus substulit, sibique servilem quandam seque ac nostra familia indignam conditionem imposuit. An tu is es, fili, quem natum arbitrabar ad glorie claritatem, ad nominis posteritatem, ad optime de patria promerendum? Tunc, fili, preter meam civiumque nostrorum de te expectationem operas ingeniumque	607:614	0:1250
senatus	NN	[100,200]	2	24_7	 	, ad C. Fabricium consulem furtim venit ac praemium petivit et, si de praemio conveniret, promisit regem venenis necare idque facile esse factu dixit, quoniam filii sui pocula in convivio regi ministrarent. Eam rem Fabricius ad senatum scripsit. Senatus ad regem legatos misit mandavitque, ut de Timochare nihil proderent, sed monerent, uti rex circumspectius ageret atque a proximorum insidiis salutem tutaretur. Hoc ita, uti diximus, in Valeri Antiatis historia scriptum est. Quadrigarius autem in libro tertio non Timocharem, sed Niciam adisse ad consulem scripsit neque legatos a senatu missos, sed a consulibus, et Pyrrum populo Romano laudes atque gratias scripsisse captivosque omnes, quos tum habuit, vestivisse et reddidisse. Consules tum fuerunt C. Fabricius et Q. Aemilius. Litteras, quas ad regem Pyrrum super ea causa miserunt, Claudius Quadrigarius scripsit fuisse hoc exemplo:; Consules Romani salutem dicunt Pyrro regi. Nos pro tuis iniuriis continuis animo tenus commoti inimiciter tecum bellare studemus. Sed communis exempli et fidei ergo visum, ut te salvum velimus, ut esset, quem armis vincere possimus. Ad nos venit Nicias familiaris tuus	584:590	0:1162
senatus	NN	[300,400]	2	24_9	 	, adeo ut sedecim ordines dicatur habuisse remorum. Triumphavit autem magnificentissime in curru aureo cum duobus filiis utroque latere adstantibus. Ducti sunt ante currum duo regis filii et ipse Perseus, XLV annos natus. Post eum etiam Anicius de Illyriis triumphavit. Gentius cum fratre et filiis ante currum ductus est. Ad hoc spectaculum reges multarum gentium Romam venerunt, inter alios venit etiam Attalus atque Eumenes, Asiae reges, et Prusias Bithyniae. Magno honore excepti sunt et permittente senatu dona, quae attulerant, in Capitolio posuerunt. Prusias etiam filium suum Nicomeden senatui commendavit. Insequenti anno L. Memmius in Lusitania bene pugnavit. Marcellus postea consul res ibidem prosperas gessit. Tertium deinde bellum contra Carthaginem suscipitur, sexcentesimo et altero ab urbe condita anno, L. Manlio Censorino et M. Manilio consulibus, anno quinquagesimo primo postquam secundum Punicum transactum erat. Hi profecti Carthaginem oppugnaverunt. Contra eos Hasdrubal, dux Carthaginiensium, dimicabat. Famea, dux alius, equitatui Carthaginiensium praeerat. Scipio tunc, Scipionis Africani nepos, tribunus ibi militabat. Huius apud omnes ingens metus et reverentia erat. Nam et paratissimus ad dimicandum et	594:601	0:1234
senatus	NN	[1400,1500]	2	24_11	 	, adiecit. Ordinem quoque ipsium in provincias custodiasque divist.; Magnus etiam dignitate in Romana fuit Ecclesia. Increbrescente enim fama innocentiae, doctrinae ac prudentiae eius, a fel. rec. Gregorio Papa, praedecessore nostro, ad cardinalatus est vocatus honorem, ut eius opera in maximis ed difficillimis rebus, quae temporibus illis inciderant, uteretur, in quem Gregorius ipse ob ingentiae viri merita novo est usus exemplo. Statim enim illi Albanen. commisit Ecclesiam, quae non nisi vetustioribus cardinalibus solet committi.; Non fefellit expectationem Summi Pontificis ac sacri senatus optimus ac Deo amicissimus vir. Sed in concilio Lugdunensi praesidens omniaque ad Dei laudem dirigens, sedatis discordiis difficultatibusque sublatis, ipsi Ecclesiae maximo usui fuit et ornamento.; Quibus rebus aperte cognoscitur, quod statuit illi Dominus testamentum pacis et principem fecit eum, ut sit illi sacerdotii dignitas in aeternum, quem inanis gloria non inflavit, non divitiae sinistrorsum egerunt; sed in fide lenitateque perseverans, pius in Deum, in pauperes misericors, iustus in omnes, ita hoc corruptibile corpus exuit, ut cum Apostolo dicere posset:( II Tim.	592:599	0:1179
senatus	NN	[1700,1800]	2	24_13	 	, Aegyptum invadere conabatur. Jam navali proelio vicerat minorem Ptolemaeum, et Alexandriam obsidebat; nec procul abesse videbatur quin regno opulentissimo potiretur, Legati sordidati, barba et capillo promisso, cum ramis oleae ingressi curiam procubuerunt. Oratio fuit etiam miserabilior quam habitus. Orabant senatum ut opem regno Aegypti ferret. Moti patres legatorum precibus, extemplo legationem miserunt, cujus princeps Caius Popilius Laenas, ad bellum inter fratres componendum. Jussus est Popilius adire prius Antiochum, deinde Ptolemaeum, eisque denunciare ut bello absisterent: qui secus fecisset, eum pro hoste a senatu habitum iri. Prope Alexandriam Antiocho occurrerunt legati, quos advenientes Antiochus amice salutavit, et Popilio dextram porrexit; at Popilius suam regi noluit porrigere, sed tabellas, in quibus erat senatusconsultum, ei tradidit, atque statim legere jussit. Quibus perlectis, Antiochus dixit se, adhibitis amicis, consideraturum quid faciendum sibi esset. Indignatus Popilius, quod rex aliquam moram interponeret, virga, quam manu gerebat, regem circumscripsit; ac:; Prius, ait, quam hoc circulo excedas, da responsum, quod senatui referam.; Obstupefactus Antiochus,	625:631	0:1202
senatus	NN	[300,500]	2	24_14	 	, Alamanne, furori, Saxonis incursus cessat, Chattumque palustri alligat Albis aqua; uixque hoc ter menstrua totum luna uidet, iamque ad populos et rura feroci tenta Getae pertendit iter, qua pulsus ab aestu Oceanus refluum spargit per culta Garumnam; in flumen currente mari transcendit amarus blanda fluenta latex, fluuiique impacta per alueum salsa peregrinum sibi nauigat unda profundum. Hic iam disposito laxantes frena duello Uesorum proceres raptim suspendit ab ira rumor, succincto referens diplomate Auitum iam Geticas intrare domus positaque parumper mole magisterii legati iura subisse. Obstupuere duces pariter Scythicusque senatus et timuere suam pacem ne forte negaret. Sic rutilus Phaethonta leuem cum carperet axis, iam pallente die flagrantique excita mundo pax elementorum fureret uel sicca propinquus saeuiret per stagna uapor limusque sitiret puluereo ponti fundo, tunc unica Phoebi insuetum clemens extinxit flamma calorem. Hic aliquis tum forte Getes, dum falce recocta ictibus informat saxoque cacuminat ensem, iam promptus caluisse tubis, iam iamque frequenti caede sepulturus terram non hoste sepulto, claruit ut primum nomen uenientis Auiti, exclamat:" Periit bellum, date rursus aratra. Otia si replico priscae bene nota	636:643	0:1248
senatus	NN	[100,200]	2	24_15	 	, alterius uitiis infensus. Nam Drusus fluxioris remissiorisque uitae erat. Itaque ne mortuo quidem perinde adfectus est, sed tantum non statim a funere ad negotiorum consuetudinem rediit iustitio longiore inhibito. Quin et Iliensium legatis paulo serius consolantibus, quasi obliterata iam doloris memoria, irridens se quoque respondit uicem eorum dolere, quod egregium ciuem Hectorem amisissent. Germanico usque adeo obtrectauit, ut et praeclara facta eius pro superuacuis eleuarit et gloriosissimas uictorias ceu damnosas rei p. increparet. Quod uero Alexandream propter immensam et repentinam famem inconsulto se adisset, questus est in senatu. Etiam causa mortis fuisse ei per Cn. Pisonem legatum Syriae creditur, quem mox huius criminis reum putant quidam mandata prolaturum, nisi ea secreto ostentant[...] quae multifariam inscriptum et per noctes celeberrime adclamatum est:; Redde Germanicum!; Quam suspicionem confirmauit ipse postea coniuge etiam ac liberis Germanici crudelem in modum afflictis. Nurum Agrippinam post mariti mortem liberius quiddam questam manu apprehendit Graecoque uersu:; Si non dominaris,; inquit,; filiola, iniuriam te accipere existimas?; Nec ullo mox sermone dignatus est. Quondam uero inter	641:647	0:1228
senatus	NN	[500,600]	2	24_16	 	, ante exhibitionem testium, ante examinationem iudicii, in ipsa expositione criminum atque accusationis exordio ultore gladio feriatur. vocem enim funestam intercidi oportet potius quam audiri. maiestatis autem crimen excipimus. arcad. et honor. aa. eutychiano pp.; a d. vi id. nov. constantinopoli caesario et attico conss.; CJ.: Imperatores Honorius, Theodosius Liberti si accusatores manumissorum heredumve esse praesumpserint, eodem quo servi supplicio tenebuntur, luituri poenas ante prohibitae delationis exordium. honor. et theodos. aa. conss. praetoribus tribunis plebi senatui s. D.; a d. viii id. aug. ravennae asclepiodoto et mariniano conss.; CJ. De accusationibus et inscriptionibus. CJ.: Imperator Alexander Severus Eos qui terminos effoderunt extraordinaria animadversione coerceri debere praeses provinciae non ignorabit. alex. a. marciano.; a pp. Iii k. Aug. Alexandro a. cons.; CJ. pr.: Imperator Alexander Severus Si cuiusdam criminis obnoxius servus postulatur, dominus eum defendere potest et in iudicio sistere accusatoris intentionibus responsurum. alex. a. syro.;	579:586	0:1089
senatus	NN	[1700,1800]	2	24_18	 	, armata familia, Aventinum occupaverat. Quamobrem consul, vocato ad arma populo, Caium aggressus est qui pulsus, dum a templo Dianae desilit, talum intorsit, et cum jam a satellitibus Opimii comprehenderetur, jugulum servo praebuit, qui dominum et mox semetipsum super domini corpus interemit. Consul promiserat se pro capite Gracchi aurum repensurum esse; quare Septimuleius quidam lancea praefixum Caii caput attulit, eique aequale auri pondus persolutum est. Aiunt etiam illum prius cervice perforata, cerebroque exempto, plumbum infudisse, quo gravius efficeretur. Occiso Tiberio Graccho, cum senatus consulibus mandasset ut in eos qui cum Tiberio consenserant animadverteretur, Blosius quidam Tiberii amicus pro se deprecatum venit; hancque, ut sibi ignosceretur, causam afferebat, quod tanti Gracchum fecisset, at quidquid ille vellet, sibi faciendtim putaret. Tum consul:; Quid? ait, si te in Capitolium faces ferre vellet, obsecuturusne voluntati illius fuisses propter istam quam jactas familiaritatem?;-; Nunquam, inquit Blosius, id quidem voluisset; sed, si voluisset, paruissem.; Nefaria est ista vox; nulla enim est excusatio peccati,	598:605	0:1149
senatus	NN	[1700,1800]	2	24_19	 	, arte formatum, efficacissimisque rationibus munitum, humillime Principi obtuli. Ille, cum singulari me semper prosecutus esset favore, obstupuit ad audax adeo et stolidum inceptum, quod perniciem mihi allaturum ominabatur. Quocirca precibus a molimine isto me deterrere conatur,... precibusque minas regaliter addit. Mihi vero, freto non minus commenti utilitate, quam favore totius sexus virilis, quem causam communem non deserturum sperabam, mens immota manebat, adeo, ut nullis admonitionibus eVerari pertinacia potuerit. Hinc, secundum legem gentis, ad forum cum laqueo abstrahor, exspectaturus ibi senatus iudicium. Coacto senatu, et latis suffragiis, sententia ad Principem mittitur confirmanda, ab eoque remissa, voce praeconis enunciatur, his verbis: Habito maturo examine, iudicamus: Legem Domini Scabbae, cursoris aulici primarii, de excludendo a muneribus publicis sexu sequiore latam, perferri non posse, nisi summo cum totius reipublicae detrimento, cum dimidia pars gentis, quae e sexu muliebri constat, hanc innovationem aegerrime sit latura, ac reipublicae proinde molesta ac infensa reddatur. Porro existimamus, iniquum esse, praeclarae indolis arbores ab honoribus, quibus se dignas	605:612	0:1203
